image_id,caption,n,n_objects,n_relations,n_attributes,n_connected_components,hard_negs,x,y,width,height
2359459,outlet under table. there is a floor.,4,3,1,0,2,"{'Outlet under table. There is a floor. There is no table.', 'Outlet under table. There is a floor. There is no outlet.', 'Outlet not under table. There is a floor.', 'There is no outlet under table. There is a floor.', 'Outlet under table. . There is no floor.'}",0.0,299.0,333.0,199.0
2359467,keyboard has number pad. number pad on keyboard.,4,2,2,0,1,"{'Keyboard has number pad. Something on keyboard. There is no number pad.', 'There is no keyboard has number pad. Number pad on keyboard.', 'Keyboard not has number pad. Number pad on keyboard.', 'Keyboard has number pad. Number pad on keyboard. There is no keyboard.', 'Keyboard has number pad. Number pad not on keyboard.'}",0.0,36.0,256.0,179.0
2359467,cup has handle. there is a rim.,4,3,1,0,2,"{'Cup has handle. There is a rim. There is no cup.', 'Cup has handle. . There is no rim.', 'Cup has handle. There is a rim. There is no handle.', 'Cup not has handle. There is a rim.', 'There is no cup has handle. There is a rim.'}",305.0,13.0,192.0,228.0
2359473,fence near grass. there is a bench.,4,3,1,0,2,"{'Fence not near grass. There is a bench.', 'Fence near grass. . There is no bench.', 'Fence near grass. There is a bench. There is no fence.', 'Fence near grass. There is a bench. There are no grass.', 'There is no fence near grass. There is a bench.'}",0.0,16.0,375.0,483.0
2359475,kid has mouth. there is a eyebrow.,4,3,1,0,2,"['Kid has mouth. There is an eyebrow. There is no mouth.', 'Kid has mouth. There is an eyebrow. There is no man.', 'There is no kid has mouth. There is an eyebrow.', 'Kid not has mouth. There is an eyebrow.', 'Kid has mouth. There is an eyebrow. There is no kid.']",78.0,195.0,294.0,302.0
2359485,bread has edge. there is a pepper.,4,3,1,0,2,"['Bread has edge. There is a pepper. There is no crust.', 'Bread has edge. There is a pepper. There is no edge.', 'Bread not has edge. There is a pepper.', 'There is no bread has edge. There is a pepper.', 'Bread has edge. . There is no pepper.']",153.0,112.0,345.0,225.0
2359485,cat has eyebrow. there is a chin.,4,3,1,0,2,"{'Cat has eyebrow. There is a chin. There is no eyebrow.', 'Cat has eyebrow. . There is no chin.', 'Cat not has eyebrow. There is a chin.', 'There is no cat has eyebrow. There is a chin.', 'Cat has eyebrow. There is a chin. There is no cat.'}",0.0,1.0,276.0,278.0
2359494,picture of horse. there is a cake.,4,3,1,0,2,"{'Picture of horse. . There is no cake.', 'Picture of horse. There is a cake. There is no picture.', 'Picture of horse. There is a cake. There is no horse.', 'Picture not of horse. There is a cake.', 'There is no picture of horse. There is a cake.'}",146.0,70.0,196.0,222.0
2359496,key on computer. there is a keypad.,4,3,1,0,2,"{'Key not on computer. There is a keypad.', 'Key on computer. There is a keypad. There is no key.', 'Key on computer. There is a keypad. There is no computer.', 'There is no key on computer. There is a keypad.', 'Key on computer. . There is no keypad.'}",1.0,43.0,330.0,361.0
2359497,man wearing shoes. there is a racket.,4,3,1,0,2,"{'Man wearing shoes. There is a racket. There are no shoes.', 'Man wearing shoes. There is a racket. There is no man.', 'Man wearing shoes. . There is no racket.', 'There is no man wearing shoes. There is a racket.', 'Man not wearing shoes. There is a racket.'}",102.0,166.0,192.0,251.0
2359505,cat has ear. there is a eye.,4,3,1,0,2,"{'Cat has ear. There is an eye. There is no cat.', 'There is no cat has ear. There is an eye.', 'Cat has ear. There is an eye. There is no ear.', 'Cat has ear. . There is no eye.', 'Cat not has ear. There is an eye.'}",68.0,71.0,357.0,232.0
2359507,man on skateboard. there is a helmet.,4,3,1,0,2,"{'There is no man on skateboard. There is a helmet.', 'Man on skateboard. There is a helmet. There is no man.', 'Man not on skateboard. There is a helmet.', 'Man on skateboard. . There is no helmet.', 'Man on skateboard. There is a helmet. There is no skateboard.'}",170.0,4.0,232.0,319.0
2359509,drinking glass behind cat. there is a desk.,4,3,1,0,2,"{'There is no drinking glass behind cat. There is a desk.', 'Drinking glass behind cat. There is a desk. There is no cat.', 'Drinking glass behind cat. There is a desk. There are no drinking glass.', 'Drinking glass not behind cat. There is a desk.', 'Drinking glass behind cat. . There is no desk.'}",0.0,78.0,484.0,293.0
2359518,man on field. there is a hat.,4,3,1,0,2,"{'Man on field. . There is no hat.', 'Man not on field. There is a hat.', 'Man on field. There is a hat. There is no man.', 'There is no man on field. There is a hat.', 'Man on field. There is a hat. There is no field.'}",17.0,6.0,467.0,315.0
2359526,guy in wife beater. there is a motorcycle.,4,3,1,0,2,"{'Guy not in wife beater. There is a motorcycle.', 'Guy in wife beater. There is a motorcycle. There is no wife beater.', 'Guy in wife beater. . There is no motorcycle.', 'Guy in wife beater. There is a motorcycle. There is no guy.', 'There is no guy in wife beater. There is a motorcycle.'}",6.0,284.0,220.0,207.0
2359527,noodles under meat. there is a vegetable.,4,3,1,0,2,"{'Noodles under meat. . There is no vegetable.', 'there are no noodles under meat. There is a vegetable.', 'Noodles under meat. There is a vegetable. There are no noodles.', 'Noodles not under meat. There is a vegetable.', 'Noodles under meat. There is a vegetable. There is no meat.'}",116.0,51.0,266.0,230.0
2359528,bicycle on sidewalk. there is a row.,4,3,1,0,2,"{'There is no bicycle on sidewalk. There is a row.', 'Bicycle on sidewalk. . There is no row.', 'Bicycle on sidewalk. There is a row. There is no sidewalk.', 'Bicycle not on sidewalk. There is a row.', 'Bicycle on sidewalk. There is a row. There is no bicycle.'}",82.0,133.0,416.0,242.0
2359530,airplane on runway. there is a ground.,4,3,1,0,2,"{'Airplane on runway. There is a ground. There is no runway.', 'There is no airplane on runway. There is a ground.', 'Airplane on runway. . There is no ground.', 'Airplane not on runway. There is a ground.', 'Airplane on runway. There is a ground. There is no airplane.'}",11.0,182.0,370.0,190.0
2359537,bull's head on a merry go round. there is a horse.,4,3,1,0,2,"{""There is no bull's head on a merry-go-round. There is a horse."", ""Bull's head on something. There is a horse. There is no merry-go-round."", ""Bull's head on a merry-go-round. . There is no horse."", ""Bull's head on a merry-go-round. There is a horse. There is no bull's head."", ""Bull's head not on a merry-go-round. There is a horse.""}",11.0,2.0,487.0,373.0
2359538,clock attached building. there is a wall.,4,3,1,0,2,"{'Clock attached building. There is a wall. There is no clock.', 'Clock attached building. . There is no wall.', 'There is no clock attached building. There is a wall.', 'Clock not attached building. There is a wall.', 'Clock attached building. There is a wall. There is no building.'}",0.0,6.0,363.0,492.0
2359554,girl wearing shirt. there is a pizza.,4,3,1,0,2,"{'Girl wearing shirt. There is a pizza. There is no shirt.', 'Girl wearing shirt. There is a pizza. There is no girl.', 'Girl wearing shirt. . There is no pizza.', 'Girl not wearing shirt. There is a pizza.', 'There is no girl wearing shirt. There is a pizza.'}",166.0,0.0,238.0,319.0
2359554,girl wearing shirt. there is a jeans.,4,3,1,0,2,"{'Girl wearing shirt. there are a jeans. There is no shirt.', 'Girl wearing shirt. . There are no jeans.', 'There is no girl wearing shirt. there are a jeans.', 'Girl wearing shirt. there are a jeans. There is no girl.', 'Girl not wearing shirt. there are a jeans.'}",242.0,0.0,256.0,373.0
2359560,soup and sandwich plate. there is a cup.,4,3,1,0,2,"['Soup and sandwich plate. There is a cup. There is no soup.', 'Soup and sandwich plate. There is a cup. There is no another bowl.', 'Soup and sandwich plate. There is a cup. There is no plate.', 'Soup and sandwich plate. . There is no cup.', 'There is no soup and sandwich plate. There is a cup.']",19.0,22.0,290.0,394.0
2359560,shadow of person. there is a at table.,4,3,1,0,2,"['Shadow of person. There is an at table. There is no on the table.', 'Shadow not of person. There is an at table.', 'Shadow of person. There is an at table. There is no shadow.', 'Shadow of person. There is an at table. There is no person.', 'Shadow of person. There is an at table. There is no table.']",2.0,1.0,361.0,214.0
2359565,legs wearing shoes. there is a bench.,4,3,1,0,2,"{'Legs wearing shoes. There is a bench. There are no shoes.', 'there are no legs wearing shoes. There is a bench.', 'Legs not wearing shoes. There is a bench.', 'Legs wearing shoes. There is a bench. There are no legs.', 'Legs wearing shoes. . There is no bench.'}",19.0,0.0,442.0,230.0
2359567,girl wearing glasses. there is a pizza.,4,3,1,0,2,"{'Girl wearing glasses. There is a pizza. There are no glasses.', 'There is no girl wearing glasses. There is a pizza.', 'Girl wearing glasses. . There is no pizza.', 'Girl not wearing glasses. There is a pizza.', 'Girl wearing glasses. There is a pizza. There is no girl.'}",50.0,21.0,334.0,252.0
2359569,bicycle has frame. there is a seat.,4,3,1,0,2,"{'There is no bicycle has frame. There is a seat.', 'Bicycle has frame. . There is no seat.', 'Bicycle has frame. There is a seat. There is no frame.', 'Bicycle has frame. There is a seat. There is no bicycle.', 'Bicycle not has frame. There is a seat.'}",27.0,18.0,416.0,307.0
2359574,helmet of man. there is a handlebar.,4,3,1,0,2,"{'Helmet of man. There is a handlebar. There is no helmet.', 'Helmet not of man. There is a handlebar.', 'There is no helmet of man. There is a handlebar.', 'Helmet of man. There is a handlebar. There is no man.', 'Helmet of man. . There is no handlebar.'}",109.0,66.0,259.0,175.0
2359580,bus has front. there is a road.,4,3,1,0,2,"{'Bus has front. There is a road. There are no buses.', 'Bus not has front. There is a road.', 'There is no bus has front. There is a road.', 'Bus has front. . There is no road.', 'Bus has front. There is a road. There is no front.'}",208.0,91.0,277.0,283.0
2359584,man in water. there is a wave.,4,3,1,0,2,"{'Man not in water. There is a wave.', 'Man in water. . There is no wave.', 'Man in water. There is a wave. There is no man.', 'Man in water. There is a wave. There is no water.', 'There is no man in water. There is a wave.'}",1.0,3.0,498.0,329.0
2359589,baby horse standing next to horse. there is a field.,4,3,1,0,2,"{'Baby horse not standing next to horse. There is a field.', 'Baby horse standing next to horse. There is a field. There is no baby horse.', 'Baby horse standing next to horse. . There is no field.', 'Baby something standing next to horse. There is a field. There is no horse.', 'There is no baby horse standing next to horse. There is a field.'}",0.0,0.0,499.0,330.0
2359591,flag attached to pickup truck. there is a truck window.,4,3,1,0,2,"{'Flag not attached to pickup truck. There is a truck window.', 'Flag attached to pickup truck. There is a truck window. There is no pickup truck.', 'There is no flag attached to pickup truck. There is a truck window.', 'Flag attached to pickup truck. There is a truck window. There is no flag.', 'Flag attached to pickup truck. There is a truck window. There is no truck window.'}",62.0,160.0,349.0,213.0
2359603,man playing tennis. there is a foreground.,4,3,1,0,2,"{'Man playing tennis. There is a foreground. There is no man.', 'Man playing tennis. . There is no foreground.', 'Man playing tennis. There is a foreground. There are no tennis.', 'There is no man playing tennis. There is a foreground.', 'Man not playing tennis. There is a foreground.'}",235.0,9.0,253.0,321.0
2359603,man on a court. there is a shoes.,4,3,1,0,2,"{'Man on a court. . There are no shoes.', 'Man on something. there are a shoes. There is no court.', 'There is no man on a court. there are a shoes.', 'Man not on a court. there are a shoes.', 'Man on a court. there are a shoes. There is no man.'}",140.0,9.0,279.0,270.0
2359605,kite in sky. there is a air.,4,3,1,0,2,"{'There is no kite in sky. There is an air.', 'Kite in sky. . There is no air.', 'Kite in sky. There is an air. There is no kite.', 'Kite not in sky. There is an air.', 'Kite in sky. There is an air. There is no sky.'}",1.0,2.0,497.0,370.0
2359608,man part of a group. there is a shorts.,4,3,1,0,2,"{'Man part of something. there are a shorts. There is no group.', 'There is no man part of a group. there are a shorts.', 'Man not part of a group. there are a shorts.', 'Man part of a group. . There are no shorts.', 'Man part of a group. there are a shorts. There is no man.'}",18.0,4.0,473.0,413.0
2359628,photo of man. there is a table.,4,3,1,0,2,"{'Photo of man. . There is no table.', 'Photo not of man. There is a table.', 'There is no photo of man. There is a table.', 'Photo of man. There is a table. There is no photo.', 'Photo of man. There is a table. There is no man.'}",0.0,93.0,374.0,405.0
2359639,board under woman. there is a floor.,4,3,1,0,2,"{'Board under woman. There is a floor. There is no board.', 'Board under woman. . There is no floor.', 'Board under woman. There is a floor. There is no woman.', 'There is no board under woman. There is a floor.', 'Board not under woman. There is a floor.'}",102.0,37.0,376.0,323.0
2359643,zebra in enclosure. there is a ear.,4,3,1,0,2,"{'Zebra in enclosure. There is an ear. There is no zebra.', 'Zebra in enclosure. . There is no ear.', 'There is no zebra in enclosure. There is an ear.', 'Zebra in enclosure. There is an ear. There is no enclosure.', 'Zebra not in enclosure. There is an ear.'}",12.0,64.0,485.0,257.0
2359660,person end of alley. there is a umbrella.,4,3,1,0,2,"{'Person not end of alley. There is an umbrella.', 'There is no person end of alley. There is an umbrella.', 'Person end of alley. There is an umbrella. There is no person.', 'Person end of alley. There is an umbrella. There is no alley.', 'Person end of alley. . There is no umbrella.'}",20.0,11.0,466.0,327.0
2359664,aircraft has wing. there is a sky.,4,3,1,0,2,"{'There is no aircraft has wing. There is a sky.', 'Aircraft has wing. There is a sky. There is no wing.', 'Aircraft not has wing. There is a sky.', 'Aircraft has wing. There is a sky. There are no aircraft.', 'Aircraft has wing. . There is no sky.'}",50.0,53.0,334.0,321.0
2359665,wing on airplane. there is a plane.,4,3,1,0,2,"{'Wing on airplane. There is a plane. There is no airplane.', 'Wing not on airplane. There is a plane.', 'Wing on airplane. . There is no plane.', 'Wing on airplane. There is a plane. There is no wing.', 'There is no wing on airplane. There is a plane.'}",35.0,77.0,278.0,362.0
2359677,reflection in window. there is a clock.,4,3,1,0,2,"{'Reflection in window. There is a clock. There is no window.', 'Reflection not in window. There is a clock.', 'There is no reflection in window. There is a clock.', 'Reflection in window. There is a clock. There is no reflection.', 'Reflection in window. . There is no clock.'}",11.0,45.0,460.0,435.0
2359680,guy riding board. there is a ramp.,4,3,1,0,2,"{'There is no guy riding board. There is a ramp.', 'Guy not riding board. There is a ramp.', 'Guy riding board. . There is no ramp.', 'Guy riding board. There is a ramp. There is no board.', 'Guy riding board. There is a ramp. There is no guy.'}",171.0,61.0,182.0,271.0
2359688,building beside road. there is a street.,4,3,1,0,2,"{'There is no building beside road. There is a street.', 'Building not beside road. There is a street.', 'Building beside road. . There is no street.', 'Building beside road. There is a street. There is no road.', 'Building beside road. There is a street. There is no building.'}",17.0,1.0,481.0,296.0
2359691,kite has head. there is a ground.,4,3,1,0,2,"{'Kite not has head. There is a ground.', 'There is no kite has head. There is a ground.', 'Kite has head. There is a ground. There is no kite.', 'Kite has head. . There is no ground.', 'Kite has head. There is a ground. There is no head.'}",17.0,25.0,464.0,346.0
2359697,handle on baking pan. there is a pot.,4,3,1,0,2,"{'Handle not on baking pan. There is a pot.', 'There is no handle on baking pan. There is a pot.', 'Handle on baking pan. There is a pot. There is no handle.', 'Handle on baking pan. There is a pot. There is no baking pan.', 'Handle on baking pan. . There is no pot.'}",53.0,57.0,412.0,317.0
2359697,pie on counter. there is a pan.,4,3,1,0,2,"{'Pie on counter. There is a pan. There is no counter.', 'Pie on counter. There is a pan. There is no pie.', 'Pie on counter. . There is no pan.', 'There is no pie on counter. There is a pan.', 'Pie not on counter. There is a pan.'}",0.0,0.0,280.0,210.0
2359713,table with dish. there is a glass.,4,3,1,0,2,"{'Table with dish. There is a glass. There is no table.', 'Table not with dish. There is a glass.', 'Table with dish. There is a glass. There is no dish.', 'There is no table with dish. There is a glass.', 'Table with dish. . There are no glass.'}",2.0,147.0,378.0,226.0
2359724,elephant has ear. there is a tusk.,4,3,1,0,2,"{'There is no elephant has ear. There is a tusk.', 'Elephant has ear. There is a tusk. There is no elephant.', 'Elephant not has ear. There is a tusk.', 'Elephant has ear. There is a tusk. There is no ear.', 'Elephant has ear. . There is no tusk.'}",177.0,60.0,198.0,230.0
2359725,frame over light. there is a cat.,4,3,1,0,2,"{'Frame not over light. There is a cat.', 'There is no frame over light. There is a cat.', 'Frame over light. . There is no cat.', 'Frame over light. There is a cat. There is no frame.', 'Frame over light. There is a cat. There is no light.'}",0.0,24.0,396.0,238.0
2359726,cat has whiskers. there is a face.,4,3,1,0,2,"{'Cat has whiskers. . There is no face.', 'There is no cat has whiskers. There is a face.', 'Cat has whiskers. There is a face. There are no whiskers.', 'Cat not has whiskers. There is a face.', 'Cat has whiskers. There is a face. There is no cat.'}",12.0,4.0,487.0,297.0
2359729,person has head. there is a horse.,4,3,1,0,2,"{'There is no person has head. There is a horse.', 'Person has head. There is a horse. There is no head.', 'Person has head. There is a horse. There is no person.', 'Person not has head. There is a horse.', 'Person has head. . There is no horse.'}",2.0,47.0,487.0,315.0
2359741,man standing on snow. there is a coat.,4,3,1,0,2,"{'Man standing on snow. There is a coat. There is no man.', 'Man standing on snow. . There is no coat.', 'There is no man standing on snow. There is a coat.', 'Man standing on snow. There is a coat. There is no snow.', 'Man not standing on snow. There is a coat.'}",1.0,55.0,493.0,442.0
2359743,panda on bench. there is a backpack.,4,3,1,0,2,"['Panda on bench. . There is no backpack.', 'Panda on bench. There is a backpack. There is no panda and statue.', 'There is no panda on bench. There is a backpack.', 'Panda not on bench. There is a backpack.', 'Panda on bench. There is a backpack. There is no bench.']",0.0,51.0,499.0,323.0
2359756,grass by horse. there is a mountains.,4,3,1,0,2,"{'Grass by horse. . There are no mountains.', 'Grass by horse. there are a mountains. There are no grass.', 'Grass by horse. there are a mountains. There is no horse.', 'There is no grass by horse. there are a mountains.', 'Grass not by horse. there are a mountains.'}",49.0,45.0,268.0,352.0
2359758,tree beside hydrant. there is a leaves.,4,3,1,0,2,"['Tree beside hydrant. there are a leaves.', 'There is no tree beside hydrant. there are a leaves.', 'Tree beside hydrant. there are a leaves. There is no hydrant.', 'Tree beside hydrant. there are a leaves. There is no tree.', 'Tree not beside hydrant. there are a leaves.']",0.0,1.0,279.0,292.0
2359769,giraffe standing by wood. there is a branches.,4,3,1,0,2,"{'Giraffe not standing by wood. there are a branches.', 'Giraffe standing by wood. . There are no branches.', 'Giraffe standing by wood. there are a branches. There is no giraffe.', 'There is no giraffe standing by wood. there are a branches.', 'Giraffe standing by wood. there are a branches. There is no wood.'}",2.0,66.0,395.0,228.0
2359770,kid wearing shoe. there is a hydrant.,4,3,1,0,2,"['Kid wearing shoe. There is a hydrant. There is no shoe.', 'Kid wearing shoe. There is a hydrant. There is no kid.', 'Kid wearing shoe. There is a hydrant.', 'There is no kid wearing shoe. There is a hydrant.', 'Kid not wearing shoe. There is a hydrant.']",85.0,0.0,261.0,321.0
2359773,kite with face design. there is a sky.,4,3,1,0,2,"{'Kite not with face design. There is a sky.', 'Kite with face design. There is a sky. There is no face design.', 'Kite with face design. There is a sky. There is no kite.', 'Kite with face design. . There is no sky.', 'There is no kite with face design. There is a sky.'}",36.0,1.0,427.0,218.0
2359790,bird has wing. there is a limbs.,4,3,1,0,2,"{'Bird not has wing. there are a limbs.', 'Bird has wing. there are a limbs. There is no bird.', 'Bird has wing. there are a limbs. There is no wing.', 'Bird has wing. . There are no limbs.', 'There is no bird has wing. there are a limbs.'}",1.0,14.0,323.0,213.0
2359790,bird has beek. there is a branch.,4,3,1,0,2,"{'Bird has been. There is a branch. There is no bird.', 'Bird has been. There is a branch. There is no been.', 'Bird has been. . There is no branch.', 'Bird not has been. There is a branch.', 'There is no bird has been. There is a branch.'}",136.0,87.0,201.0,242.0
2359799,cat has mouth. there is a head.,4,3,1,0,2,"{'Cat has mouth. There is a head. There is no cat.', 'Cat has mouth. . There is no head.', 'There is no cat has mouth. There is a head.', 'Cat not has mouth. There is a head.', 'Cat has mouth. There is a head. There is no mouth.'}",20.0,110.0,463.0,296.0
2359801,tree behind lady. there is a shade.,4,3,1,0,2,"{'Tree behind lady. There is a shade. There is no tree.', 'Tree behind lady. . There is no shade.', 'Tree behind lady. There is a shade. There is no lady.', 'There is no tree behind lady. There is a shade.', 'Tree not behind lady. There is a shade.'}",2.0,6.0,389.0,488.0
2359807,part of muffin. there is a blurry.,4,3,1,0,2,"{'Part of muffin. . There is no blurry.', 'Part not of muffin. There is a blurry.', 'There is no part of muffin. There is a blurry.', 'Part of muffin. There is a blurry. There is no muffin.', 'Part of muffin. There is a blurry. There is no part.'}",1.0,196.0,457.0,302.0
2359807,cupcake in paper wrapper. there is a showing.,4,3,1,0,2,"{'Cupcake in paper wrapper. . There is no showing.', 'Cupcake in paper wrapper. There is a showing. There is no cupcake.', 'There is no cupcake in paper wrapper. There is a showing.', 'Cupcake not in paper wrapper. There is a showing.', 'Cupcake in paper wrapper. There is a showing. There is no paper wrapper.'}",12.0,20.0,225.0,313.0
2359832,man wearing tie. there is a watch.,4,3,1,0,2,"{'Man wearing tie. There is a watch. There is no man.', 'Man wearing tie. There is a watch. There is no tie.', 'Man wearing tie. . There is no watch.', 'Man not wearing tie. There is a watch.', 'There is no man wearing tie. There is a watch.'}",56.0,51.0,308.0,359.0
2359838,playstation on bus. there is a picture.,4,3,1,0,2,"{'Playstation on bus. There is a picture. There are no buses.', 'Playstation on bus. . There is no picture.', 'Playstation not on bus. There is a picture.', 'There is no PlayStation on bus. There is a picture.', 'Playstation on bus. There is a picture. There is no PlayStation.'}",2.0,4.0,495.0,313.0
2359843,animal grazing in field. there is a meadow.,4,3,1,0,2,"{'Animal grazing in field. There is a meadow. There is no animal.', 'Animal grazing in field. There is a meadow. There is no field.', 'There is no animal grazing in field. There is a meadow.', 'Animal grazing in field. . There is no meadow.', 'Animal not grazing in field. There is a meadow.'}",0.0,117.0,498.0,342.0
2359871,bird perched on branch. there is a tree.,4,3,1,0,2,"{'Bird perched on branch. There is a tree. There is no branch.', 'There is no bird perched on branch. There is a tree.', 'Bird perched on branch. . There is no tree.', 'Bird perched on branch. There is a tree. There is no bird.', 'Bird not perched on branch. There is a tree.'}",0.0,1.0,497.0,373.0
2359877,carrot in blender. there is a bowl.,4,3,1,0,2,"{'Carrot not in blender. There is a bowl.', 'There is no carrot in blender. There is a bowl.', 'Carrot in blender. . There is no bowl.', 'Carrot in blender. There is a bowl. There is no blender.', 'Carrot in blender. There is a bowl. There is no carrot.'}",0.0,0.0,477.0,372.0
2359881,man wearing jeans. there is a chair.,4,3,1,0,2,"{'Man wearing jeans. There is a chair. There is no man.', 'Man wearing jeans. There is a chair. There are no jeans.', 'Man wearing jeans. . There is no chair.', 'Man not wearing jeans. There is a chair.', 'There is no man wearing jeans. There is a chair.'}",70.0,64.0,231.0,309.0
2359893,snow along front of banner. there is a ground.,4,3,1,0,2,"{'Snow not along front of banner. There is a ground.', 'Snow along front of banner. . There is no ground.', 'There is no snow along front of banner. There is a ground.', 'Snow along front of banner. There is a ground. There is no banner.', 'Snow along front of banner. There is a ground. There is no snow.'}",0.0,0.0,332.0,499.0
2359896,animal has ear. there is a nose.,4,3,1,0,2,"{'Animal has ear. There is a nose. There is no ear.', 'Animal has ear. . There is no nose.', 'Animal not has ear. There is a nose.', 'Animal has ear. There is a nose. There is no animal.', 'There is no animal has ear. There is a nose.'}",104.0,28.0,395.0,302.0
