image_id,caption,n,n_objects,n_relations,n_attributes,n_connected_components,hard_negs,x,y,width,height
2362052,sink near toilet. there is a wall.,4,3,1,0,2,"{'Sink near toilet. There is a wall. There is no toilet.', 'Sink near toilet. There is a wall. There is no sink.', 'Sink not near toilet. There is a wall.', 'There is no sink near toilet. There is a wall.', 'Sink near toilet. . There is no wall.'}",0.0,1.0,266.0,374.0
2362068,lady holding racket. there is a leg.,4,3,1,0,2,"{'Lady holding racket. There is a leg. There is no lady.', 'Lady holding racket. There is a leg. There is no racket.', 'There is no lady holding racket. There is a leg.', 'Lady not holding racket. There is a leg.', 'Lady holding racket. . There is no leg.'}",60.0,94.0,251.0,346.0
2362071,mirror on side. there is a car.,4,3,1,0,2,"{'Mirror on side. There is a car. There is no mirror.', 'Mirror on side. . There is no car.', 'There is no mirror on side. There is a car.', 'Mirror on side. There is a car. There is no side.', 'Mirror not on side. There is a car.'}",188.0,12.0,306.0,230.0
2362108,woman taking cellphone. there is a phone.,4,3,1,0,2,"{'Woman taking cellphone. . There is no phone.', 'There is no woman taking cellphone. There is a phone.', 'Woman taking cellphone. There is a phone. There is no cellphone.', 'Woman not taking cellphone. There is a phone.', 'Woman taking cellphone. There is a phone. There is no woman.'}",95.0,59.0,252.0,315.0
2362110,zebras in fence. there is a zoo.,4,3,1,0,2,"{'There is no zebras in fence. There is a zoo.', 'Zebras not in fence. There is a zoo.', 'Zebras in fence. . There is no zoo.', 'Zebras in fence. There is a zoo. There are no zebras.', 'Zebras in fence. There is a zoo. There is no fence.'}",0.0,3.0,498.0,367.0
2362170,elephants in zoo. there is a hay.,4,3,1,0,2,"{'Elephants in zoo. There is a hay. There is no zoo.', 'Elephants in zoo. . There is no hay.', 'Elephants not in zoo. There is a hay.', 'Elephants in zoo. There is a hay. There are no elephants.', 'there are no elephants in zoo. There is a hay.'}",2.0,0.0,494.0,331.0
2362174,engine of plane. there is a train.,4,3,1,0,2,"{'Engine of plane. There is a train. There is no plane.', 'Engine of plane. There is a train. There is no engine.', 'Engine of plane. . There is no train.', 'Engine not of plane. There is a train.', 'There is no engine of plane. There is a train.'}",33.0,90.0,389.0,195.0
2362245,napkin on table. there is another table.,4,3,1,0,2,"{'There is no napkin on table. There is another table.', 'Napkin on table. There is another table. There is no napkin.', 'Napkin not on table. There is another table.', 'Napkin on table. There is another table. There is no table.', ' That are not napkin on table. There is another table.'}",0.0,0.0,498.0,498.0
2362256,horse walking on grass. there is a eye.,4,3,1,0,2,"{'Horse not walking on grass. There is an eye.', 'Horse walking on grass. There is an eye. There is no horse.', 'There is no horse walking on grass. There is an eye.', 'Horse walking on grass. . There is no eye.', 'Horse walking on grass. There is an eye. There are no grass.'}",40.0,163.0,277.0,312.0
2362259,building made of brick. there is a sidewalk.,4,3,1,0,2,"{'Building made of brick. There is a sidewalk. There is no building.', 'Building made of brick. There is a sidewalk. There is no brick.', 'Building made of brick. . There is no sidewalk.', 'Building not made of brick. There is a sidewalk.', 'There is no building made of brick. There is a sidewalk.'}",1.0,2.0,404.0,478.0
2362278,bushes in front of stop sign. there is a branches.,4,3,1,0,2,"{'Bushes in front of stop sign. . There are no branches.', 'there are no bushes in front of stop sign. there are a branches.', 'Bushes in front of stop sign. there are a branches. There are no bushes.', 'Bushes not in front of stop sign. there are a branches.', 'Bushes in front of stop sign. there are a branches. There is no stop sign.'}",1.0,77.0,480.0,244.0
2362279,man with hair. there is a camera.,4,3,1,0,2,"{'Man with hair. There is a camera. There is no hair.', 'Man with hair. . There is no camera.', 'Man not with hair. There is a camera.', 'There is no man with hair. There is a camera.', 'Man with hair. There is a camera. There is no man.'}",241.0,7.0,255.0,292.0
2362281,woman has hair. there is a kitchen.,4,3,1,0,2,"{'Woman has hair. There is a kitchen. There is no woman.', 'Woman has hair. . There is no kitchen.', 'Woman not has hair. There is a kitchen.', 'There is no woman has hair. There is a kitchen.', 'Woman has hair. There is a kitchen. There is no hair.'}",0.0,4.0,496.0,371.0
2362287,timer on grill. there is a oven.,4,3,1,0,2,"{'Timer on grill. There is an oven. There is no grill.', 'Timer on grill. . There is no oven.', 'Timer on grill. There is an oven. There is no timer.', 'There is no timer on grill. There is an oven.', 'Timer not on grill. There is an oven.'}",12.0,30.0,486.0,267.0
2362302,bagel on top of burger. there is a plate.,4,3,1,0,2,"{'Bagel on top of burger. There is a plate. There is no bagel.', 'Bagel on top of burger. There is a plate. There is no burger.', 'There is no bagel on top of burger. There is a plate.', 'Bagel not on top of burger. There is a plate.', 'Bagel on top of burger. . There is no plate.'}",40.0,15.0,458.0,355.0
2362304,logo on shoes. there is a arrow.,4,3,1,0,2,"{'Logo on shoes. There is an arrow. There are no shoes.', 'Logo not on shoes. There is an arrow.', 'There is no logo on shoes. There is an arrow.', 'Logo on shoes. There is an arrow. There is no logo.', 'Logo on shoes. . There is no arrow.'}",152.0,0.0,239.0,264.0
2362306,shadow behind cat. there is a table.,4,3,1,0,2,"{'There is no shadow behind cat. There is a table.', 'Shadow behind cat. There is a table. There is no shadow.', 'Shadow behind cat. There is a table. There is no cat.', 'Shadow not behind cat. There is a table.', 'Shadow behind cat. . There is no table.'}",49.0,53.0,450.0,319.0
2362322,widow of buildig. there is a buidig.,4,3,1,0,2,"{'Widow of building. There is a building. There is no building.', 'Widow not of building. There is a building.', 'There is no widow of building. There is a building.', 'Widow of building. . There is no building.', 'Widow of building. There is a building. There is no widow.'}",142.0,0.0,357.0,204.0
2362330,hydrant has bolt. there is a metal bolts.,4,3,1,0,2,"['Hydrant has bolt. There is a metal bolt. There is no bolt.', 'A that is not hydrant has bolt. There is a metal bolt.', 'Hydrant has bolt. There is a metal bolt. There is no hydrant.', 'Hydrant not has bolt. There is a metal bolt.', 'Hydrant has bolt. . There are no metal bolts.']",75.0,17.0,218.0,249.0
2362357,man sitting behind bag. there is a cigarette.,4,3,1,0,2,"{'Man sitting behind bag. There is a cigarette. There is no man.', 'Man not sitting behind bag. There is a cigarette.', 'Man sitting behind bag. There is a cigarette. There is no bag.', 'There is no man sitting behind bag. There is a cigarette.', 'Man sitting behind bag. . There is no cigarette.'}",253.0,80.0,239.0,416.0
2362385,cat on sheet. there is a hat.,4,3,1,0,2,"{'Cat on sheet. There is a hat. There is no sheet.', 'Cat not on sheet. There is a hat.', 'Cat on sheet. There is a hat. There is no cat.', 'There is no cat on sheet. There is a hat.', 'Cat on sheet. . There is no hat.'}",46.0,37.0,233.0,272.0
2362388,string holding kite. there is a hand.,4,3,1,0,2,"{'String holding kite. There is a hand. There is no string.', 'There is no string holding kite. There is a hand.', 'String not holding kite. There is a hand.', 'String holding kite. There is a hand. There is no kite.', 'String holding kite. . There is no hand.'}",222.0,4.0,259.0,291.0
2362389,giraffe in field. there is a neck.,4,3,1,0,2,"{'Giraffe in field. There is a neck. There is no field.', 'Giraffe not in field. There is a neck.', 'There is no giraffe in field. There is a neck.', 'Giraffe in field. . There is no neck.', 'Giraffe in field. There is a neck. There is no giraffe.'}",261.0,126.0,220.0,212.0
2362437,food signs describing items. there is a menu.,4,3,1,0,2,"{'There is no food signs describing items. There is a menu.', 'Food signs not describing items. There is a menu.', 'Food signs describing items. . There is no menu.', 'Food signs describing items. There is a menu. There are no food signs.', 'Food signs describing items. There is a menu. There are no items.'}",42.0,15.0,440.0,257.0
2362447,man talking into microphone. there is a coat.,4,3,1,0,2,"{'Man talking into microphone. There is a coat. There is no microphone.', 'Man not talking into microphone. There is a coat.', 'Man talking into microphone. There is a coat. There is no man.', 'There is no man talking into microphone. There is a coat.', 'Man talking into microphone. . There is no coat.'}",4.0,19.0,373.0,246.0
2362451,sheep has legs. there is a tail.,4,3,1,0,2,"{'Sheep has legs. There is a tail. There are no legs.', 'Sheep has legs. . There is no tail.', 'There is no sheep has legs. There is a tail.', 'Sheep not has legs. There is a tail.', 'Sheep has legs. There is a tail. There are no sheep.'}",164.0,117.0,226.0,177.0
2362458,man on horse. there is a shoes.,4,3,1,0,2,"{'Man on horse. there are a shoes. There is no horse.', 'Man not on horse. there are a shoes.', 'There is no man on horse. there are a shoes.', 'Man on horse. . There are no shoes.', 'Man on horse. there are a shoes. There is no man.'}",74.0,21.0,242.0,363.0
2362460,pole beside tower. there is a ground.,4,3,1,0,2,"{'There is no pole beside tower. There is a ground.', 'Pole beside tower. There is a ground. There is no tower.', 'Pole not beside tower. There is a ground.', 'Pole beside tower. . There is no ground.', 'Pole beside tower. There is a ground. There is no pole.'}",2.0,18.0,372.0,480.0
2362473,tongue sticking out of mouth. there is a dog.,4,3,1,0,2,"{'Tongue sticking out of mouth. There is a dog. There is no tongue.', 'Tongue sticking out of mouth. There is a dog. There is no mouth.', 'There is no tongue sticking out of mouth. There is a dog.', 'Tongue not sticking out of mouth. There is a dog.', 'Tongue sticking out of mouth. . There is no dog.'}",167.0,167.0,254.0,186.0
2362476,man wears neck tie. there is a pants.,4,3,1,0,2,"{'Man wears neck tie. . There are no pants.', 'There is no man wears neck tie. there are a pants.', 'Man wears neck tie. there are a pants. There is no man.', 'Man not wears neck tie. there are a pants.', 'Man wears neck tie. there are a pants. There is no neck tie.'}",2.0,2.0,430.0,330.0
2362482,bird on pot. there is a wings.,4,3,1,0,2,"{'Bird on pot. there are a wings. There is no pot.', 'Bird on pot. there are a wings. There is no bird.', 'Bird on pot. . There are no wings.', 'Bird not on pot. there are a wings.', 'There is no bird on pot. there are a wings.'}",70.0,86.0,218.0,324.0
2362487,clouds in sky. there is a peaks.,4,3,1,0,2,"{'Clouds in sky. . There are no peaks.', 'Clouds in sky. there are a peaks. There is no sky.', 'Clouds in sky. there are a peaks. There are no clouds.', 'there are no clouds in sky. there are a peaks.', 'Clouds not in sky. there are a peaks.'}",1.0,2.0,309.0,198.0
2362535,woman holding bag. there is a pants.,4,3,1,0,2,"{'There is no woman holding bag. there are a pants.', 'Woman holding bag. there are a pants. There is no woman.', 'Woman holding bag. there are a pants. There is no bag.', 'Woman not holding bag. there are a pants.', 'Woman holding bag. . There are no pants.'}",0.0,125.0,258.0,196.0
2362549,cat has face. face on cat.,4,2,2,0,1,"{'Cat has face. Face on cat. There is no cat.', 'Cat has face. Something on cat. There is no face.', 'There is no cat has face. Face on cat.', 'Cat has face. Face not on cat.', 'Cat not has face. Face on cat.'}",65.0,32.0,347.0,252.0
2362555,lamp on table. there is a wall.,4,3,1,0,2,"{'Lamp on table. . There is no wall.', 'There is no lamp on table. There is a wall.', 'Lamp not on table. There is a wall.', 'Lamp on table. There is a wall. There is no table.', 'Lamp on table. There is a wall. There is no lamp.'}",2.0,1.0,497.0,284.0
2362577,conveyor behind conveyor. there is a man. there is a hat.,4,3,1,0,3,"['There is no conveyor behind conveyor. There is a man. There is a hat.', 'Conveyor behind conveyor. . There is a hat. There is no man.', 'Conveyor not behind conveyor. There is a man. There is a hat.', 'Conveyor behind conveyor. There is a man. There is a hat. There is no conveyor.', 'Conveyor behind conveyor. There is a man. There is a hat. There are no glasses.']",15.0,56.0,484.0,252.0
2362581,batter are playing on field. there is a bat.,4,3,1,0,2,"{'Batter are playing on field. There is a bat. There is no batter.', 'There is no batter are playing on field. There is a bat.', 'Batter not are playing on field. There is a bat.', 'Batter are playing on field. There is a bat. There is no field.', 'Batter are playing on field. . There is no bat.'}",207.0,114.0,285.0,213.0
2362585,clock has numbers. there is a church.,4,3,1,0,2,"{'Clock has numbers. There is a church. There is no clock.', 'Clock not has numbers. There is a church.', 'Clock has numbers. . There is no church.', 'Clock has numbers. There is a church. There are no numbers.', 'There is no clock has numbers. There is a church.'}",0.0,0.0,325.0,332.0
2362592,chocolate on spatula. there is a paper plate.,4,3,1,0,2,"{'Chocolate on spatula. There is a paper plate. There is no spatula.', 'Chocolate not on spatula. There is a paper plate.', 'Chocolate on spatula. . There is no paper plate.', 'Chocolate on spatula. There is a paper plate. There is no chocolate.', 'There is no chocolate on spatula. There is a paper plate.'}",222.0,79.0,277.0,175.0
2362603,knife has handle. there is a carrot.,4,3,1,0,2,"{'There is no knife has handle. There is a carrot.', 'Knife not has handle. There is a carrot.', 'Knife has handle. There is a carrot. There is no handle.', 'Knife has handle. . There is no carrot.', 'Knife has handle. There is a carrot. There is no knife.'}",152.0,78.0,327.0,230.0
2362611,arrow on sign. sign has arrow.,4,2,2,0,1,"{'There is no arrow on sign. Sign has arrow.', 'Arrow on sign. Sign not has arrow.', 'Arrow not on sign. Sign has arrow.', 'Arrow on sign. Sign has arrow. There is no arrow.', 'Arrow on sign. Something has arrowed. There is no sign.'}",142.0,113.0,195.0,240.0
2362642,teddy bear behind snowglobe. there is a sheet.,4,3,1,0,2,"{'There is no teddy bear behind snow globe. There is a sheet.', 'Teddy bear behind snow globe. . There is no sheet.', 'Teddy bear behind snow globe. There is a sheet. There is no snow globe.', 'Teddy bear not behind snow globe. There is a sheet.', 'Teddy bear behind snow globe. There is a sheet. There is no teddy bear.'}",5.0,90.0,326.0,406.0
2362657,pen with lid. there is a bats.,4,3,1,0,2,"{'Pen with lid. there are a bats. There is no pen.', 'Pen with lid. there are a bats. There is no lid.', 'There is no pen with lid. there are a bats.', 'Pen not with lid. there are a bats.', 'Pen with lid. . There are no bats.'}",5.0,29.0,489.0,297.0
2362660,bell in building. there is a tower.,4,3,1,0,2,"{'Bell in building. There is a tower. There is no building.', 'Bell in building. . There is no tower.', 'Bell in building. There is a tower. There is no bell.', 'There is no bell in building. There is a tower.', 'Bell not in building. There is a tower.'}",0.0,57.0,484.0,275.0
2362676,window next to bed. there is a shade.,4,3,1,0,2,"{'Window next to bed. There is a shade. There is no window.', 'Window not next to bed. There is a shade.', 'Window next to bed. There is a shade. There is no bed.', 'Window next to bed. . There is no shade.', 'There is no window next to bed. There is a shade.'}",7.0,2.0,197.0,219.0
2362684,numbers on subway. there is a background.,4,3,1,0,2,"{'Numbers not on subway. There is a background.', 'Numbers on subway. There is a background. There are no numbers.', 'Numbers on subway. There is a background. There is no subway.', 'there are no numbers on subway. There is a background.', 'Numbers on subway. . There is no background.'}",126.0,87.0,199.0,212.0
2362688,manhole cover on gound. gound has a manhole cover.,4,2,2,0,1,"['Manhole cover on found. Gound has a manhole cover. There is no manhole cover.', 'There is no manhole cover on found. Gound has a manhole cover.', 'Manhole cover on found. Gound not has a manhole cover.', 'Manhole cover on found. Something has a manhole cover. There is no found.', 'Manhole cover on found. Gound has a manhole cover. There is no round disc.']",205.0,318.0,294.0,161.0
2362691,roof over platform. there is a walkway.,4,3,1,0,2,"{'Roof over platform. There is a walkway. There is no platform.', 'Roof over platform. . There is no walkway.', 'There is no roof over platform. There is a walkway.', 'Roof not over platform. There is a walkway.', 'Roof over platform. There is a walkway. There is no roof.'}",0.0,156.0,269.0,175.0
2362702,stove has handles. handles on stove.,4,2,2,0,1,"{'Stove has handles. Handles not on stove.', 'Stove has handles. Handles on stove. There is no stove.', 'Stove has handles. Something on stove. There are no handles.', 'There is no stove has handles. Handles on stove.', 'Stove not has handles. Handles on stove.'}",6.0,245.0,365.0,253.0
2362703,wall near tracks. there is a stone bricks.,4,3,1,0,2,"{'There is no wall near tracks. There is a stone brick.', 'Wall near tracks. There is a stone brick. There are no tracks.', 'Wall not near tracks. There is a stone brick.', 'Wall near tracks. There is a stone brick. There is no wall.', 'Wall near tracks. . There are no stone bricks.'}",199.0,134.0,281.0,171.0
2362706,man has shirt. there is a watch.,4,3,1,0,2,"{'Man has shirt. There is a watch. There is no man.', 'Man has shirt. There is a watch. There is no shirt.', 'Man has shirt. . There is no watch.', 'There is no man has shirt. There is a watch.', 'Man not has shirt. There is a watch.'}",191.0,2.0,308.0,330.0
2362715,snow on statue. there is a tree.,4,3,1,0,2,"{'Snow on statue. There is a tree. There is no snow.', 'Snow on statue. . There is no tree.', 'There is no snow on statue. There is a tree.', 'Snow on statue. There is a tree. There is no statue.', 'Snow not on statue. There is a tree.'}",3.0,2.0,393.0,349.0
2362729,trees in field. there is a row.,4,3,1,0,2,"{'Trees in field. There is a row. There are no trees.', 'there are no trees in field. There is a row.', 'Trees not in field. There is a row.', 'Trees in field. There is a row. There is no field.', 'Trees in field. . There is no row.'}",42.0,227.0,270.0,219.0
2362745,crust on pie. there is a food.,4,3,1,0,2,"{'Crust on pie. . There is no food.', 'Crust on pie. There is food. There is no crust.', 'There is no crust on pie. There is food.', 'Crust not on pie. There is food.', 'Crust on pie. There is food. There is no pie.'}",60.0,10.0,332.0,370.0
2362749,helmet on person. there is a head.,4,3,1,0,2,"{'Helmet on person. . There is no head.', 'There is no helmet on person. There is a head.', 'Helmet on person. There is a head. There is no helmet.', 'Helmet not on person. There is a head.', 'Helmet on person. There is a head. There is no person.'}",135.0,167.0,160.0,276.0
2362765,glove on skier. there is a hand.,4,3,1,0,2,"{'Glove on skier. There is a hand. There is no skier.', 'Glove not on skier. There is a hand.', 'Glove on skier. . There is no hand.', 'There is no glove on skier. There is a hand.', 'Glove on skier. There is a hand. There is no glove.'}",167.0,70.0,158.0,302.0
2362781,rocks on slope. there is a snow.,4,3,1,0,2,"{'there are no rocks on slope. There is a snow.', 'Rocks on slope. There is a snow. There are no rocks.', 'Rocks not on slope. There is a snow.', 'Rocks on slope. . There is no snow.', 'Rocks on slope. There is a snow. There is no slope.'}",2.0,0.0,370.0,334.0
2362793,ball over arm. there is a air.,4,3,1,0,2,"{'Ball not over arm. There is an air.', 'Ball over arm. There is an air. There is no arm.', 'Ball over arm. . There is no air.', 'Ball over arm. There is an air. There is no ball.', 'There is no ball over arm. There is an air.'}",137.0,92.0,170.0,238.0
2362798,canopies are over window. there is a sign.,4,3,1,0,2,"{'Canopies are over window. . There is no sign.', 'there are no canopies are over window. There is a sign.', 'Canopies are over window. There is a sign. There are no canopies.', 'Canopies are over window. There is a sign. There is no window.', 'Canopies not are over window. There is a sign.'}",4.0,63.0,338.0,359.0
2362802,sleeve on another arm. there is a arms.,4,3,1,0,2,"{'There is no sleeve on another arm. there are a arms.', 'Sleeve on another arm. . There are no arms.', 'Sleeve on another arm. there are a arms. There is no sleeve.', 'Sleeve not on another arm. there are a arms.', 'Sleeve on something. there are a arms. There is no arm.'}",108.0,116.0,390.0,257.0
2362822,animal by truck. there is a object.,4,3,1,0,2,"{'Animal not by truck. There is an object.', 'Animal by truck. . There is no object.', 'There is no animal by truck. There is an object.', 'Animal by truck. There is an object. There is no truck.', 'Animal by truck. There is an object. There is no animal.'}",2.0,2.0,496.0,358.0
2362845,he holding stick. there is a hat.,4,3,1,0,2,"{""There is no he's holding stick. There is a hat."", 'He holding stick. There is a hat. There is no he.', 'He not holding stick. There is a hat.', 'He holding stick. There is a hat. There is no stick.', 'He holding stick. . There is no hat.'}",277.0,10.0,213.0,310.0
2362858,player holding bat. there is a hand.,4,3,1,0,2,"{'There is no player holding bat. There is a hand.', 'Player holding bat. There is a hand. There is no player.', 'Player holding bat. There is a hand. There is no bat.', 'Player holding bat. . There is no hand.', 'Player not holding bat. There is a hand.'}",251.0,46.0,182.0,357.0
2362892,concrete strip between parking meters. there is a parking spots.,4,3,1,0,2,"['Concrete strip between parking meters. There is a parking spot. There are no parking spots.', 'There is no concrete strip between parking meters. There is a parking spot.', 'Concrete something between parking meters. There is a parking spot. There is no strip.', 'Concrete strip between parking meters. There is a parking spot. There are no parking meters.', 'A strip that is not concrete between parking meters. There is a parking spot.']",30.0,187.0,290.0,311.0
2362898,part of letter. there is a board.,4,3,1,0,2,"{'Part of letter. There is a board. There is no part.', 'Part not of letter. There is a board.', 'There is no part of letter. There is a board.', 'Part of letter. There is a board. There is no letter.', 'Part of letter. . There is no board.'}",121.0,65.0,247.0,181.0
2362920,cheese drooped between pizza slice. there is a slice.,4,3,1,0,2,"{'Cheese drooped between pizza slice. There is a slice. There is no cheese.', 'Cheese drooped between pizza slice. There is a slice. There are no slices.', 'There is no cheese drooped between pizza slice. There is a slice.', 'Cheese drooped between pizza slice. There is a slice. There are no pizza slices.', 'Cheese not drooped between pizza slice. There is a slice.'}",1.0,29.0,492.0,344.0
2362924,necklace around neck. there is a woman.,4,3,1,0,2,"{'Necklace not around neck. There is a woman.', 'There is no necklace around neck. There is a woman.', 'Necklace around neck. There is a woman. There is no neck.', 'Necklace around neck. There is a woman. There is no necklace.', 'Necklace around neck. . There is no woman.'}",137.0,25.0,240.0,308.0
2362929,reflecting lines across door. there is a panel.,4,3,1,0,2,"{'There is no reflecting lines across door. There is a panel.', 'Reflecting lines across door. There is a panel. There are no reflecting lines.', 'Reflecting lines across door. . There is no panel.', 'Reflecting lines across door. There is a panel. There is no door.', 'Reflecting lines not across door. There is a panel.'}",2.0,3.0,202.0,324.0
2362941,nose on person. there is a face.,4,3,1,0,2,"{'Nose on person. . There is no face.', 'Nose on person. There is a face. There is no person.', 'Nose on person. There is a face. There is no nose.', 'Nose not on person. There is a face.', 'There is no nose on person. There is a face.'}",12.0,0.0,486.0,328.0
2362951,cabinet in bathroom. there is a door.,4,3,1,0,2,"{'There is no cabinet in bathroom. There is a door.', 'Cabinet not in bathroom. There is a door.', 'Cabinet in bathroom. There is a door. There is no cabinet.', 'Cabinet in bathroom. . There is no door.', 'Cabinet in bathroom. There is a door. There is no bathroom.'}",2.0,1.0,297.0,398.0
2362956,boy in picture. there is a shorts.,4,3,1,0,2,"{'Boy in picture. . There are no shorts.', 'Boy in picture. there are a shorts. There is no picture.', 'Boy in picture. there are a shorts. There is no boy.', 'There is no boy in picture. there are a shorts.', 'Boy not in picture. there are a shorts.'}",1.0,2.0,354.0,497.0
2362962,cow standing on hill. there is a eye.,4,3,1,0,2,"{'There is no cow standing on hill. There is an eye.', 'Cow standing on hill. . There is no eye.', 'Cow standing on hill. There is an eye. There is no hill.', 'Cow standing on hill. There is an eye. There is no cow.', 'Cow not standing on hill. There is an eye.'}",78.0,108.0,417.0,219.0
2362969,picture taken at date. there is a time.,4,3,1,0,2,"{'Picture taken at date. . There is no time.', 'There is no picture taken at date. There is a time.', 'Picture taken at date. There is a time. There is no picture.', 'Picture taken at date. There is a time. There is no date.', 'Picture not taken at date. There is a time.'}",1.0,4.0,499.0,371.0
2362989,person on kitchen. there is a shirt.,4,3,1,0,2,"{'Person not on kitchen. There is a shirt.', 'There is no person on kitchen. There is a shirt.', 'Person on kitchen. There is a shirt. There is no person.', 'Person on kitchen. . There is no shirt.', 'Person on kitchen. There is a shirt. There is no kitchen.'}",0.0,2.0,498.0,271.0
