image_id,caption,n,n_objects,n_relations,n_attributes,n_connected_components,hard_negs,x,y,width,height
2360118,umbrella in yard. there is a pole.,4,3,1,0,2,"{'Umbrella not in yard. There is a pole.', 'Umbrella in yard. There is a pole. There is no umbrella.', 'There is no umbrella in yard. There is a pole.', 'Umbrella in yard. There is a pole. There is no yard.', 'Umbrella in yard. . There is no pole.'}",15.0,132.0,468.0,366.0
2360122,tail of a buffalo. there is a wildebeast.,4,3,1,0,2,"{'Tail of a buffalo. There is a wildebeest. There is no tail.', 'There is no tail of a buffalo. There is a wildebeest.', 'Tail of something. There is a wildebeest. There is no buffalo.', 'Tail not of a buffalo. There is a wildebeest.', 'Tail of a buffalo. . There is no wildebeest.'}",132.0,53.0,265.0,272.0
2360124,paw on hand. there is a face.,4,3,1,0,2,"{'Paw on hand. . There is no face.', 'There is no paw on hand. There is a face.', 'Paw not on hand. There is a face.', 'Paw on hand. There is a face. There is no paw.', 'Paw on hand. There is a face. There is no hand.'}",73.0,158.0,208.0,270.0
2360126,flowers on another tree. there is a trees.,4,3,1,0,2,"{'Flowers not on another tree. there are a trees.', 'there are no flowers on another tree. there are a trees.', 'Flowers on another tree. there are a trees. There are no flowers.', 'Flowers on another tree. . There are no trees.', 'Flowers on something. there are a trees. There is no tree.'}",0.0,107.0,161.0,272.0
2360132,light attached to wall. there is a bed.,4,3,1,0,2,"{'Light attached to wall. . There is no bed.', 'Light attached to wall. There is a bed. There is no light.', 'Light not attached to wall. There is a bed.', 'There is no light attached to wall. There is a bed.', 'Light attached to wall. There is a bed. There is no wall.'}",9.0,44.0,475.0,300.0
2360143,car close to bus. there is a road.,4,3,1,0,2,"['There is no car close to bus. There is a road.', 'Car close to bus. . There is no road.', 'Car close to bus. There is a road. There are no buses.', 'Car close to bus. There is a road. There is no car.', 'Car that are not closet bus. There is a road.']",156.0,99.0,220.0,263.0
2360143,number on bus. there is a circle.,4,3,1,0,2,"{'Number not on bus. There is a circle.', 'Number on bus. There is a circle. There is no number.', 'Number on bus. There is a circle. There are no buses.', 'Number on bus. . There is no circle.', 'There is no number on bus. There is a circle.'}",53.0,126.0,277.0,197.0
2360148,door on airplane. there is a plane.,4,3,1,0,2,"{'There is no door on airplane. There is a plane.', 'Door on airplane. . There is no plane.', 'Door on airplane. There is a plane. There is no door.', 'Door not on airplane. There is a plane.', 'Door on airplane. There is a plane. There is no airplane.'}",1.0,71.0,497.0,277.0
2360151,plant on table. there is a leaves.,4,3,1,0,2,"{'There is no plant on table. there are a leaves.', 'Plant not on table. there are a leaves.', 'Plant on table. there are a leaves. There is no plant.', 'Plant on table. . There are no leaves.', 'Plant on table. there are a leaves. There is no table.'}",66.0,209.0,232.0,289.0
2360156,candle on table. there is a candlestick.,4,3,1,0,2,"{'Candle on table. There is a candlestick. There is no table.', 'Candle on table. . There is no candlestick.', 'There is no candle on table. There is a candlestick.', 'Candle not on table. There is a candlestick.', 'Candle on table. There is a candlestick. There is no candle.'}",59.0,56.0,416.0,280.0
2360169,words has word another word. there is a right.,4,3,1,0,2,"['Words has word another word. There is a right. There are no words.', 'Words not has word another word. There is a right.', 'Words has word another word. There is a right. There is no the.', 'there are no words has word another word. There is a right.', 'Words has something another word. There is a right. There is no word.']",1.0,4.0,497.0,252.0
2360182,man waiting for train. there is a shadow.,4,3,1,0,2,"{'There is no man waiting for train. There is a shadow.', 'Man waiting for train. There is a shadow. There is no train.', 'Man not waiting for train. There is a shadow.', 'Man waiting for train. . There is no shadow.', 'Man waiting for train. There is a shadow. There is no man.'}",117.0,49.0,320.0,243.0
2360190,trees in vegetation. there is a rocks.,4,3,1,0,2,"{'Trees in vegetation. . There are no rocks.', 'Trees not in vegetation. there are a rocks.', 'Trees in vegetation. there are a rocks. There is no vegetation.', 'Trees in vegetation. there are a rocks. There are no trees.', 'there are no trees in vegetation. there are a rocks.'}",0.0,0.0,333.0,356.0
2360198,man wearing a shirt. there is a table.,4,3,1,0,2,"{'Man wearing a shirt. There is a table. There is no man.', 'Man wearing something. There is a table. There is no shirt.', 'There is no man wearing a shirt. There is a table.', 'Man wearing a shirt. . There is no table.', 'Man not wearing a shirt. There is a table.'}",20.0,160.0,353.0,213.0
2360203,bus in background. there is a road.,4,3,1,0,2,"{'Bus in background. There is a road. There are no buses.', 'Bus not in background. There is a road.', 'Bus in background. There is a road. There is no background.', 'There is no bus in background. There is a road.', 'Bus in background. . There is no road.'}",71.0,183.0,302.0,181.0
2360218,tank of motorcycle. there is a bike.,4,3,1,0,2,"{'Tank of motorcycle. There is a bike. There is no motorcycle.', 'There is no tank of motorcycle. There is a bike.', 'Tank of motorcycle. There is a bike. There is no tank.', 'Tank not of motorcycle. There is a bike.', 'Tank of motorcycle. . There is no bike.'}",10.0,62.0,348.0,416.0
2360221,gir wearing shirt. there is a sideline.,4,3,1,0,2,"{'There is no air wearing shirt. There is a sideline.', 'Gir wearing shirt. There is a sideline. There is no shirt.', 'Gir wearing shirt. There is a sideline. There is no air.', 'Gir not wearing shirt. There is a sideline.', 'Gir wearing shirt. . There is no sideline.'}",45.0,5.0,451.0,290.0
2360249,painting on wall. there is a fire place.,4,3,1,0,2,"{'There is no painting on wall. There is a fire place.', 'Painting on wall. There is a fire place. There is no wall.', 'Painting not on wall. There is a fire place.', 'Painting on wall. . There is no fire place.', 'Painting on wall. There is a fire place. There is no painting.'}",295.0,0.0,195.0,253.0
2360262,windows on wall. there is a toilet.,4,3,1,0,2,"{'Windows on wall. . There is no toilet.', 'Windows on wall. There is a toilet. There are no windows.', 'there are no windows on wall. There is a toilet.', 'Windows on wall. There is a toilet. There is no wall.', 'Windows not on wall. There is a toilet.'}",183.0,11.0,286.0,333.0
2360273,surf rescue in red on surfboard. there is a sign.,4,3,1,0,2,"{'Surf rescue not in red on surfboard. There is a sign.', 'There is no surf rescue in red on surfboard. There is a sign.', 'Surf rescue in red on surfboard. . There is no sign.', 'Surf rescue in red on surfboard. There is a sign. There is no surf rescue.', 'Surf rescue in red on surfboard. There is a sign. There is no surfboard.'}",1.0,22.0,277.0,180.0
2360317,chair in living room. there is a wall.,4,3,1,0,2,"{'Chair in living room. . There is no wall.', 'Chair in living room. There is a wall. There is no living room.', 'Chair not in living room. There is a wall.', 'There is no chair in living room. There is a wall.', 'Chair in living room. There is a wall. There is no chair.'}",18.0,4.0,481.0,305.0
2360347,man wearing shirt. there is a elephants.,4,3,1,0,2,"{'Man wearing shirt. there are a elephants. There is no man.', 'Man wearing shirt. . There are no elephants.', 'Man wearing shirt. there are a elephants. There is no shirt.', 'There is no man wearing shirt. there are a elephants.', 'Man not wearing shirt. there are a elephants.'}",162.0,194.0,272.0,180.0
2360355,laptop on table. there is a desk.,4,3,1,0,2,"{'Laptop on table. There is a desk. There is no table.', 'Laptop on table. . There is no desk.', 'Laptop not on table. There is a desk.', 'There is no laptop on table. There is a desk.', 'Laptop on table. There is a desk. There is no laptop.'}",1.0,113.0,498.0,260.0
2360363,skateboard atop box. there is a boy.,4,3,1,0,2,"{'Skateboard atop box. . There is no boy.', 'There is no skateboard atop box. There is a boy.', 'Skateboard atop box. There is a boy. There is no box.', 'Skateboard not atop box. There is a boy.', 'Skateboard atop box. There is a boy. There is no skateboard.'}",77.0,1.0,384.0,330.0
2360367,meter has screen. there is a takes coins.,4,3,1,0,2,"{'Meter has screen. . There are no takes coins.', 'Meter not has screen. There is a takes coins.', 'Meter has screen. There is a takes coins. There is no meter.', 'Meter has screen. There is a takes coins. There is no screen.', 'There is no meter has screen. There is a takes coins.'}",20.0,83.0,219.0,220.0
2360376,skier holding ski poles. there is a downhill.,4,3,1,0,2,"{'Skier holding ski poles. . There is no downhill.', 'Skier not holding ski poles. There is a downhill.', 'Skier holding ski poles. There is a downhill. There is no skier.', 'There is no skier holding ski poles. There is a downhill.', 'Skier holding ski poles. There is a downhill. There are no ski poles.'}",2.0,5.0,497.0,368.0
2360377,hat on figurine. there is a leaf.,4,3,1,0,2,"{'Hat on figurine. . There is no leaf.', 'There is no hat on figurine. There is a leaf.', 'Hat on figurine. There is a leaf. There is no hat.', 'Hat on figurine. There is a leaf. There is no figurine.', 'Hat not on figurine. There is a leaf.'}",309.0,34.0,188.0,337.0
2360389,curtains on wall. there is a window.,4,3,1,0,2,"{'Curtains on wall. There is a window. There are no curtains.', 'Curtains on wall. There is a window. There is no wall.', 'Curtains on wall. . There is no window.', 'Curtains not on wall. There is a window.', 'there are no curtains on wall. There is a window.'}",3.0,3.0,316.0,233.0
2360392,trees behind goats. there is a fence.,4,3,1,0,2,"{'Trees behind goats. There is a fence. There are no goats.', 'Trees behind goats. There is a fence. There are no trees.', 'there are no trees behind goats. There is a fence.', 'Trees not behind goats. There is a fence.', 'Trees behind goats. . There is no fence.'}",7.0,0.0,490.0,264.0
2360402,tree standing at edge of field. there is a background.,4,3,1,0,2,"{'Tree standing at edge of field. There is a background. There is no tree.', 'Tree standing at edge of field. There is a background. There is no field.', 'There is no tree standing at edge of field. There is a background.', 'Tree standing at edge of field. . There is no background.', 'Tree not standing at edge of field. There is a background.'}",1.0,0.0,331.0,498.0
2360406,man wearing suit. there is a tie.,4,3,1,0,2,"{'Man wearing suit. . There is no tie.', 'Man wearing suit. There is a tie. There is no man.', 'Man not wearing suit. There is a tie.', 'Man wearing suit. There is a tie. There is no suit.', 'There is no man wearing suit. There is a tie.'}",145.0,85.0,187.0,266.0
2360409,branches covered in snow. there is a ground.,4,3,1,0,2,"{'Branches covered in snow. There is a ground. There are no branches.', 'there are no branches covered in snow. There is a ground.', 'Branches covered in snow. . There is no ground.', 'Branches not covered in snow. There is a ground.', 'Branches covered in snow. There is a ground. There is no snow.'}",1.0,1.0,497.0,372.0
2360429,bear's leg in air. there is a teddy bear.,4,3,1,0,2,"{""Bear's leg not in air. There is a teddy bear."", ""Bear's leg in air. . There is no teddy bear."", ""Bear's leg in air. There is a teddy bear. There is no air."", ""Bear's leg in air. There is a teddy bear. There is no bear's leg."", ""There is no bear's leg in air. There is a teddy bear.""}",250.0,0.0,241.0,241.0
2360440,head on bear. there is a water.,4,3,1,0,2,"{'Head on bear. There is water. There is no bear.', 'Head not on bear. There is water.', 'Head on bear. . There is no water.', 'There is no head on bear. There is water.', 'Head on bear. There is water. There is no head.'}",98.0,122.0,218.0,201.0
2360444,rear tire on taxi. there is a car.,4,3,1,0,2,"['Rear tire not on taxi. There is a car.', 'Rear something on taxi. There is a car. There is no tire.', 'A tire that is not rear on taxi. There is a car.', 'There is no rear tire on taxi. There is a car.', 'Rear tire on taxi. . There is no car.']",23.0,156.0,455.0,315.0
2360478,hair on baby. there is a baby's head.,4,3,1,0,2,"{""Hair not on baby. There is a baby's head."", ""Hair on baby. There is a baby's head. There is no hair."", ""Hair on baby. There is a baby's head. There is no baby."", ""Hair on baby. . There is no baby's head."", ""There is no hair on baby. There is a baby's head.""}",0.0,0.0,342.0,329.0
2360482,coffee table on rug. there is a couch.,4,3,1,0,2,"{'There is no coffee table on rug. There is a couch.', 'Coffee table on rug. There is a couch. There is no rug.', 'Coffee table not on rug. There is a couch.', 'Coffee table on rug. . There is no couch.', 'Coffee table on rug. There is a couch. There is no coffee table.'}",124.0,163.0,337.0,193.0
2360499,wall in photo. there is a room.,4,3,1,0,2,"{'Wall in photo. There is a room. There is no wall.', 'Wall not in photo. There is a room.', 'There is no wall in photo. There is a room.', 'Wall in photo. . There is no room.', 'Wall in photo. There is a room. There is no photo.'}",1.0,3.0,368.0,491.0
2360505,sink inside bathroom. there is a faucet.,4,3,1,0,2,"{'There is no sink inside bathroom. There is a faucet.', 'Sink inside bathroom. There is a faucet. There is no bathroom.', 'Sink inside bathroom. There is a faucet. There is no sink.', 'Sink inside bathroom. . There is no faucet.', 'Sink not inside bathroom. There is a faucet.'}",190.0,1.0,243.0,359.0
2360518,ear of man. there is a adult.,4,3,1,0,2,"{'Ear of man. There is an adult. There is no man.', 'Ear not of man. There is an adult.', 'Ear of man. There is an adult. There is no ear.', 'Ear of man. . There is no adult.', 'There is no ear of man. There is an adult.'}",265.0,2.0,226.0,211.0
2360525,mirror on wall. there is a frame.,4,3,1,0,2,"{'Mirror on wall. There is a frame. There is no mirror.', 'There is no mirror on wall. There is a frame.', 'Mirror not on wall. There is a frame.', 'Mirror on wall. . There is no frame.', 'Mirror on wall. There is a frame. There is no wall.'}",28.0,1.0,227.0,241.0
2360539,line on court. there is a grass.,4,3,1,0,2,"{'Line not on court. There is a grass.', 'Line on court. . There are no grass.', 'Line on court. There is a grass. There is no line.', 'Line on court. There is a grass. There is no court.', 'There is no line on court. There is a grass.'}",1.0,68.0,499.0,276.0
2360549,picture on computer. there is a monitor.,4,3,1,0,2,"{'Picture on computer. There is a monitor. There is no picture.', 'Picture not on computer. There is a monitor.', 'Picture on computer. There is a monitor. There is no computer.', 'Picture on computer. . There is no monitor.', 'There is no picture on computer. There is a monitor.'}",154.0,23.0,340.0,337.0
2360563,tires in plane. there is a landing gear.,4,3,1,0,2,"{'Tires in plane. There is a landing gear. There is no plane.', 'Tires in plane. There is a landing gear. There are no tires.', 'Tires in plane. . There is no landing gear.', 'there are no tires in plane. There is a landing gear.', 'Tires not in plane. There is a landing gear.'}",47.0,14.0,408.0,250.0
2360582,lights hanging in station. there is a ceiling.,4,3,1,0,2,"{'Lights hanging in station. There is a ceiling. There are no lights.', 'Lights not hanging in station. There is a ceiling.', 'Lights hanging in station. . There is no ceiling.', 'there are no lights hanging in station. There is a ceiling.', 'Lights hanging in station. There is a ceiling. There is no station.'}",5.0,0.0,490.0,373.0
2360590,pole on side of train. there is a tracks.,4,3,1,0,2,"{'There is no pole on side of train. there are a tracks.', 'Pole not on side of train. there are a tracks.', 'Pole on side of train. there are a tracks. There is no train.', 'Pole on side of train. there are a tracks. There is no pole.', 'Pole on side of train. . There are no tracks.'}",107.0,5.0,374.0,328.0
2360596,woman standing on sidewalk. there is a jeans.,4,3,1,0,2,"{'Woman standing on sidewalk. there are a jeans. There is no sidewalk.', 'Woman standing on sidewalk. . There are no jeans.', 'Woman standing on sidewalk. there are a jeans. There is no woman.', 'Woman not standing on sidewalk. there are a jeans.', 'There is no woman standing on sidewalk. there are a jeans.'}",26.0,166.0,367.0,207.0
2360597,monitor on top of shelf. there is a stand.,4,3,1,0,2,"{'Monitor not on top of shelf. There is a stand.', 'Monitor on top of shelf. There is a stand. There is no shelf.', 'There is no monitor on top of shelf. There is a stand.', 'Monitor on top of shelf. There is a stand. There is no monitor.', 'Monitor on top of shelf. . There is no stand.'}",153.0,5.0,219.0,291.0
2360602,fuel tank of motorcycle. there is a motocycle.,4,3,1,0,2,"{'Fuel tank of motorcycle. There is a motorcycle. There is no fuel tank.', 'Fuel tank of motorcycle. There is a motorcycle. There is no motorcycle.', 'Fuel tank of motorcycle. . There is no motorcycle.', 'There is no fuel tank of motorcycle. There is a motorcycle.', 'Fuel tank not of motorcycle. There is a motorcycle.'}",215.0,130.0,236.0,238.0
2360608,blanket on top of legs. there is a woman.,4,3,1,0,2,"{'Blanket not on top of legs. There is a woman.', 'There is no blanket on top of legs. There is a woman.', 'Blanket on top of legs. . There is no woman.', 'Blanket on top of legs. There is a woman. There is no blanket.', 'Blanket on top of legs. There is a woman. There are no legs.'}",33.0,60.0,293.0,232.0
2360640,man sitting by dirt. there is a ground.,4,3,1,0,2,"{'Man sitting by dirt. There is a ground. There is no man.', 'Man not sitting by dirt. There is a ground.', 'There is no man sitting by dirt. There is a ground.', 'Man sitting by dirt. There is a ground. There is no dirt.', 'Man sitting by dirt. . There is no ground.'}",2.0,0.0,495.0,330.0
2360647,carpet on floor. there is a dog.,4,3,1,0,2,"{'There is no carpet on floor. There is a dog.', 'Carpet on floor. There is a dog. There is no floor.', 'Carpet not on floor. There is a dog.', 'Carpet on floor. There is a dog. There is no carpet.', 'Carpet on floor. . There is no dog.'}",55.0,54.0,262.0,414.0
2360647,radiator in a corner. there is a dog.,4,3,1,0,2,"{'Radiator in something. There is a dog. There is no corner.', 'Radiator in a corner. . There is no dog.', 'There is no radiator in a corner. There is a dog.', 'Radiator in a corner. There is a dog. There is no radiator.', 'Radiator not in a corner. There is a dog.'}",2.0,1.0,241.0,218.0
2360653,leaves of lettuce. there is a romaine.,4,3,1,0,2,"{'Leaves of lettuce. There is a romaine. There is no lettuce.', 'there are no leaves of lettuce. There is a romaine.', 'Leaves not of lettuce. There is a romaine.', 'Leaves of lettuce. . There is no romaine.', 'Leaves of lettuce. There is a romaine. There are no leaves.'}",212.0,3.0,257.0,228.0
2360656,man swing tennis racket. there is a tennis shoes.,4,3,1,0,2,"{'There is no man swing tennis racket. There is a tennis shoe.', 'Man not swing tennis racket. There is a tennis shoe.', 'Man swing tennis racket. There is a tennis shoe. There is no tennis racket.', 'Man swing tennis racket. There is a tennis shoe. There is no man.', 'Man swing tennis racket. There is a tennis shoe. There are no tennis shoes.'}",12.0,5.0,239.0,369.0
2360678,people on path. there is a trail.,4,3,1,0,2,"{'People on path. There is a trail. There are no people.', 'People on path. . There is no trail.', 'People not on path. There is a trail.', 'People on path. There is a trail. There is no path.', 'There is no people on path. There is a trail.'}",170.0,165.0,248.0,182.0
2360691,tree has leaves. there is a branches.,4,3,1,0,2,"{'There is no tree has leaves. there are a branches.', 'Tree has leaves. there are a branches. There is no tree.', 'Tree has leaves. . There are no branches.', 'Tree has leaves. there are a branches. There are no leaves.', 'Tree not has leaves. there are a branches.'}",4.0,0.0,369.0,242.0
2360697,syrup in cup. there is a ham.,4,3,1,0,2,"{'Syrup not in cup. There is a ham.', 'Syrup in cup. There is a ham. There is no cup.', 'There is no syrup in cup. There is a ham.', 'Syrup in cup. There is a ham. There is no syrup.', 'Syrup in cup. . There is no ham.'}",112.0,22.0,315.0,209.0
2360713,reflection in window. there is a tail light.,4,3,1,0,2,"{'Reflection in window. There is a tail light. There is no window.', 'Reflection not in window. There is a tail light.', 'Reflection in window. . There is no tail light.', 'Reflection in window. There is a tail light. There is no reflection.', 'There is no reflection in window. There is a tail light.'}",4.0,4.0,494.0,375.0
2360718,lips on baby. there is a face.,4,3,1,0,2,"{'Lips on baby. . There is no face.', 'Lips on baby. There is a face. There are no lips.', 'Lips on baby. There is a face. There is no baby.', 'Lips not on baby. There is a face.', 'there are no lips on baby. There is a face.'}",28.0,24.0,277.0,394.0
2360722,triangles hanging from tower. there is a building.,4,3,1,0,2,"{'Triangles not hanging from tower. There is a building.', 'Triangles hanging from tower. There is a building. There are no triangles.', 'there are no triangles hanging from tower. There is a building.', 'Triangles hanging from tower. There is a building. There is no tower.', 'Triangles hanging from tower. . There is no building.'}",3.0,27.0,248.0,263.0
2360726,elephant following father. there is a safari.,4,3,1,0,2,"{'Elephant following father. There is a safari. There is no father.', 'Elephant following father. There is a safari. There is no elephant.', 'There is no elephant following father. There is a safari.', 'Elephant following father. . There is no safari.', 'Elephant not following father. There is a safari.'}",4.0,6.0,480.0,324.0
2360729,wires on table. there is a picture.,4,3,1,0,2,"['Wires on table. . There is no picture.', 'Wires not on table. There is a picture.', 'there are no wires on table. There is a picture.', 'Wires on table. There is a picture. There is no table.', 'Wires on table. There is a picture. There is no wire.']",1.0,92.0,352.0,406.0
2360736,cake with icing. there is a plate.,4,3,1,0,2,"{'Cake with icing. . There is no plate.', 'There is no cake with icing. There is a plate.', 'Cake with icing. There is a plate. There is no icing.', 'Cake not with icing. There is a plate.', 'Cake with icing. There is a plate. There is no cake.'}",144.0,238.0,340.0,219.0
2360758,man holding remote. there is a t-shirt.,4,3,1,0,2,"['Man holding remote. . There is no t-shirt.', 'Man not holding remote. There is a t-shirt.', 'There is no man holding remote. There is a t-shirt.', 'Man holding remote. There is a t-shirt. There is no man.', 'Man holding remote. There is a t-shirt.']",254.0,70.0,168.0,298.0
2360775,sandal worn by man. there is a foot.,4,3,1,0,2,"{'There is no sandal worn by man. There is a foot.', 'Sandal worn by man. There is a foot. There is no sandal.', 'Sandal worn by man. There is a foot. There is no man.', 'Sandal worn by man. . There is no foot.', 'Sandal not worn by man. There is a foot.'}",175.0,16.0,271.0,315.0
2360831,blanket near woman. there is a chair.,4,3,1,0,2,"{'Blanket near woman. There is a chair. There is no woman.', 'Blanket near woman. There is a chair. There is no blanket.', 'Blanket near woman. . There is no chair.', 'There is no blanket near woman. There is a chair.', 'Blanket not near woman. There is a chair.'}",112.0,61.0,346.0,265.0
2360852,fire hydrant on sidewalk. there is a street corner.,4,3,1,0,2,"['Fire hydrant on sidewalk. . There is no street corner.', 'There is no fire hydrant on sidewalk. There is a street corner.', 'Fire hydrant on sidewalk. There is a street corner. There is no fire hydrant.', 'Fire a that is not hydrant on sidewalk. There is a street corner.', 'Fire hydrant not on sidewalk. There is a street corner.']",71.0,238.0,259.0,259.0
2360855,doorway in a hotel room. there is a bathroom.,4,3,1,0,2,"{'Doorway not in a hotel room. There is a bathroom.', 'There is no doorway in a hotel room. There is a bathroom.', 'Doorway in something. There is a bathroom. There is no hotel room.', 'Doorway in a hotel room. . There is no bathroom.', 'Doorway in a hotel room. There is a bathroom. There is no doorway.'}",9.0,4.0,485.0,327.0
2360868,barrier in road. there is a traffic.,4,3,1,0,2,"{'Barrier in road. There is traffic. There is no road.', 'Barrier in road. . There is no traffic.', 'Barrier not in road. There is traffic.', 'Barrier in road. There is traffic. There is no barrier.', 'There is no barrier in road. There is traffic.'}",1.0,305.0,370.0,191.0
2360873,leaves are on a tree. there is a street.,4,3,1,0,2,"{'Leaves are on a tree. . There is no street.', 'there are no leaves are on a tree. There is a street.', 'Leaves are on a tree. There is a street. There are no leaves.', 'Leaves are on something. There is a street. There is no tree.', 'Leaves not are on a tree. There is a street.'}",0.0,1.0,497.0,265.0
2360879,shadow on grass. there is a tree.,4,3,1,0,2,"{'There is no shadow on grass. There is a tree.', 'Shadow on grass. . There is no tree.', 'Shadow on grass. There is a tree. There is no shadow.', 'Shadow not on grass. There is a tree.', 'Shadow on grass. There is a tree. There are no grass.'}",0.0,0.0,498.0,329.0
2360896,man on court. there is a shorts.,4,3,1,0,2,"{'Man on court. there are a shorts. There is no man.', 'Man on court. there are a shorts. There is no court.', 'Man on court. . There are no shorts.', 'There is no man on court. there are a shorts.', 'Man not on court. there are a shorts.'}",3.0,117.0,325.0,277.0
