image_id,caption,n,n_objects,n_relations,n_attributes,n_connected_components,hard_negs,x,y,width,height
2362967,blue boat with canvas and rope tied to a fence along the water,11,6,4,1,2,"['white boat with canvas and rope tied to a fence along the water', 'blue galley with canvas and rope tied to a fence along the water', 'blue boat with board and rope tied to a fence along the water', 'blue boat with canvas and canvas tied to a fence along the water', 'blue boat with canvas and rope tied to a dyke along the water']",2.0,86.0,486.0,286.0
2362970,a plate with food on a table. the table has a glass and there are wine glasses nearby.,11,7,4,0,3,"['a plate with food on a row. the table has a glass and there are wine glasses nearby.', 'a plate with food on a table. the table has a glass and there are wine glasses overby.', 'a plate with food on a table. the table has a glass and there are wine glasses onby.', 'a plate with food on a line. the table has a glass and there are wine glasses nearby.', 'a plate with ash on a table. the table has a glass and there are wine glasses nearby.']",0.0,0.0,496.0,330.0
2362978,"a plane with windows, a cockpit, wheels, and a pipe connected to it, flying in the sky",11,6,5,0,1,"['a balloon with windows, a cockpit, wheels, and a pipe connected to it, flying in the sky', 'a plane with windows, a cab, wheels, and a pipe connected to it, flying in the sky', 'a plane with windows, a cockpit, wheels, and a coil connected to it, flying in the sky', 'a drone with windows, a cockpit, wheels, and a pipe connected to it, flying in the sky', 'a plane with interface, a cockpit, wheels, and a pipe connected to it, flying in the sky']",2.0,0.0,498.0,325.0
2362996,"a bird on a branch with its two legs, forehead, tail, and beak",11,6,5,0,1,"['a mammalian on a branch with its two legs, forehead, tail, and beak', 'a bird on a branch with its two legs, head, tail, and beak', 'a bird on a branch with its two legs, forehead, tail, and asshole', 'a bird on a department with its two legs, forehead, tail, and beak', 'a bird below a branch with its two legs, forehead, tail, and beak']",102.0,82.0,251.0,416.0
2363004,"train with numbers on the front, on a track, with a platform on the side",11,6,5,0,1,"['train with lengths on the front, on a track, with a platform on the side', 'train with numbers on the front, on a field, with a platform on the side', 'train with numbers on the front, on a track, with a beam on the side', 'shuttle with numbers on the front, on a track, with a platform on the side', 'train with numbers on the front, on a track, with a front on the side']",2.0,131.0,470.0,244.0
2363005,"two motorcycles parked on a street. one motorcycle has a wheel, head lamp, and tire",11,6,5,0,1,"['two cars parked on a street. one motorcycle has a wheel, head lamp, and tire', 'two motorcycles parked on a street. one motorcycle has a wheel, head lamp, and collar', 'two trucks parked on a street. one motorcycle has a wheel, head lamp, and tire', 'two motorcycles parked on a street. one motorcycle has a magazine, head lamp, and tire', 'two motorcycles parked on a freeway. one motorcycle has a wheel, head lamp, and tire']",41.0,10.0,456.0,314.0
2363008,man wearing a hat and glasses with a black frame. the meter has a coin slot.,11,6,4,1,3,"['man wearing a hat and glasses with a black frame. the g has a coin slot.', 'man wearing a hat and glasses with a white frame. the meter has a coin slot.', 'man wearing a hat and glasses with a black hoop. the meter has a coin slot.', 'character wearing a hat and glasses with a black frame. the meter has a coin slot.', 'driver wearing a hat and glasses with a black frame. the meter has a coin slot.']",0.0,0.0,259.0,333.0
2363010,a man wearing a jacket and goggles. the man has a head and face.,11,6,5,0,1,"['a kid wearing a jacket and goggles. the man has a head and face.', 'a man wearing a jacket and sunglasses. the man has a head and face.', 'a boy wearing a jacket and goggles. the man has a head and face.', 'a man wearing a jacket and shades. the man has a head and face.', 'a man wearing a jacket and goggles. tground man has a head and face.']",63.0,1.0,336.0,372.0
2363013,"a bed with a pillow, blanket, and another pillow on top of it. there is a wall behind the bed with pictures hanging on it.",11,6,5,0,1,"['a bed with a pillow, quilt, and another pillow on top of it. there is a wall behind the bed with pictures hanging on it.', 'a bed with a pillow, blanket, and another pillow on top of it. there is a room behind the bed with pictures hanging on it.', 'a bed with a pillow, blanket, and another pillow on top of it. there is a wall behind the bed with fruit hanging on it.', 'a couch with a pillow, blanket, and another pillow on top of it. there is a wall behind the bed with pictures hanging on it.', 'a bed with a mat, blanket, and another pillow on top of it. there is a wall behind the bed with pictures hanging on it.']",17.0,3.0,481.0,368.0
2363013,a window next to a wall with a plant in front of it. there is a building visible through the window. the bed is against the wall.,11,5,4,2,1,"['a rack next to a wall with a plant in front of it. there is a building visible through the window. the bed is against the wall.', 'a window next to a house with a plant in front of it. there is a building visible through the window. the bed is against the wall.', 'a window next to a wall with a plant in front of it. there is a bed visible through the window. the bed is against the wall.', 'a window next to a wall with a plant in front of it. there is a door visible through the window. the bed is against the wall.', 'a window next to a wall with a plant in front of it. there is a building visible through the window. the board is against the wall.']",1.0,0.0,497.0,366.0
2363018,a seat and leg of a bench on top of grass,11,6,5,0,1,"['a seat and arm of a bench on top of grass', 'a light and leg of a bench on top of grass', 'a seat and leg of a bench on top of reed', 'a seat and forearm of a bench on top of grass', 'a seat and leg of a sofa on top of grass']",121.0,200.0,269.0,158.0
2363025,"a man with hair, wearing a shirt with a pocket and pants. he also has a tie and belt.",11,7,4,0,3,"['a man with hair, wearing a suit with a pocket and pants. he also has a tie and belt.', 'a man with hair, wearing a shirt with a pocket and stays. he also has a tie and belt.', 'a man with hair, wearing a shirt with a pocket and pants. he also has a coat and belt.', 'a man with skin, wearing a shirt with a pocket and pants. he also has a tie and belt.', 'a kid with hair, wearing a shirt with a pocket and pants. he also has a tie and belt.']",15.0,1.0,483.0,477.0
2363028,"a fridge with a door, sink, paper, bottle, and lid",11,6,5,0,1,"['a fridge with a wall, sink, paper, bottle, and lid', 'a fridge with a door, sink, water, bottle, and lid', 'a fridge with a bar, sink, paper, bottle, and lid', 'a fridge with a door, sink, paper, pot, and lid', 'a fridge with a door, sink, paper, tray, and lid']",1.0,63.0,402.0,312.0
2363053,a man wearing goggles with a shadow on the snow. there are trees and tracks in the snow.,11,6,5,0,1,"['a man wearing goggles with a shadow on the snow. there are hop and tracks in the snow.', 'a man wearing goggles with a shadow on the breeze. there are trees and tracks in the snow.', 'a man wearing sunglasses with a shadow on the snow. there are trees and tracks in the snow.', 'a man wearunderg goggles with a shadow on the snow. there are trees and tracks in the snow.', 'a man wearing goggles with a shadow on the snow. there are trees and field in the snow.']",1.0,0.0,497.0,323.0
2363063,a boy in front of a net on a court. the court has a line in the middle of it. there are bushes behind the boy.,11,6,5,0,1,"['a player in front of a net on a court. the court has a line in the middle of it. there are bushes behind the boy.', 'a boy in front of a gross on a court. the court has a line in the middle of it. there are bushes behind the boy.', 'a boy in frinsidet of a net on a court. the court has a line in the middle of it. there are bushes behind the boy.', 'a boy in front of a net on a court. the court has a bank in the middle of it. there are bushes behind the boy.', 'a boy in frbelowt of a net on a court. the court has a line in the middle of it. there are bushes behind the boy.']",0.0,0.0,499.0,332.0
2363064,a button on the wall of a bathroom. the bathroom has a sink and a square on the wall. there is a flyer laying on the sink.,11,6,5,0,1,"['a button on the wall of a bathroom. the bathroom has a sunderk and a square on the wall. there is a flyer laying on the sink.', 'a buttunder on the wall of a bathroom. the bathroom has a sink and a square on the wall. there is a flyer laying on the sink.', 'a button on the frame of a bathroom. the bathroom has a sink and a square on the wall. there is a flyer laying on the sink.', 'a button on the wall of a bathroom. the bathroom has a can and a square on the wall. there is a flyer laying on the sink.', 'a buttbelow on the wall of a bathroom. the bathroom has a sink and a square on the wall. there is a flyer laying on the sink.']",16.0,12.0,484.0,347.0
2363066,a sink on a counter with a mirror on the wall. there is a bottle on the counter and a knob on the sink.,11,7,4,0,3,"['a pot on a counter with a mirror on the wall. there is a bottle on the counter and a knob on the sink.', 'a sink on a counter with a mirror on the wall. there is a bottle on the counter and a bar on the sink.', 'a sink on a counter with a mirror on the center. there is a bottle on the counter and a knob on the sink.', 'a sink on a dresser with a mirror on the wall. there is a bottle on the counter and a knob on the sink.', 'a sink under a counter with a mirror on the wall. there is a bottle on the counter and a knob on the sink.']",0.0,0.0,468.0,443.0
2363067,"train with a window, stripe, and children waiting for the train. the children are wearing skirts.",11,6,5,0,1,"['train with a sash, stripe, and children waiting for the train. the children are wearing skirts.', 'train with a window, stripe, and head waiting for the train. the children are wearing skirts.', 'train with a window, jewelry, and children waiting for the train. the children are wearing skirts.', 'train with a window, stripe, and children waiting for the train. the children are wearing black.', 'train with a window, stripe, and girl waiting for the train. the children are wearing skirts.']",2.0,4.0,421.0,462.0
2363072,"a bathroom with a curtain, towel, mirror, and toilet paper on a holder",11,6,5,0,1,"['a bathroom with a curtain, towel, mirror, and toilet paper inside a holder', 'a bathroom with a curtain, towel, mirror, and toilet paper on a store', 'a bathroom with a curtain, towel, lamp, and toilet paper on a holder', 'a bathroom with a curtain, towel, mirror, and toilet paper below a holder', 'a door with a curtain, towel, mirror, and toilet paper on a holder']",0.0,0.0,277.0,499.0
2363074,a lady with hair sitting on a sofa. there is a bird and some bags on a table.,11,6,5,0,2,"['a lady with hair sitting on a sofa. there is a bird and some bags on a line.', 'a lady with cinnamon sitting on a sofa. there is a bird and some bags on a table.', 'a figure with hair sitting on a sofa. there is a bird and some bags on a table.', 'a lady with hair sitting below a sofa. there is a bird and some bags on a table.', 'a boy with hair sitting on a sofa. there is a bird and some bags on a table.']",1.0,1.0,274.0,239.0
2363075,"tv on a stand with a small table by it, and a couch by a light on the wall",11,6,4,1,2,"['tv on a stand with a small table by it, and a desk by a light on the wall', 'tv on a stand with a small table over it, and a couch by a light on the wall', 'tv on a stand with a small table by it, and a couch by a dark on the wall', 'radio on a stand with a small table by it, and a couch by a light on the wall', 'reception on a stand with a small table by it, and a couch by a light on the wall']",10.0,12.0,488.0,283.0
2363079,"a girl with a banana. the girl has eyes, hair, and eyebrows.",11,6,5,0,1,"['a girl with a banana. the girl has eyes, plumage, and eyebrows.', 'a girl with a tomato. the girl has eyes, hair, and eyebrows.', 'a girl with a banana. the girl has eyes, hair, and curls.', 'a figure with a banana. the girl has eyes, hair, and eyebrows.', 'a girl with a banana. the girl has eyes, falls, and eyebrows.']",9.0,16.0,287.0,402.0
2363091,"a cat with a face, a paw, and a fish on a rope. the rope holds a toy.",11,7,4,0,3,"['a cat with a face, a paw, and a fish on a rope. the rope holds a button.', 'a cat with a face, a paw, and a fish on a rope. the rope holds a thing.', 'a cat with a tail, a paw, and a fish on a rope. the rope holds a toy.', 'a cat with a face, a paw, and a cock on a rope. the rope holds a toy.', 'a cat with a face, a paw, and a frog on a rope. the rope holds a toy.']",126.0,6.0,213.0,253.0
2363108,"a woman wearing a tank top and a wrap. there is a banana resting on her head. on another head, there is a plate.",11,7,4,0,3,"['a woman wearing a tank top and a wrap. there is a banana resting on her tongue. on another head, there is a plate.', 'a girl wearing a tank top and a wrap. there is a banana resting on her head. on another head, there is a plate.', 'a woman wearing a tank top and a wrap. there is a banana resting on her neck. on another head, there is a plate.', 'a woman wearing a tank top and a wrap. there is a banana resting across her head. on another head, there is a plate.', 'a woman wearing a tank top and a wrap. there is a grape resting on her head. on another head, there is a plate.']",170.0,71.0,270.0,258.0
2363108,"cloth under bananas, which are stacked on a plate that is on a head, with a silver tray holding the bananas",11,6,4,1,2,"['cloth under tree, which are stacked on a plate that is on a head, with a silver tray holding the bananas', 'cloth under potatos, which are stacked on a plate that is on a head, with a silver tray holding the bananas', 'cover under bananas, which are stacked on a plate that is on a head, with a silver tray holding the bananas', 'cloth under bananas, which are stacked across a plate that is on a head, with a silver tray holding the bananas', 'cloth under bananas, which are stacked inside a plate that is on a head, with a silver tray holding the bananas']",170.0,0.0,294.0,272.0
2363109,"a window on a building, a roof on another building, and a window on a house",11,7,4,0,3,"['a window on a building, a screen on another building, and a window on a house', 'a cornice on a building, a roof on another building, and a window on a house', 'a window on a window, a roof on another building, and a window on a house', 'a window on a building, a back on another building, and a window on a house', 'a window on a wall, a roof on another building, and a window on a house']",29.0,7.0,226.0,178.0
2363116,"two men playing tennis. one man is wearing a shoe, wristband, and headband.",11,6,5,0,1,"['two men playing tennis. one girl is wearing a shoe, wristband, and headband.', 'two men playing tennis. one man is wearing a uniform, wristband, and headband.', 'two men playing tennis. acrosse man is wearing a shoe, wristband, and headband.', 'two men playing tennis. one man is wearing a hood, wristband, and headband.', 'two men playing tennis. one player is wearing a shoe, wristband, and headband.']",3.0,6.0,320.0,486.0
2363117,banana with brown spots on a counter top with a stem and reigns. there is a reflection of the banana.,11,6,4,1,2,"['banana with brown spots on a counter top with a stem and flower. there is a reflection of the banana.', 'banana with brown spots on a counter top with a particle and reigns. there is a reflection of the banana.', 'banana with white spots on a counter top with a stem and reigns. there is a reflection of the banana.', 'banana with brown spots on a counter top with a stem and bloom. there is a reflection of the banana.', 'banana with brown spots on a counter top with a stem and reigns. there is a line of the banana.']",13.0,186.0,386.0,210.0
2363119,a bed in a window in a bedroom with a chair and vanity at the corner,11,6,5,0,1,"['a bed by a window in a bedroom with a chair and vanity at the corner', 'a box in a window in a bedroom with a chair and vanity at the corner', 'a bed in a window in a bedroom with a chair and fire at the corner', 'a bed above a window in a bedroom with a chair and vanity at the corner', 'a board in a window in a bedroom with a chair and vanity at the corner']",0.0,10.0,373.0,488.0
2363123,"trees, river bank, cliff, van, river, animals, and road",11,7,4,0,3,"['trees, river bank, beach, van, river, animals, and road', 'trees, river bank, cliff, van, river, sport, and road', 'bush, river bank, cliff, van, river, animals, and road', 'trees, river bank, cliff, van, river, animals, and water', 'trees, river bank, cliff, labor, river, animals, and road']",0.0,6.0,498.0,366.0
2363127,"woman in a field wearing pink shoes, and a bike and fence in the field",11,6,4,1,2,"['woman in a field wearing pink shoes, and a cat and fence in the field', 'woman across a field wearing pink shoes, and a bike and fence in the field', 'woman in a field wearing pink softness, and a bike and fence in the field', 'woman in a field wearing pink shoes, and a car and fence in the field', 'woman in a field wearing pink heat, and a bike and fence in the field']",0.0,0.0,499.0,325.0
2363130,doorway with frame in a house. there is a window above the sink and a refrigerator standing in the house.,11,7,4,0,3,"['doorway with frame in a house. there is a window under the sink and a refrigerator standing in the house.', 'arch with frame in a house. there is a window above the sink and a refrigerator standing in the house.', 'doorway with basement in a house. there is a window above the sink and a refrigerator standing in the house.', 'doorway with frame in a house. there is a window above the shower and a refrigerator standing in the house.', 'doorway with window in a house. there is a window above the sink and a refrigerator standing in the house.']",0.0,4.0,499.0,370.0
2363147,"cake with feathers, ribbon, and another ribbon on top",11,7,4,0,3,"['arms with feathers, ribbon, and another ribbon on top', 'cake with corks, ribbon, and another ribbon on top', 'cake with cork, ribbon, and another ribbon on top', 'neck with feathers, ribbon, and another ribbon on top', 'cake with feathers, ribbinside, and another ribbon on top']",41.0,0.0,228.0,294.0
2363152,"a cat sitting in a motorcycle with whiskers, eyes, ears, and paws",11,6,5,0,1,"['a cat sitting in a motorcycle with whiskers, eyes, buttons, and paws', 'a cat sitting in a motorcycle with whiskers, buttons, ears, and paws', 'a bitch sitting in a motorcycle with whiskers, eyes, ears, and paws', 'a cat sitting in a car with whiskers, eyes, ears, and paws', 'a cat sitting in a machine with whiskers, eyes, ears, and paws']",8.0,13.0,324.0,486.0
2363165,"elephant with eye, ear, and trunk; dirt on ear and beneath elephant",11,6,5,0,1,"['mole with eye, ear, and trunk; dirt on ear and beneath elephant', 'elephant with eye, ear, and trunk; dirt on ear and above elephant', 'squirrel with eye, ear, and trunk; dirt on ear and beneath elephant', 'elephant with eye, ear, and blade; dirt on ear and beneath elephant', 'elephant with liver, ear, and trunk; dirt on ear and beneath elephant']",96.0,0.0,402.0,499.0
2363168,"person, another person, another person, another person, another person, all with pants on, in a line",11,6,5,0,1,"['person, another person, another person, another person, another person, all with boxers on, in a line', 'persacross, another person, another person, another person, another person, all with pants on, in a line', 'persunder, another person, another person, another person, another person, all with pants on, in a line', 'catch, another person, another person, another person, another person, all with pants on, in a line', 'person, another person, another person, another person, another person, all with shorts on, in a line']",254.0,17.0,202.0,228.0
2363169,"many pine trees behind snow on the ground, with a tree next to a lady in the shade",11,6,4,1,2,"['many pine rues behind snow on the ground, with a tree next to a lady in the shade', 'many pine fern behind snow on the ground, with a tree next to a lady in the shade', 'many pine trees behind calm on the ground, with a tree next to a lady in the shade', 'many pine trees behind snow on the wall, with a tree next to a lady in the shade', 'many pine trees behind snow on the ground, with a tree next to a guy in the shade']",0.0,3.0,499.0,321.0
2363170,"hand, shadow, and two glasses on a table with a plate",11,6,5,0,1,"['hand, shadow, and two glasses on a column with a plate', 'hand, shadow, and two plastices on a table with a plate', 'fang, shadow, and two glasses on a table with a plate', 'hand, shadow, and two glasses across a table with a plate', 'hand, shadow, and two foodes on a table with a plate']",3.0,63.0,495.0,372.0
2363177,"a bear with fur, eyes, and a face. there is grass behind the bear",11,6,5,0,1,"['a bear with hide, eyes, and a face. there is grass behind the bear', 'a bear with fur, eyes, and a face. there is charity behind the bear', 'a bear with fur, eyes, and a tail. there is grass behind the bear', 'a mouse with fur, eyes, and a face. there is grass behind the bear', 'a bear with fur, eyes, and a face. there is bamboo behind the bear']",96.0,16.0,403.0,349.0
2363177,"boulder with moss on it and grass next to it, on the ground with dirt and grass",11,6,4,1,2,"['boulder with moss on it and grass next to it, on the head with dirt and grass', 'boulder with moss on it and pea next to it, on the ground with dirt and grass', 'boulder with moss across it and grass next to it, on the ground with dirt and grass', 'blanket with moss on it and grass next to it, on the ground with dirt and grass', 'boulder with moss inside it and grass next to it, on the ground with dirt and grass']",0.0,0.0,499.0,375.0
2363178,"a woman in a newspaper on a table; the newspaper has an edge and part, and there is a napkin on the table",11,6,5,0,1,"['a woman in a newspaper on a table; the newspaper has an end and part, and there is a napkin on the table', 'a woman in a newspaper on a table; the newspaper has an point and part, and there is a napkin on the table', 'a woman in a mag on a table; the newspaper has an edge and part, and there is a napkin on the table', 'a woman in a newspaper on a row; the newspaper has an edge and part, and there is a napkin on the table', 'a woman in a magazine on a table; the newspaper has an edge and part, and there is a napkin on the table']",3.0,0.0,496.0,282.0
2363184,"a photo of a tree, sidewalk, and sign with the bottom of the tree and grass",11,6,5,0,1,"['a photo of a tree, alley, and sign with the bottom of the tree and grass', 'a photo of a tree, sidewalk, and history with the bottom of the tree and grass', 'a photo of a tree, sidewalk, and sign with the bottom of the tree and torch', 'a photo of a carrot, sidewalk, and sign with the bottom of the tree and grass', 'a photo of a bush, sidewalk, and sign with the bottom of the tree and grass']",13.0,4.0,484.0,318.0
2363186,breakfast foods on a plate with a red plate on top of it,11,6,4,1,2,"['breakfast foods on a plate with a black plate on top of it', 'special foods on a plate with a red plate on top of it', 'breakfast glasss on a plate with a red plate on top of it', 'dessert foods on a plate with a red plate on top of it', 'breakfast foods on a plate with a white plate on top of it']",2.0,4.0,497.0,494.0
2363189,"a bench with legs, a back, and a tree behind it. the bench has a seat and a chain.",11,7,4,0,3,"['a bench with legs, a trunk, and a tree behind it. the bench has a seat and a chain.', 'a bench with capacity, a back, and a tree behind it. the bench has a seat and a chain.', 'a bench with legs, a back, and a tree behind it. the bench lack a seat and a chain.', 'a bench with legs, a back, and a tree behind it. the bench has a hub and a chain.', 'a bench with legs, a back, and a tree behind it. the bench refuse a seat and a chain.']",111.0,115.0,353.0,359.0
2363193,"white toothbrush in case, on a desk with a can, coaster, and phone",11,6,4,1,2,"['white toothbrush in case, on a desk with a can, coaster, and butt', 'white toothbrush in return, on a desk with a can, coaster, and phone', 'white toothbrush in case, on a counter with a can, coaster, and phone', 'white bag in case, on a desk with a can, coaster, and phone', 'white toothbrush in case, on a stand with a can, coaster, and phone']",40.0,22.0,372.0,245.0
2363198,"woman in cap and behind a line on a court, with an arm and a watch",11,6,5,0,1,"['woman in cap and behind a line below a court, with an arm and a watch', 'woman in cap and behind a line on a court, with an leg and a watch', 'boy in cap and behind a line on a court, with an arm and a watch', 'woman in cap and behind a bouquet on a court, with an arm and a watch', 'woman in cap and behind a line on a bee, with an arm and a watch']",0.0,88.0,488.0,277.0
2363205,"man wearing shirt and watch on wrist, sitting on a rug. there is a couch behind the man.",11,7,4,0,3,"['man wearing shirt and watch on elbow, sitting on a rug. there is a couch behind the man.', 'man wearing shirt and watch on wrist, sitting on a lap. there is a couch behind the man.', 'man wearing shirt and bomb on wrist, sitting on a rug. there is a couch behind the man.', 'man wearing shirt and watch on wrist, sitting on a rug. there is a bench behind the man.', 'woman wearing shirt and watch on wrist, sitting on a rug. there is a couch behind the man.']",0.0,25.0,306.0,475.0
