image_id,caption,n,n_objects,n_relations,n_attributes,n_connected_components,hard_negs,x,y,width,height
2364999,a clock on a wall with a number and a dog. the clock has three.,11,6,5,0,1,"['a clock on a frame with a number and a dog. the clock has three.', 'a clock on a corner with a number and a dog. the clock has three.', 'a clock under a wall with a number and a dog. the clock has three.', 'a clock on a wall with a number and a dog. the clock has twelve.', 'a clock on a wall with a number and a dog. the clock lack three.']",96.0,2.0,403.0,371.0
2365010,"bird, pigeon, and pigeons trying to get a bag from a hand",11,7,4,0,3,"['mammal, pigeon, and pigeons trying to get a bag from a hand', 'bird, partridge, and pigeons trying to get a bag from a hand', 'bird, pigeon, and pigeons trying to get a stick from a hand', 'bird, pigeinside, and pigeons trying to get a bag from a hand', 'bird, pigeon, and pigeons trying to get a paper from a hand']",105.0,170.0,156.0,298.0
2365014,woman wearing a shirt and mittens; snowboarder wearing pants and a shirt,11,7,4,0,3,"['woman wearing a skirt and mittens; snowboarder wearing pants and a shirt', 'wrestler wearing a shirt and mittens; snowboarder wearing pants and a shirt', 'woman wearing a cap and mittens; snowboarder wearing pants and a shirt', 'woman wearing a shirt and mittens; woman wearing pants and a shirt', 'woman wearing a shirt and mittens; calmboarder wearing pants and a shirt']",0.0,73.0,498.0,261.0
2365017,"sign, another sign, window, and another window on a building. the store is next to the another window",11,6,4,1,2,"['sign, another sign, rack, and another window on a building. the store is next to the another window', 'sign, another sign, grill, and another window on a building. the store is next to the another window', 'sign, another sign, window, and another window on a screen. the store is next to the another window', 'story, another sign, window, and another window on a building. the store is next to the another window', 'sign, another sign, window, and another window below a building. the store is next to the another window']",0.0,0.0,352.0,494.0
2365018,"a house with a roof and window, and a sale sign posted in the grass next to a fire hydrant",11,7,4,0,3,"['a house with a roof and window, and a sale sign posted in the cole next to a fire hydrant', 'a house with a roof and wbydow, and a sale sign posted in the grass next to a fire hydrant', 'a house with a roof and frame, and a sale sign posted in the grass next to a fire hydrant', 'a house with a roof and grill, and a sale sign posted in the grass next to a fire hydrant', 'a house with a screen and window, and a sale sign posted in the grass next to a fire hydrant']",0.0,116.0,497.0,257.0
2365018,"window and sale sign on a house with a roof, and window on a second house",11,6,4,1,2,"['case and sale sign on a house with a roof, and window on a second house', 'window and sale sign on a room with a roof, and window on a second house', 'window and sale sign on a house with a back, and window on a second house', 'window and sale sign on a flat with a roof, and window on a second house', 'window and sale sign below a house with a roof, and window on a second house']",51.0,116.0,334.0,255.0
2365019,"a bathroom with toilet, plant, faucet, and dish.",11,6,5,0,1,"['a closet with toilet, plant, faucet, and dish.', 'a bathroom with toilet, knob, faucet, and dish.', 'a bathroom with toilet, plant, faucet, and fan.', 'a bathroom with bath, plant, faucet, and dish.', 'a bathroom with toilet, plant, register, and dish.']",5.0,2.0,491.0,328.0
2365024,"a bear with two eyes and a face, lying on a carpet with a wire",11,6,5,0,1,"['a bear with two muscles and a face, lying on a carpet with a wire', 'a bear with two eyes and a chest, lying on a carpet with a wire', 'a bear with two eyes and a face, lying on a carpet with a chain', 'a bear with two eyes and a tail, lying on a carpet with a wire', 'a bear with two eyes and a face, lying on a roof with a wire']",5.0,13.0,492.0,362.0
2365030,a skateboard with a shadow and a wheel on a crack on a walkway with grass nearby,11,6,5,0,1,"['a skateboard with a shadow and a wheel on a stretch on a walkway with grass nearby', 'a skateboard with a shadow and a wheel on a crack on a walkway with grass inby', 'a skateboard with a shadow and a wheel below a crack on a walkway with grass nearby', 'a skateboard with a shadow and a block on a crack on a walkway with grass nearby', 'a skateboard with a shadow and a wheel on a crack on a lane with grass nearby']",3.0,34.0,495.0,335.0
2365069,"desktop with computer, soccer game, frame, keyboard, and speakers",11,6,5,0,1,"['desktop with computer, soccer game, frame, keyboard, and cat', 'desktop with display, soccer game, frame, keyboard, and speakers', 'crest with computer, soccer game, frame, keyboard, and speakers', 'boxtop with computer, soccer game, frame, keyboard, and speakers', 'rooftop with computer, soccer game, frame, keyboard, and speakers']",39.0,24.0,460.0,351.0
2365069,"keyboard, wristwatch, messy papers, and soccer game on a desktop computer",11,6,4,1,2,"['keyboard, wristwatch, messy papers, and soccer game on a desktop seat', 'keyboard, wristwatch, messy papers, and soccer game under a desktop computer', 'keyboard, wristwatch, messy script, and soccer game on a desktop computer', 'keyboard, wristwatch, messy papers, and soccer game on a desktop cell', 'keyboard, hunter, messy papers, and soccer game on a desktop computer']",21.0,2.0,478.0,373.0
2365070,"truck with sign and leaves on it, and tires stuck in the ground with a shadow on the ground",11,6,4,1,2,"['truck with sign and cup on it, and tires stuck in the ground with a shadow on the ground', 'truck with history and leaves on it, and tires stuck in the ground with a shadow on the ground', 'truck with sign and leaves inside it, and tires stuck in the ground with a shadow on the ground', 'truck with sign and runner on it, and tires stuck in the ground with a shadow on the ground', 'truck with story and leaves on it, and tires stuck in the ground with a shadow on the ground']",1.0,207.0,498.0,291.0
2365085,a motorcycle with a front tire that has metal spokes and a rear fender. the motorcycle has a kickstand.,11,5,3,3,2,"['a motorcycle with a front collar that has metal spokes and a rear fender. the motorcycle has a kickstand.', 'a motorcycle with a front tire that lack metal spokes and a rear fender. the motorcycle has a kickstand.', 'a motorcycle with a back tire that has metal spokes and a rear fender. the motorcycle has a kickstand.', 'a truck with a front tire that has metal spokes and a rear fender. the motorcycle has a kickstand.', 'a motorcycle with a front tire that has metal spokes and a front fender. the motorcycle has a kickstand.']",68.0,29.0,397.0,247.0
2365090,"the batter is wearing a shirt with a number, pants with a stripe, and a helmet. the batter is holding a bat.",11,7,4,0,3,"['the batter is wearing a shirt with a number, shorts with a stripe, and a helmet. the batter is holding a bat.', 'the batter is wearing a shirt with a margin, pants with a stripe, and a helmet. the batter is holding a bat.', 'the batter is wearing a shirt with a number, pants with a stripe, and a cannon. the batter is holding a bat.', 'the batter is wearing a shirt with a number, boxers with a stripe, and a helmet. the batter is holding a bat.', 'the batter is wearing a belt with a number, pants with a stripe, and a helmet. the batter is holding a bat.']",48.0,105.0,270.0,333.0
2365093,toilet in a bathroom with a can next to it. the toilet has paper in it and a handle. there are tissues on the toilet.,11,6,5,0,1,"['toilet in a bathroom with a curtain next to it. the toilet has paper in it and a handle. there are tissues on the toilet.', 'toilet in a bathroom with a can next to it. the toilet has paper in it and a handle. there are back on the toilet.', 'toilet in a bathroom with a can next to it. the toilet has paper in it and a handle. there are tissues below the toilet.', 'toilet in a bathroom with a can next to it. the toilet has paper in it and a scrap. there are tissues on the toilet.', 'den in a bathroom with a can next to it. the toilet has paper in it and a handle. there are tissues on the toilet.']",0.0,1.0,371.0,497.0
2365105,bowl of food with scooper on it and two other bowls on the table,11,6,4,1,2,"['bowl of food with scooper across it and two other bowls on the table', 'case of food with scooper on it and two other bowls on the table', 'bowl of glass with scooper on it and two other bowls on the table', 'bowl of coal with scooper on it and two other bowls on the table', 'cart of food with scooper on it and two other bowls on the table']",0.0,3.0,491.0,490.0
2365124,"a giraffe walking through an enclosure with a horn, neck, and hooves",11,6,5,0,1,"['a giraffe walking through an enclosure with a foot, neck, and hooves', 'a giraffe walking through an enclosure with a horn, neck, and paw', 'a giraffe walking through an enclosure with a horn, tongue, and hooves', 'a giraffe walking through an enclosure with a horn, horn, and hooves', 'a giraffe walking through an enclosure with a leg, neck, and hooves']",3.0,45.0,456.0,328.0
2365145,"a traffic light with a plant behind it, in front of some rails. there is a reflection of the traffic light on the asphalt.",11,6,5,0,1,"['a traffic light with a plant behind it, in front of some staff. there is a reflection of the traffic light on the asphalt.', 'a traffic light with a plant behind it, in front of some rails. there is a reflection of the traffic light on the ground.', 'a traffic light with a stop behind it, in front of some rails. there is a reflection of the traffic light on the asphalt.', 'a traffic light with a plant behind it, in front of some rails. there is a rendition of the traffic light on the asphalt.', 'a traffic light with a plant behind it, in front of some plugs. there is a reflection of the traffic light on the asphalt.']",112.0,262.0,224.0,237.0
2365147,"a teddy bear sitting in a toy car. the toy car has a hood, wheel, and tray. there is a cheeseburger on the tray.",11,6,5,0,1,"['a teddy bear sitting in a toy car. the toy car has a hood, wheel, and tray. there is a cheeseburger across the tray.', 'a teddy bear sitting in a toy car. the toy car has a hood, wheel, and wheel. there is a cheeseburger on the tray.', 'a teddy bear sitting in a toy car. the toy car has a hood, wheel, and tray. there is a cheeseburger inside the tray.', 'a teddy bear sitting in a toy car. the toy car has a hood, wheel, and bumper. there is a cheeseburger on the tray.', 'a teddy bear sitting in a toy car. the toy car refuse a hood, wheel, and tray. there is a cheeseburger on the tray.']",108.0,190.0,313.0,183.0
2365157,"a vase with handles, recessed lines, and flowers",11,6,5,0,1,"['a vase with crystal, recessed lines, and flowers', 'a jug with handles, recessed lines, and flowers', 'a vase with handles, recessed lbyes, and flowers', 'a mug with handles, recessed lines, and flowers', 'a vase with handles, recessed loveres, and flowers']",87.0,35.0,297.0,383.0
2365160,"a person with a band on their hat, a horse with a face, and a hand on the person's hip",11,7,4,0,3,"[""a person with a band on their belt, a horse with a face, and a hand on the person's hip"", ""a person with a band on their hat, a horse with a face, and a hand on the person's small"", ""a person with a band on their hat, a horse with a face, and a hand on the person's process"", ""a person with a band on their hat, a horse with a head, and a hand on the person's hip"", ""a persacross with a band on their hat, a horse with a face, and a hand on the person's hip""]",0.0,64.0,493.0,291.0
2365164,man and tree in front of a building with a door. the tree has branches. there is another man in front of the building.,11,6,5,0,1,"['man and tree in front of a door with a door. the tree has branches. there is another man in front of the building.', 'man and tree in front of a building with a grille. the tree has branches. there is another man in front of the building.', 'rock and tree in front of a building with a door. the tree has branches. there is another man in front of the building.', 'square and tree in front of a building with a door. the tree has branches. there is another man in front of the building.', 'man and tree in front of a building with a door. the tree has organ. there is another man in front of the building.']",1.0,0.0,498.0,373.0
2365168,top buns on sandwiches with a reflection on the plate,11,6,4,1,2,"['top buns on crispes with a reflection on the plate', 'top buns on sandwiches with a figuring on the plate', 'top puffs on sandwiches with a reflection on the plate', 'top buns under sandwiches with a reflection on the plate', 'top cookies on sandwiches with a reflection on the plate']",0.0,35.0,499.0,337.0
2365170,a clock on a cupola with the time reading 3 o'clock. there is a viewing area on the building with windows.,11,7,4,0,3,"[""a clock on a cupola with the time reading 3 o'clock. there is a viewing area on the building with loop."", ""a clock on a cupola with the time readoverg 3 o'clock. there is a viewing area on the building with windows."", ""a clock on a cupola with the time reading 3 o'clock. there is a viewing area on the building with spider."", ""a clock on a monument with the time reading 3 o'clock. there is a viewing area on the building with windows."", ""a ruler on a cupola with the time reading 3 o'clock. there is a viewing area on the building with windows.""]",184.0,200.0,315.0,297.0
2365172,"a bathroom with a tile floor, sink faucets, a mirror, and a shower",11,6,5,0,1,"['a bathroom with a tile floor, sink faucets, a holder, and a shower', 'a bathroom with a six floor, sink faucets, a mirror, and a shower', 'a closet with a tile floor, sink faucets, a mirror, and a shower', 'a foyer with a tile floor, sink faucets, a mirror, and a shower', 'a bathroom with a four floor, sink faucets, a mirror, and a shower']",1.0,2.0,494.0,316.0
2365172,tile floor in a bathroom with a mirror and a reflection of a curtain,11,6,4,1,2,"['tile floor in a bathroom with a mirror and a reflection of a can', 'tile floor in a bathroom with a mirror and a arrangement of a curtain', 'space floor in a bathroom with a mirror and a reflection of a curtain', 'tile floor in a closet with a mirror and a reflection of a curtain', 'tile floor in a bathroom with a shelf and a reflection of a curtain']",1.0,2.0,494.0,316.0
2365176,"sticker on half watermelon, eggplant and carrot on table, half watermelon on counter",11,6,4,1,2,"['sticker on half watermelon, eggplant and carrot on table, half watermelon on bench', 'sticker on half watermelon, potato and carrot on table, half watermelon on counter', 'sticker on half watermelon, eggplant and carrot on rear, half watermelon on counter', 'sticker on half watermelon, eggplant and carrot on center, half watermelon on counter', 'sticker on half watermelon, eggplant and fruit on table, half watermelon on counter']",0.0,0.0,498.0,374.0
2365178,an oven with a loaf of bread inside and four switches,11,6,5,0,1,"['an stove with a loaf of bread inside and four switches', 'an oven with a loaf of bread on and four switches', 'an oven with a loaf of bread inside and four lowes', 'an oven with a loaf of butter inside and four switches', 'an oven with a loaf of bread inside and four rolleres']",201.0,10.0,249.0,363.0
2365193,"a vehicle with a roof, a mirror, and a bag on top of it. there is a rack on top of the vehicle and a shadow on the roof.",11,6,5,0,1,"['a vehicle with a roof, a bar, and a bag on top of it. there is a rack on top of the vehicle and a shadow on the roof.', 'a vehicle with a roof, a mirror, and a bag across top of it. there is a rack on top of the vehicle and a shadow on the roof.', 'a vehicle with a roof, a mirror, and a bar on top of it. there is a rack on top of the vehicle and a shadow on the roof.', 'a vehicle with a roof, a mirror, and a brush on top of it. there is a rack on top of the vehicle and a shadow on the roof.', 'a vehicle with a roof, a board, and a bag on top of it. there is a rack on top of the vehicle and a shadow on the roof.']",8.0,84.0,466.0,362.0
2365194,"a highway with a truck on it. the truck has a caution sign, equipment, and tires. there is a pole over the highway.",11,6,5,0,1,"['a highway with a truck on it. the truck has a caution sign, equipment, and rim. there is a pole over the highway.', 'a highway with a truck on it. the truck has a caution sign, sign, and tires. there is a pole over the highway.', 'a highway with a truck across it. the truck has a caution sign, equipment, and tires. there is a pole over the highway.', 'a highway with a truck on it. the truck has a caution sign, body, and tires. there is a pole over the highway.', 'a highway with a truck inside it. the truck has a caution sign, equipment, and tires. there is a pole over the highway.']",3.0,53.0,472.0,279.0
2365197,"a building with a doorway, a pole with a flag, and a light. there is traffic with a light.",11,6,5,0,1,"['a wall with a doorway, a pole with a flag, and a light. there is traffic with a light.', 'a building with a doorway, a pole with a flag, and a infrared. there is traffic with a light.', 'a building with a doorway, a pole with a crest, and a light. there is traffic with a light.', 'a building with a doorway, a pole with a flag, and a heavy. there is traffic with a light.', 'a building with a doorway, a marker with a flag, and a light. there is traffic with a light.']",0.0,113.0,331.0,385.0
2365208,a man wearing a shirt on an elephant. the elephant has a trunk and a foot.,11,6,5,0,1,"['a woman wearing a shirt on an elephant. the elephant has a trunk and a foot.', 'a man wearing a hood on an elephant. the elephant has a trunk and a foot.', 'a man wearing a shirt on an rat. the elephant has a trunk and a foot.', 'a man wearing a shirt on an elephant. the elephant has a trunk and a head.', 'a man wearing a shirt across an elephant. the elephant has a trunk and a foot.']",216.0,89.0,198.0,243.0
2365223,bushes and people on a road with a motorcycle and another motorcycle with occupants,11,7,4,0,3,"['bushes and people on a road with a tank and another motorcycle with occupants', 'bushes and people on a road with a motorcycle and another motorcycle with walker', 'bushes and people on a corner with a motorcycle and another motorcycle with occupants', 'clover and people on a road with a motorcycle and another motorcycle with occupants', 'bushes and sunshine on a road with a motorcycle and another motorcycle with occupants']",0.0,120.0,425.0,273.0
2365225,"a barrel hanging from a chain over an elephant. the elephant has an ear, and there is a fence and structure nearby.",11,6,5,0,1,"['a barrel hanging from a chain over an elephant. the elephant has an optic, and there is a fence and structure nearby.', 'a barrel hanging from a chain over an elephant. the elephant has an eye, and there is a fence and structure nearby.', 'a barrel hanging from a sequence over an elephant. the elephant has an ear, and there is a fence and structure nearby.', 'a chimney hanging from a chain over an elephant. the elephant has an ear, and there is a fence and structure nearby.', 'a barrel hanging from a chain over an elephant. the elephant has an ear, and there is a fence and track nearby.']",56.0,2.0,440.0,278.0
2365232,"a toilet in a bathroom with wallpaper. the toilet has a basket, handle, and bolt",11,6,5,0,1,"['a toilet in a niche with wallpaper. the toilet has a basket, handle, and bolt', 'a toilet in a bathroom with wallpaper. the toilet has a hook, handle, and bolt', 'a toilet near a bathroom with wallpaper. the toilet has a basket, handle, and bolt', 'a toilet in a bathroom with wallpaper. the toilet has a bar, handle, and bolt', 'a toilet above a bathroom with wallpaper. the toilet has a basket, handle, and bolt']",1.0,0.0,373.0,499.0
2365242,a cow with an eye behind a fence. a person is hanging over the fence with a shirt and an arm.,11,6,5,0,1,"['a cow with an eye behind a fence. a person is hanging over the fence with a shirt and an leg.', 'a cow with an eye behind a fender. a person is hanging over the fence with a shirt and an arm.', 'a beef with an eye behind a fence. a person is hanging over the fence with a shirt and an arm.', 'a cow with an eye behind a dam. a person is hanging over the fence with a shirt and an arm.', 'a bullock with an eye behind a fence. a person is hanging over the fence with a shirt and an arm.']",85.0,65.0,408.0,205.0
2365250,"a person on a platform, with another person on another platform, and another person on a platform. people are on the side walk.",11,7,4,0,3,"['a lot on a platform, with another person on another platform, and another person on a platform. people are on the side walk.', 'a person on a beam, with another person on another platform, and another person on a platform. people are on the side walk.', 'a persunder on a platform, with another person on another platform, and another person on a platform. people are on the side walk.', 'a person on a back, with another person on another platform, and another person on a platform. people are on the side walk.', 'a person on a platform, with another person on another platform, and another person on a platform. play are on the side walk.']",90.0,122.0,409.0,376.0
2365269,"train with chains and three doors on it, and rails below the train",11,6,5,0,1,"['train with chains and three wall on it, and rails below the train', 'train with chains and three doors below it, and rails below the train', 'train with chains and three gates on it, and rails below the train', 'train with chains and three doors across it, and rails below the train', 'train with stopping and three doors on it, and rails below the train']",14.0,82.0,485.0,245.0
2365274,"a computer with a mouse, cord, and appliance plugged into it. there is a cup of coffee and a star on the appliance.",11,6,5,0,1,"['a computer with a mouse, device, and appliance plugged into it. there is a cup of coffee and a star on the appliance.', 'a computer with a mouse, cord, and appliance plugged into it. there is a cup of coffee and a star inside the appliance.', 'a computer with a mouse, cord, and appliance plugged into it. there is a cup of coffee and a cap on the appliance.', 'a computer with a squirrel, cord, and appliance plugged into it. there is a cup of coffee and a star on the appliance.', 'a computer with a mouse, cord, and appliance plugged into it. there is a cup of coffee and a star under the appliance.']",28.0,1.0,346.0,395.0
2365277,roof with accent around a building that has a clock that says 12,11,6,5,0,1,"['roof with accent around a building that has a clock that says 50', 'roof with accent around a building that lack a clock that says 12', 'roof with accent at a building that has a clock that says 12', 'roof with accent around a building that has a bomb that says 12', 'roof with accent around a building that has a clock that says century']",0.0,3.0,333.0,370.0
2365282,"a cat with eyes and a nose, next to a bed post, with grass reflected in the window",11,7,4,0,3,"['a cat with eyes and a nose, next to a bed post, with torch reflected in the window', 'a dog with eyes and a nose, next to a bed post, with grass reflected in the window', 'a cat with eyes and a nose, next to a bed post, with grass reflected in the horse', 'a cat with mind and a nose, next to a bed post, with grass reflected in the window', 'a cat with hope and a nose, next to a bed post, with grass reflected in the window']",2.0,1.0,483.0,370.0
2365283,"an appliance with a door, light, and ice maker. there is food by the side of the appliance.",11,6,5,0,1,"['an appliance with a door, light, and ice maker. there is food around the side of the appliance.', 'an appliance with a door, infrared, and ice maker. there is food by the side of the appliance.', 'an envelope with a door, light, and ice maker. there is food by the side of the appliance.', 'an apparatus with a door, light, and ice maker. there is food by the side of the appliance.', 'an appliance with a door, light, and ice maker. there is food on the side of the appliance.']",1.0,1.0,397.0,374.0
2365286,light above an arrow on a street light. the street light is on a pole and there is a building next to it,11,5,5,1,1,"['light above an space on a street light. the street light is on a pole and there is a building next to it', 'light above an arrow on a street light. the street light is on a pole and there is a fountain next to it', 'light above an arrow on a street light. the street light is on a pole and there is a pad next to it', 'light above an point on a street light. the street light is on a pole and there is a building next to it', 'dark above an arrow on a street light. the street light is on a pole and there is a building next to it']",89.0,6.0,410.0,369.0
2365289,"hole on toothbrush with shadows, and another hole in brush with red cloth behind it",11,6,4,1,2,"['hole on carpet with shadows, and another hole in brush with red cloth behind it', 'hole on toothbrush with shadows, and another hole in brush with grey cloth behind it', 'hole on toothpair with shadows, and another hole in brush with red cloth behind it', 'hole on toothfield with shadows, and another hole in brush with red cloth behind it', 'hole below toothbrush with shadows, and another hole in brush with red cloth behind it']",2.0,2.0,497.0,371.0
