image_id,caption,n,n_objects,n_relations,n_attributes,n_connected_components,hard_negs,x,y,width,height
2359972,"a giraffe standing in a field with a rock, wall, and branch",11,6,5,0,1,"['a hog standing in a field with a rock, wall, and branch', 'a giraffe standing in a field with a rock, wall, and board', 'a giraffe standing in a field with a line, wall, and branch', 'a giraffe standing in a field with a rock, wall, and panel', 'a giraffe standing in a field with a pavement, wall, and branch']",0.0,57.0,498.0,275.0
2359974,"elephant with handler and another person atop it, entertaining person in a costume and other people",11,6,4,1,2,"['elephant with handler and another person atop it, entertaining person in a skirt and other people', 'elephant with handler and another person atop it, entertaining person in a costume and other time', 'elephant with handler and another person atop it, entertaining person in a costume and other style', 'bear with handler and another person atop it, entertaining person in a costume and other people', 'elephant with handler and another beast atop it, entertaining person in a costume and other people']",3.0,48.0,496.0,267.0
2359989,a girl holding a paper cup that is feeding another bird that is on her hand. the hand is also holding another bird and a bird.,11,6,5,0,1,"['a girl holding a paper cup that is feeding another bird that is under her hand. the hand is also holding another bird and a bird.', 'a lady holding a paper cup that is feeding another bird that is on her hand. the hand is also holding another bird and a bird.', 'a girl holding a paper cup that is feeding another bird that is on her toe. the hand is also holding another bird and a bird.', 'a girl holding a paper cup that is feeding another mammalian that is on her hand. the hand is also holding another bird and a bird.', 'a girl holding a paper cup that is feeding another bird that is on her mug. the hand is also holding another bird and a bird.']",39.0,24.0,334.0,474.0
2359991,"three pedals and petals on a table, with a knife",11,6,5,0,1,"['three pedals and needle on a table, with a knife', 'three pedals and petals on a head, with a knife', 'three ties and petals on a table, with a knife', 'three pedals and petals on a table, with a pick', 'three pedals and petals on a line, with a knife']",0.0,243.0,332.0,252.0
2360096,"blue eyes, head, and hat of a boy with a logo on the hat",11,5,5,1,1,"['blue eyes, head, and helmet of a boy with a logo on the hat', 'blue eyes, head, and hat of a boy with a logo inside the hat', 'blue eyes, head, and hat of a kid with a logo on the hat', 'red eyes, head, and hat of a boy with a logo on the hat', 'blue eyes, head, and dress of a boy with a logo on the hat']",79.0,28.0,207.0,304.0
2360146,"man wearing a hat and sunglasses, and a car with a tire on a white wall",11,6,4,1,2,"['man wearing a hat and sunglasses, and a car with a collar on a white wall', 'boy wearing a hat and sunglasses, and a car with a tire on a white wall', 'man wearing a hat and sunglasses, and a truck with a tire on a white wall', 'man wearing a hat and sunglasses, and a tank with a tire on a white wall', 'kid wearing a hat and sunglasses, and a car with a tire on a white wall']",2.0,70.0,497.0,266.0
2360168,a lamp with glass on a table behind a large bed. there is a sign in a stand,11,6,4,1,2,"['a lamp with glass on a table behbyd a large bed. there is a sign in a stand', 'a lamp with glass on a table behind a large bed. there is a sign in a stop', 'a lamp with glass on a table behind a large desk. there is a sign in a stand', 'a lamp with glass on a row behind a large bed. there is a sign in a stand', 'a lamp with glass on a table behunderd a large bed. there is a sign in a stand']",6.0,0.0,493.0,495.0
2360179,anchor on front of a boat in the middle of a body of water with other boats,11,6,4,1,2,"['anchor on front of a boat over the middle of a body of water with other boats', 'reed on front of a boat in the middle of a body of water with other boats', 'anchor on front of a galley in the middle of a body of water with other boats', 'anchor on front of a boat in the middle of a body of oxygen with other boats', 'anchor on front of a boat in the open of a body of water with other boats']",0.0,0.0,499.0,371.0
2360189,"ear, front leg, and nostrils of a cow in front of a gate, and another cow behind the gate",11,6,4,1,2,"['stomach, front leg, and nostrils of a cow in front of a gate, and another cow behind the gate', 'ear, front leg, and stigma of a cow in front of a gate, and another cow behind the gate', 'gut, front leg, and nostrils of a cow in front of a gate, and another cow behind the gate', 'ear, front leg, and mouth of a cow in front of a gate, and another cow behind the gate', 'ear, front leg, and nostrils of a cow in front of a door, and another cow behind the gate']",162.0,112.0,336.0,174.0
2360191,"highway with a line on top of it, clouds above it, a gaurdrail made of concrete, and a rail next to it",11,6,4,1,2,"['highway with a line on top of it, clouds below it, a gaurdrail made of concrete, and a rail next to it', 'highway with a line on top of it, peeling above it, a gaurdrail made of concrete, and a rail next to it', 'highway with a line on top of it, clouds above it, a gaurddam made of concrete, and a rail next to it', 'highway with a line on top of it, clouds above it, a gaurdfender made of concrete, and a rail next to it', 'line with a line on top of it, clouds above it, a gaurdrail made of concrete, and a rail next to it']",0.0,1.0,499.0,374.0
2360202,"man with armband and bag, carrying a finger with white lines on the street",11,6,4,1,2,"['man with armband and bag, carrying a finger with black lines on the street', 'man with armband and bag, carrying a finger with green lines on the street', 'man with armband and bag, carrying a finger with white lines inside the street', 'man with armband and mail, carrying a finger with white lines on the street', 'woman with armband and bag, carrying a finger with white lines on the street']",0.0,71.0,332.0,427.0
2360279,"blue sky with clouds and people in water, and a man in the ocean",11,6,4,1,2,"['blue sky with death and people in water, and a man in the ocean', 'white sky with clouds and people in water, and a man in the ocean', 'blue sky with life and people in water, and a man in the ocean', 'blue sky with clouds and people in air, and a man in the ocean', 'blue breath with clouds and people in water, and a man in the ocean']",0.0,7.0,500.0,323.0
2360280,"rock, foreign words, tree branch, and snake on a rock with writing",11,6,4,1,2,"['rock, foreign words, tree branch, and snake on a rock with transcription', 'rock, foreign words, tree branch, and snake inside a rock with writing', 'rock, domestic words, tree branch, and snake on a rock with writing', 'rock, foreign words, tree branch, and snake on a rock with attack', 'construction, foreign words, tree branch, and snake on a rock with writing']",4.0,20.0,424.0,229.0
2360285,"man with a tie full of spots, and a blackboard behind him. his right hand is raised.",11,6,3,2,3,"['boss with a tie full of spots, and a blackboard behind him. his right hand is raised.', 'man with a tie thin of spots, and a blackboard behind him. his right hand is raised.', 'man with a tie full of spots, and a bar behind him. his right hand is raised.', 'man with a cloak full of spots, and a blackboard behind him. his right hand is raised.', 'man with a vest full of spots, and a blackboard behind him. his right hand is raised.']",236.0,54.0,215.0,204.0
2360413,"a plane with gears, rudders, and text. another plane is in the background with a wing.",11,7,4,0,3,"['a chopper with gears, rudders, and text. another plane is in the background with a wing.', 'a plane with gears, rudders, and text. another plane is in the background with a tail.', 'a plane with gears, gear, and text. another plane is in the background with a wing.', 'a glider with gears, rudders, and text. another plane is in the background with a wing.', 'a plane with gears, rudders, and text. another plane is in the background with a head.']",17.0,98.0,395.0,230.0
2360426,"an entrance to a building with a flag, roof, crest, and clock",11,6,5,0,1,"['an entrance to a building with a flag, roof, crest, and ruler', 'an entrance to a building with a flag, roof, crest, and rule', 'an entrance to a building with a flag, roof, corner, and clock', 'an entrance to a building with a flag, seal, crest, and clock', 'an entrance to a building with a crest, roof, crest, and clock']",18.0,22.0,461.0,461.0
2360432,"a pizza with mushrooms on a plate. there is a knife and fork on the plate, and another fork lying on top of the pizza.",11,7,4,0,3,"['a pizza with mushrooms below a plate. there is a knife and fork on the plate, and another fork lying on top of the pizza.', 'a pizza with mushrooms on a plate. there is a knife and dish on the plate, and another fork lying on top of the pizza.', 'a pizza with mushrooms on a third. there is a knife and fork on the plate, and another fork lying on top of the pizza.', 'a cake with mushrooms on a plate. there is a knife and fork on the plate, and another fork lying on top of the pizza.', 'a breakfast with mushrooms on a plate. there is a knife and fork on the plate, and another fork lying on top of the pizza.']",5.0,6.0,324.0,275.0
2360435,"a laptop, notebook, wire, book, and frame on a table",11,6,5,0,1,"['a laptop, notebook, wire, book, and walker on a table', 'a laptop, notebook, wire, book, and frame on a matrix', 'a laptop, journal, wire, book, and frame on a table', 'a laptop, notebook, wire, book, and frame across a table', 'a laptop, notesource, wire, book, and frame on a table']",0.0,0.0,338.0,497.0
2360440,three bears in a river; one bear is playing in the water; there is a rock behind one of the bears,11,7,4,0,3,"['three bears in a river; one bear is playing in the water; there is a line behind one of the bears', 'three bears in a pool; one bear is playing in the water; there is a rock behind one of the bears', 'three bears in a river; one bear is playing in the soda; there is a rock behind one of the bears', 'three bears across a river; one bear is playing in the water; there is a rock behind one of the bears', 'three bears in a river; one bear is playing in the air; there is a rock behind one of the bears']",3.0,88.0,494.0,263.0
2360443,three dogs in a dog park. one dog has a tail. a woman is with grass.,11,7,4,0,3,"['three dogs in a dog park. one dog has a tail. a woman is with bean.', 'three heads in a dog park. one dog has a tail. a woman is with grass.', 'three dogs in a dog park. one dog has a tail. a woman is with reed.', 'three dogs in a dog park. one dog has a tooth. a woman is with grass.', 'three dogs over a dog park. one dog has a tail. a woman is with grass.']",0.0,80.0,499.0,251.0
2360450,five spectators in stands,11,6,5,0,1,"['five spectators across stands', 'five runners in stands', 'five spectators over stands', 'five spectators in band', 'five shots in stands']",6.0,6.0,493.0,254.0
2360450,"a man wearing shorts with his head, eyes, and two hands",11,6,5,0,1,"['a man wearing shorts with his head, stomachs, and two hands', 'a man wearing tweed with his head, eyes, and two hands', 'a driver wearing shorts with his head, eyes, and two hands', 'a man wearing shorts with his waist, eyes, and two hands', 'a head wearing shorts with his head, eyes, and two hands']",64.0,6.0,252.0,325.0
2360460,"skies and a snowboard on racks, and a board in a rack",11,7,4,0,3,"['breath and a snowboard on racks, and a board in a rack', 'skies and a snowboard across racks, and a board in a rack', 'skies and a snowjury on racks, and a board in a rack', 'skies and a snowboard below racks, and a board in a rack', 'skies and a snowboard on racks, and a board by a rack']",0.0,53.0,373.0,446.0
2360465,"a man with a beard, nose, mouth, and eyebrow lying on a pillow wearing a hospital gown",11,7,4,0,3,"['a man with a beard, nose, mouth, and eyebrow lying below a pillow wearing a hospital gown', 'a man with a beard, nose, bill, and eyebrow lying on a pillow wearing a hospital gown', 'a man with a beard, nose, stigma, and eyebrow lying on a pillow wearing a hospital gown', 'a kid with a beard, nose, mouth, and eyebrow lying on a pillow wearing a hospital gown', 'a man with a beard, nose, mouth, and coat lying on a pillow wearing a hospital gown']",2.0,43.0,497.0,331.0
2360469,"train on a railroad track with gravel, bushes, and grass nearby",11,6,5,0,1,"['train on a railroad track with gravel, bushes, and mustard nearby', 'train on a railroad track with gravel, bushes, and reed nearby', 'train on a railroad track with dirt, bushes, and grass nearby', 'train on a railroad track with gravel, sage, and grass nearby', 'sedan on a railroad track with gravel, bushes, and grass nearby']",81.0,122.0,415.0,237.0
2360472,"an elephant with a fence behind it. the elephant has a tail, face, and eye. the face has a mask.",11,6,5,0,1,"['an bear with a fence behind it. the elephant has a tail, face, and eye. the face has a mask.', 'an elephant with a fence behind it. the elephant has a hair, face, and eye. the face has a mask.', 'an elephant with a fence behind it. the elephant has a tail, face, and eye. the face has a face.', 'an elephant with a fence behind it. the elephant has a tail, face, and liver. the face has a mask.', 'an elephant with a wing behind it. the elephant has a tail, face, and eye. the face has a mask.']",0.0,30.0,485.0,342.0
2360473,"a microwave with a door, cord, and buttons. there is water near a deck.",11,6,5,0,2,"['a microwave with a door, cord, and buttacrosss. there is water near a deck.', 'a microwave with a door, cord, and buttons. there is oxygen near a deck.', 'a microwave with a door, cord, and buttons. there is air near a deck.', 'a microwave with a door, screen, and buttons. there is water near a deck.', 'a microwave with a wall, cord, and buttons. there is water near a deck.']",0.0,0.0,500.0,373.0
2360477,oven with three knobs in a kitchen with a wall,11,6,5,0,1,"['oven with three spikes in a kitchen with a wall', 'oven with three knobs in a pit with a wall', 'oven with three knobs in a kitchen with a box', 'refrigerator with three knobs in a kitchen with a wall', 'oven with three blocks in a kitchen with a wall']",2.0,4.0,482.0,357.0
2360499,"three benches, one on the ground and two on the floor, in a room",11,7,4,0,3,"['three benches, insidee on the ground and two on the floor, in a room', 'three benches, one on the ground and two on the floor, around a room', 'three boardes, one on the ground and two on the floor, in a room', 'three benches, one on the ground and two on the floor, near a room', 'three benches, one on the ground and two on the platform, in a room']",0.0,5.0,374.0,491.0
2360503,"a cat with two eyes, a collar, sitting on a chair with a blender on a shelf behind it",11,6,5,0,1,"['a cat with two nipples, a collar, sitting on a chair with a blender on a shelf behind it', 'a cat with two eyes, a collar, sitting on a chair with a turner on a shelf behind it', 'a cat with two eyes, a collar, sitting below a chair with a blender on a shelf behind it', 'a cat with two eyes, a collar, sitting on a chair with a grid on a shelf behind it', 'a cat with two eyes, a collar, sitting on a stool with a blender on a shelf behind it']",0.0,0.0,363.0,498.0
2360504,a sidewalk with five bricks in it,11,6,5,0,1,"['a alley with five bricks in it', 'a sidewalk with five lanes in it', 'a sidewalk with five levels in it', 'a mall with five bricks in it', 'a sidewalk with five bricks under it']",95.0,217.0,208.0,281.0
2360509,man playing with a set of blocks on a table. the man has hair and pants.,11,6,5,0,1,"['man playing with a variety of blocks on a table. the man has hair and pants.', 'man playing with a set of blocks on a table. the man has hair and thong.', 'man playing with a set of rock on a table. the man has hair and pants.', 'man playing with a set of blocks below a table. the man has hair and pants.', 'kid playing with a set of blocks on a table. the man has hair and pants.']",88.0,51.0,411.0,353.0
2360511,an elephant on the shore of a body of water. the elephant has a trunk and a leg. there is grass on the shore and a tree in the water.,11,7,4,0,3,"['an rat on the shore of a body of water. the elephant has a trunk and a leg. there is grass on the shore and a tree in the water.', 'an elephant on the shore of a body of water. the elephant has a trunk and a finger. there is grass on the shore and a tree in the water.', 'an elephant on the shore of a body of water. the elephant has a trunk and a leg. there is grass on the shore and a tree above the water.', 'an elephant on the shore of a body of oxygen. the elephant has a trunk and a leg. there is grass on the shore and a tree in the water.', 'an elephant on the shore of a body of water. the elephant has a pad and a leg. there is grass on the shore and a tree in the water.']",1.0,3.0,498.0,347.0
2360515,"a computer on a desk with a monitor, keyboard, and chair with wheels",11,6,5,0,2,"['a computer inside a desk with a monitor, keyboard, and chair with wheels', 'a computer on a desk with a monitor, machine, and chair with wheels', 'a computer across a desk with a monitor, keyboard, and chair with wheels', 'a computer on a desk with a monitor, keyboard, and console with wheels', 'a panel on a desk with a monitor, keyboard, and chair with wheels']",2.0,187.0,352.0,217.0
2360517,"a mirror on a wall, a stand on a sink, a pitcher under a sink, and a faucet on a sink",11,7,4,0,3,"['a mirror on a wall, a stand on a throne, a pitcher under a sink, and a faucet on a sink', 'a mirror on a wall, a stand on a sink, a pitcher under a sink, and a push on a sink', 'a mirror on a wall, a stand on a sink, a pitcher over a sink, and a faucet on a sink', 'a mirror on a wall, a lamp on a sink, a pitcher under a sink, and a faucet on a sink', 'a mirror on a corner, a stand on a sink, a pitcher under a sink, and a faucet on a sink']",47.0,1.0,324.0,498.0
2360519,a pole with banners hanging on it in the median of a road. there is another sidewalk near the road.,11,7,4,0,3,"['a pole with arms hanging on it in the median of a road. there is another sidewalk near the road.', 'a pole with banners hanging on it in the median of a road. there is another boardwalk near the road.', 'a pole with banners hanging on it in the median of a road. there is another promenade near the road.', 'a pole with colours hanging on it in the median of a road. there is another sidewalk near the road.', 'a pole with banners hanging on it in the median of a field. there is another sidewalk near the road.']",0.0,1.0,491.0,329.0
2360526,"people standing in front of and behind a building with a circle, angel, and statue on it",11,6,5,0,1,"['time standing in front of and behind a building with a circle, angel, and statue on it', 'chance standing in front of and behind a building with a circle, angel, and statue on it', 'people standing in front of and behind a building with a circle, pole, and statue on it', 'people standing in front of and behind a building with a circle, angel, and carving on it', 'people standing in front of and behind a cross with a circle, angel, and statue on it']",0.0,0.0,373.0,499.0
2360528,rocks in the surf,11,6,5,0,1,"['beds in the surf', 'rocks in the wake', 'goods in the surf', 'rocks over the surf', 'rocks in the rise']",251.0,130.0,238.0,201.0
2360535,"a motorcycle with a headlight, tire, and exhaust pipe. there is grass beside the motorcycle.",11,6,5,0,1,"['a automobile with a headlight, tire, and exhaust pipe. there is grass beside the motorcycle.', 'a motorcycle with a headdark, tire, and exhaust pipe. there is grass beside the motorcycle.', 'a motorcycle with a headheavy, tire, and exhaust pipe. there is grass beside the motorcycle.', 'a motorcycle with a headlight, tire, and exhaust pipe. there is mustard beside the motorcycle.', 'a motorcycle with a spot, tire, and exhaust pipe. there is grass beside the motorcycle.']",58.0,84.0,383.0,274.0
2360544,three donuts and an apple fritter in a box,11,6,5,0,1,"['three donuts and an apple fritter in a line', 'three snaps and an apple fritter in a box', 'three kisss and an apple fritter in a box', 'three donuts and an apple fritter across a box', 'three donuts and an apple fritter in a can']",2.0,2.0,497.0,495.0
2360546,"a zebra on the ground during the day. the zebra has a hoof, tail, and leg.",11,7,4,0,3,"['a zebra on the ground during the day. the zebra has a paw, tail, and leg.', 'a zebra on the water during the day. the zebra has a hoof, tail, and leg.', 'a zebra on the ground during the cycle. the zebra has a hoof, tail, and leg.', 'a zebra on the ground during the run. the zebra has a hoof, tail, and leg.', 'a zebra on the ground during the day. the zebra has a hoof, tail, and arm.']",1.0,1.0,498.0,354.0
2360552,a laptop on a desk with a keyboard and a cat. the cat has whiskers and ears.,11,6,5,0,1,"['a laptop below a desk with a keyboard and a cat. the cat has whiskers and ears.', 'a laptop on a desk with a keyboard and a cat. the cat has bob and ears.', 'a laptop on a desk with a case and a cat. the cat has whiskers and ears.', 'a laptop on a desk with a drawer and a cat. the cat has whiskers and ears.', 'a notebook on a desk with a keyboard and a cat. the cat has whiskers and ears.']",0.0,0.0,499.0,331.0
2360558,"elephant with tusk and arm feeding it. there is also a mother with her arms around the arm, and hair on the head.",11,7,4,0,3,"['mouse with tusk and arm feeding it. there is also a mother with her arms around the arm, and hair on the head.', 'elephant with tusk and arm feeding it. there is also a mother with her arms around the arm, and hair under the head.', 'elephant with tusk and toe feeding it. there is also a mother with her arms around the arm, and hair on the head.', 'elephant with tusk and leg feeding it. there is also a mother with her arms around the arm, and hair on the head.', 'elephant with tusk and arm feeding it. there is also a father with her arms around the arm, and hair on the head.']",0.0,0.0,331.0,405.0
2360559,"a shadow on the floor, a bag with a strap, a cat with a nose, and a mat on the floor",11,7,4,0,3,"['a shadow on the floor, a bag with a pencil, a cat with a nose, and a mat on the floor', 'a shadow on the floor, a bag with a strap, a wolf with a nose, and a mat on the floor', 'a shadow below the floor, a bag with a strap, a cat with a nose, and a mat on the floor', 'a shadow on the face, a bag with a strap, a cat with a nose, and a mat on the floor', 'a shadow on the floor, a rug with a strap, a cat with a nose, and a mat on the floor']",0.0,0.0,499.0,373.0
2360567,a bear with an ear and a bear with an ear and a nose behind a tree,11,7,4,0,3,"['a rat with an ear and a bear with an ear and a nose behind a tree', 'a bbutton with an ear and a bear with an ear and a nose behind a tree', 'a bnipple with an ear and a bear with an ear and a nose behind a tree', 'a bear with an ear and a bear with an ear and a nose behind a shrub', 'a monkey with an ear and a bear with an ear and a nose behind a tree']",90.0,28.0,366.0,267.0
2360568,a photo of a bear with a muzzle. the bear has fur and an eye. there is grass in the photo.,11,7,4,0,3,"['a photo of a bear with a muzzle. the bear has fur and an penis. there is grass in the photo.', 'a photo of a bear with a muzzle. the bear refuse fur and an eye. there is grass in the photo.', 'a photo of a bear with a muzzle. the bear has fur and an eye. there is grass under the photo.', 'a photo of a rat with a muzzle. the bear has fur and an eye. there is grass in the photo.', 'a photo of a bear with a muzzle. the bear has wool and an eye. there is grass in the photo.']",3.0,9.0,491.0,257.0
2360572,a bus with a window and wipers. the bus is on a street. there is another bus on the street.,11,6,5,0,1,"['a semi with a window and wipers. the bus is on a street. there is another bus on the street.', 'a sedan with a window and wipers. the bus is on a street. there is another bus on the street.', 'a bus with a window and types. the bus is on a street. there is another bus on the street.', 'a bus with a grille and wipers. the bus is on a street. there is another bus on the street.', 'a bus with a window and wipers. the bus is inside a street. there is another bus on the street.']",0.0,44.0,500.0,319.0
2360574,"a bird with a wing, two legs, and a stick",11,7,4,0,3,"['a bird with a tail, two legs, and a stick', 'a bird with a wing, two legs, and a case', 'a bird with a face, two legs, and a stick', 'a mammal with a wing, two legs, and a stick', 'a mammalian with a wing, two legs, and a stick']",29.0,38.0,290.0,177.0
2360583,two people behind a table. the table has a plate with a sandwich and bread on it.,11,6,5,0,1,"['two people behind a line. the table has a plate with a sandwich and bread on it.', 'two people behind a row. the table has a plate with a sandwich and bread on it.', 'two time behind a table. the table has a plate with a sandwich and bread on it.', 'two people behind a table. the table has a plate with a sandwich and cereal on it.', 'two people behind a table. the table has a plate with a chip and bread on it.']",0.0,1.0,333.0,498.0
2360585,a train with two letters and a tow hitch in front. the train is wearing overalls.,11,7,4,0,3,"['a train with two letters and a tow hitch in front. the train is wearing helmet.', 'a craft with two letters and a tow hitch in front. the train is wearing overalls.', 'a train with two letters and a tow hitch in front. the train is wearing weeds.', 'a train with two letters and a tow hitch in frundert. the train is wearing overalls.', 'a train with two lines and a tow hitch in front. the train is wearing overalls.']",0.0,156.0,274.0,228.0
