image_id,caption,n,n_objects,n_relations,n_attributes,n_connected_components,hard_negs,x,y,width,height
60,"a moped with a tire and seat, and a license plate",8,4,4,0,1,"['a moped with a tire and scooter, and a license plate', 'a moped with a scooter and seat, and a license plate', 'a license plate with a tire and seat, and a moped', 'a scooter with a tire and seat, and a license plate', 'a moped with a tire and seat, and a scooter']",277.0,270.0,195.0,310.0
327,a person wearing pants and a car parked on a street with buildings lining it.,8,5,3,0,2,"['a car wearing pants and a person parked on a street with buildings lining it.', 'a person wearing street and a car parked on a pants with buildings lining it.', 'a person wearing buildings and a car parked on a street with pants lining it.', 'a person wearing pants and a buildings parked on a street with car lining it.', 'a person wearing car and a pants parked on a street with buildings lining it.']",44.0,90.0,754.0,500.0
356,people and a car on a road near a sidewalk with a sign above the people,8,5,3,0,2,"['sign and a car on a road near a sidewalk with a people above the sign', 'people and a sign on a road near a sidewalk with a car above the people', 'road and a car on a people near a sidewalk with a sign above the road', 'people and a car on a sign near a sidewalk with a road above the people', 'sidewalk and a car on a road near a people with a sign above the sidewalk']",50.0,108.0,588.0,480.0
460,"a window on a building, with a sign and a cow in front of it",8,5,3,0,2,"['a cow on a building, with a sign and a window in front of it', 'a window on a sign, with a building and a cow in front of it', 'a sign on a building, with a window and a cow in front of it', 'a window on a cow, with a sign and a building in front of it', 'a building on a window, with a sign and a cow in front of it']",29.0,16.0,447.0,358.0
494,"a bucket on a tray, with glasses near the bucket, and a menu on the dresser.",8,5,3,0,2,"['a bucket on a menu, with glasses near the bucket, and a tray on the dresser.', 'a menu on a tray, with glasses near the menu, and a bucket on the dresser.', 'a bucket on a tray, with dresser near the bucket, and a menu on the glasses.', 'a bucket on a tray, with glasses near the bucket, and a dresser on the menu.', 'a dresser on a tray, with glasses near the dresser, and a menu on the bucket.']",197.0,377.0,412.0,221.0
524,oven has handle. handle on oven. window on oven. microwave above oven.,8,4,4,0,1,"['oven has microwave. microwave on oven. window on oven. handle above oven.', 'oven has handle. handle above oven. window above oven. microwave on oven.', 'microwave has handle. handle on microwave. window on microwave. oven above microwave.', 'oven above handle. handle on oven. window on oven. microwave has oven.', 'window has handle. handle on window. oven on window. microwave above window.']",222.0,4.0,321.0,595.0
563,a shelf above a counter with a microwave on it and a sticker attached to the microwave,8,5,3,0,2,"['a sticker above a counter with a microwave on it and a shelf attached to the microwave', 'a shelf above a counter with a sticker on it and a microwave attached to the sticker', 'a microwave above a counter with a shelf on it and a sticker attached to the shelf', 'a counter above a shelf with a microwave on it and a sticker attached to the microwave', 'a shelf above a microwave with a counter on it and a sticker attached to the counter']",0.0,18.0,254.0,223.0
817,"a dumpster filled with wood, a sign hanging on the building, and people walking by the building",8,5,3,0,2,"['a dumpster filled with building, a sign hanging on the wood, and people walking by the wood', 'a dumpster filled with wood, a sign walking by the building, and people hanging on the building', 'a dumpster filled with people, a sign hanging on the building, and wood walking by the building', 'a building filled with wood, a sign hanging on the dumpster, and people walking by the dumpster', 'a dumpster filled with wood, a sign hanging on the people, and building walking by the people']",2.0,0.0,597.0,799.0
848,a tree with a gravel trunk and a bicycle on the sidewalk,8,5,3,0,2,"['a tree with a sidewalk trunk and a bicycle on the gravel', 'a tree with a gravel sidewalk and a bicycle on the trunk', 'a tree with a gravel trunk and a sidewalk on the bicycle', 'a tree with a bicycle trunk and a gravel on the sidewalk', 'a sidewalk with a gravel trunk and a bicycle on the tree']",173.0,1.0,625.0,596.0
994,a man in a shirt holding onto a handle on an escalator with a pillar in the background,8,5,3,0,3,"['a man in a pillar holding onto a handle on an escalator with a shirt in the background', 'a handle in a shirt holding onto a man on an escalator with a pillar in the background', 'a pillar in a shirt holding onto a handle on an escalator with a man in the background', 'a man in a handle holding onto a shirt on an escalator with a pillar in the background', 'a man in a shirt holding onto a pillar on an escalator with a handle in the background']",99.0,171.0,699.0,426.0
1017,a black artwork with a white mat in the background,8,4,2,2,2,"['a white artwork with a black mat in the background', 'a black background with a white mat in the artwork', 'a black matwork with a white art in the background', 'a black mat with a white artwork in the background', 'a black artwork with a white background in the mat']",2.0,62.0,203.0,283.0
1025,"a window on a house, bushes next to the house, and a door on the house",8,4,4,0,1,"['a window near a house, bushes next to the house, and a door on the house', 'a window next to a house, bushes on the house, and a door next to the house', 'a window on a door, bushes next to the door, and a house on the door', 'a house on a window, bushes next to the house, and a door on the house', 'a window on a bushes, house next to the bushes, and a door on the house']",61.0,22.0,331.0,220.0
1216,"a man below boxes, a table holding lemons, and boxes above lemons.",8,4,4,0,1,"['a man below boxes, a table above lemons, and boxes holding lemons.', 'a man holding boxes, a table below lemons, and boxes above lemons.', 'a man above boxes, a table holding lemons, and boxes below lemons.', 'a man below lemons, a table holding boxes, and lemons above boxes.', 'a boxes below man, a table holding lemons, and man above lemons.']",172.0,29.0,282.0,293.0
1375,a microphone for a drummer playing a drumset with a wire in front of it,8,5,3,0,2,"['a drummer for a microphone playing a drumset with a wire in front of it', 'a drum for a microphonemer playing a microphoneset with a wire in front of it', 'a microphone for a wire playing a drumset with a drummer in front of it', 'a microphone for a drumset playing a drummer with a wire in front of it', 'a drums for a drummer playing a microphoneet with a wire in front of it']",245.0,222.0,183.0,231.0
1466,a man wearing a backpack and an arrow pointing to a car near a road.,8,5,3,0,2,"['a backpack wearing a man and an arrow pointing to a car near a road.', 'a car wearing a backpack and an arrow pointing to a man near a road.', 'a road wearing a backpack and an arrow pointing to a car near a man.', 'a man wearing a backpack and an road pointing to a car near a arrow.', 'a man wearing a backpack and an car pointing to a arrow near a road.']",83.0,205.0,516.0,358.0
1482,"a woman in front of a building with a number on it, and a window on the building",8,5,3,0,2,"['a woman in front of a window with a number on it, and a building on the window', 'a building in front of a woman with a number on it, and a window on the building', 'a number in front of a building with a woman on it, and a window on the building', 'a woman in front of a number with a building on it, and a window on the number', 'a window in front of a building with a number on it, and a woman on the building']",107.0,3.0,504.0,493.0
1547,"a coffee mug on a table, with a cup and packet near it",8,4,4,0,1,"['a coffee mug under a table, with a cup and packet near it', 'a table on a coffee mug, with a cup and packet near it', 'a coffee mug on a cup, with a table and packet near it', 'a coffee mug on a table, with a cup and packet under it', 'a coffee mug on a packet, with a cup and table near it']",84.0,25.0,495.0,415.0
1800,"a motorcycle parked on the sidewalk, with a motorbike next to it and a gas tank of a bike.",8,5,3,0,2,"['a gas tank parked on the sidewalk, with a motorbike next to it and a motorcycle of a bike.', 'a motorcycle parked on the motorbike, with a sidewalk next to it and a gas tank of a bike.', 'a motorcycle parked on the bike, with a motorsidewalk next to it and a gas tank of a sidewalk.', 'a sidewalk parked on the motorcycle, with a motorbike next to it and a gas tank of a bike.', 'a motorcycle parked on the gas tank, with a motorbike next to it and a sidewalk of a bike.']",40.0,202.0,614.0,384.0
1835,a door on a house with a mailbox on the wall and a paper on the door,8,5,3,0,2,"['a door on a paper with a mailbox on the wall and a house on the door', 'a paper on a house with a mailbox on the wall and a door on the paper', 'a door on a house with a mailbox on the paper and a wall on the door', 'a wall on a house with a mailbox on the door and a paper on the wall', 'a mailbox on a house with a door on the wall and a paper on the mailbox']",81.0,1.0,718.0,597.0
1928,"the bottom of a lamp post in front of a building, with a sidewalk in front of another building",8,5,3,0,2,"['the sidewalk of a lamp post in front of a building, with a bottom in front of another building', 'the bottom of a sidewalk in front of a building, with a lamp post in front of another building', 'the building of a lamp post in front of a bottom, with a sidewalk in front of another bottom', 'the bottom of a building in front of a lamp post, with a sidewalk in front of another lamp post', 'the lamp post of a bottom in front of a building, with a sidewalk in front of another building']",45.0,21.0,690.0,524.0
2158,"a window shade on a window in a dining room, and a painting on the wall",8,5,3,0,2,"['a window shade on a window in a painting, and a dining room on the wall', 'a dining room on a window in a window shade, and a painting on the wall', 'a wall shade on a window in a dining room, and a painting on the window', 'a painting shade on a painting in a dining room, and a window on the wall', 'a wondow shade in a wondow on a donong room, and a paontong in the wall']",0.0,2.0,798.0,594.0
3173,"a window on a building, and a man and person walking on a cobble street",8,5,3,0,2,"['a street on a building, and a man and person walking on a cobble window', 'a man on a building, and a window and person walking on a cobble street', 'a window on a building, and a street and person walking on a cobble man', 'a window on a man, and a building and person walking on a cobble street', 'a building on a window, and a man and person walking on a cobble street']",5.0,1.0,698.0,589.0
3185,a van and car driving on a street with a sign on a building.,8,5,3,0,2,"['a van and car driving on a building with a sign on a street.', 'a street and car driving on a van with a sign on a building.', 'a van and building driving on a street with a sign on a car.', 'a van and sign driving on a street with a car on a building.', 'a van and street driving on a car with a sign on a building.']",5.0,4.0,788.0,591.0
3371,"leaves attached to a tree, with a palm tree on top of a plaza, and a lamp post on top of the plaza",8,5,3,0,2,"['lamp post attached to a tree, with a palm tree on top of a plaza, and a leaves on top of the plaza', 'leaves attached to a lamp post, with a palm tree on top of a plaza, and a tree on top of the plaza', 'tree attached to a leaves, with a palm tree on top of a plaza, and a lamp post on top of the plaza', 'leaves attached to a plaza, with a palm plaza on top of a tree, and a lamp post on top of the plaza', 'leaves attached to a tree, with a palm tree on top of a lamp post, and a plaza on top of the lamp post']",283.0,100.0,496.0,260.0
3777,"there are windows with blinds in front of them, a carpet on the floor, and a chair in the living room",8,5,3,0,3,"['there are carpet with blinds in front of them, a windows on the floor, and a chair in the living room', 'there are chair with blinds in front of them, a carpet on the floor, and a windows in the living room', 'there are windows with chair in front of them, a carpet on the floor, and a blinds in the living room', 'there are windows with living room in front of them, a carpet on the floor, and a chair in the blinds', 'there are windows with blinds in front of them, a carpet on the floor, and a living room in the chair']",1.0,0.0,309.0,238.0
3914,"a fence next to some dirt, with a pole in the dirt, and a shadow next to the ground.",8,5,3,0,2,"['a fence next to some shadow, with a pole in the dirt, and a dirt next to the ground.', 'a shadow next to some dirt, with a pole in the dirt, and a fence next to the ground.', 'a dirt next to some fence, with a pole in the fence, and a shadow next to the ground.', 'a fence next to some dirt, with a pole in the dirt, and a ground next to the shadow.', 'a fence next to some pole, with a dirt in the pole, and a shadow next to the ground.']",0.0,9.0,450.0,327.0
3931,a truck on the road with a tree next to it and people near a building,8,5,3,0,2,"['a truck on the building with a tree next to it and people near a road', 'a people on the road with a tree next to it and truck near a building', 'a building on the road with a tree next to it and people near a truck', 'a truck on the people with a tree next to it and road near a building', 'a truck on the tree with a road next to it and people near a building']",57.0,87.0,466.0,455.0
3996,"a scorpion on a sign with a letter, and panels that are supported by poles",8,5,3,0,3,"['a panels on a sign with a letter, and scorpion that are supported by poles', 'a scorpion on a sign with a letter, and poles that are supported by panels', 'a scorpion on a poles with a letter, and panels that are supported by sign', 'a sign on a scorpion with a letter, and panels that are supported by poles', 'a poles on a sign with a letter, and panels that are supported by scorpion']",14.0,0.0,738.0,750.0
4083,"animals hanging from the ceiling, with a fish next to a curtain, and another fish next to the curtain",8,5,3,0,2,"['animals hanging from the curtain, with a fish next to a ceiling, and another fish next to the curtain', 'animals hanging from the ceiling, with a curtain next to a fish, and another curtain next to the fish', 'curtain hanging from the ceiling, with a fish next to a animals, and another fish next to the curtain', 'ceiling hanging from the animals, with a fish next to a curtain, and another fish next to the curtain', 'fish hanging from the ceiling, with a animals next to a curtain, and another animals next to the curtain']",112.0,0.0,347.0,296.0
4245,a dock with a boat near it and the water below it. the sky is above the boat,8,4,4,0,1,"['a dock with a boat below it and the water near it. the sky is above the boat', 'a dock with a boat near it and the sky below it. the water is above the boat', 'a dock with a sky near it and the water below it. the boat is above the sky', 'a sky with a boat near it and the water below it. the dock is above the boat', 'a dock with a boat near it and the water above it. the sky is below the boat']",336.0,1.0,404.0,521.0
4276,a table against the wall with some toys under it and a curtain over the window,8,5,3,0,2,"['a table against the wall with some curtain under it and a toys over the window', 'a table are underneath the wall with some toys under it and a curtain over the window', 'a toys against the wall with some table under it and a curtain over the window', 'a curtain against the wall with some toys under it and a table over the window', 'a window against the wall with some toys under it and a curtain over the table']",331.0,0.0,468.0,395.0
4294,"an item on an oven, which is above a floor, and a rug on another floor",8,5,3,0,2,"['an item above an oven, which is on a floor, and a rug above another floor', 'an item on an rug, which is above a floor, and a oven on another floor', 'an floor on an oven, which is above a item, and a rug on another item', 'an item on an floor, which is above a oven, and a rug on another floor', 'an rug on an oven, which is above a floor, and a item on another floor']",134.0,91.0,176.0,245.0
4351,"paper hanging on the wall, and the wall by the another wall. the light is reflecting off the floor.",8,5,3,0,2,"['light hanging on the wall, and the wall by the another wall. the paper is reflecting off the floor.', 'paper hanging on the floor, and the wall by the another wall. the light is reflecting off the wall.', 'paper hanging on the light, and the wall by the another wall. the wall is reflecting off the floor.', 'wall hanging on the paper, and the paper by the another paper. the light is reflecting off the floor.', 'paper reflecting off on the wall, and the wall by the another wall. the light is hanging the floor.']",19.0,15.0,456.0,483.0
4594,a car on the road with a sign on a pole and the sky in the background,8,5,3,0,2,"['a car on the sign with a road on a pole and the sky in the background', 'a sign on the road with a car on a pole and the sky in the background', 'a car on the sky with a sign on a pole and the road in the background', 'a sky on the road with a sign on a pole and the car in the background', 'a pole on the road with a sign on a car and the sky in the background']",130.0,5.0,517.0,554.0
4626,"a pillow and another pillow lying on a couch, and a frame on the wall",8,5,3,0,2,"['a couch and another pillow lying on a pillow, and a frame on the wall', 'a wall and another pillow lying on a couch, and a frame on the pillow', 'a frame and another pillow lying on a couch, and a pillow on the wall', 'a pillow and another pillow lying on a wall, and a frame on the couch', 'a pillow and another pillow lying on a frame, and a couch on the wall']",2.0,6.0,238.0,269.0
4641,a pillow on a chair in a living room with a table,8,4,3,1,1,"['a table on a chair in a living room with a pillow', 'a pillow on a living room in a chair with a table', 'a living room on a chair in a pillow with a table', 'a chair on a pillow in a living room with a table', 'a pillow on a table in a living room with a chair']",2.0,30.0,796.0,488.0
4724,a house with a yard in front of it and a driveway next to a fence. there is a van parked beside the house.,8,5,3,0,2,"['a van with a yard in front of it and a driveway next to a fence. there is a house parked beside the van.', 'a fence with a yard in front of it and a driveway next to a house. there is a van parked beside the fence.', 'a house with a yard beside it and a driveway next to a fence. there is a van parked in front of the house.', 'a house with a van in front of it and a driveway next to a fence. there is a yard parked beside the house.', 'a house with a yard in front of it and a driveway next to a van. there is a fence parked beside the house.']",4.0,17.0,393.0,249.0
4774,"a fence surrounding a building, with a bird fountain in front of it that is covered in snow, and a gate leading into the building",8,5,3,0,2,"['a fence surrounding a gate, with a bird fountain in front of it that is covered in snow, and a building leading into the gate', 'a bird fountain surrounding a building, with a fence in front of it that is covered in snow, and a gate leading into the building', 'a gate surrounding a building, with a bird fountain in front of it that is covered in snow, and a fence leading into the building', 'a fence surrounding a bird fountain, with a building in front of it that is covered in snow, and a gate leading into the bird fountain', 'a snow surrounding a building, with a bird fountain in front of it that is covered in fence, and a gate leading into the building']",0.0,1.0,398.0,295.0
4835,a tray of fish with papers behind it and the fish in a plastic container,8,4,3,1,1,"['a tray of papers with fish behind it and the papers in a plastic container', 'a tray of container with papers behind it and the fish in a plastic fish', 'a tray of fish with container behind it and the fish in a plastic papers', 'a papers of fish with tray behind it and the fish in a plastic container', 'a fish of tray with papers behind it and the fish in a plastic container']",23.0,60.0,450.0,315.0
4909,"a shelf with a camera on a table behind it, and a basket on another table",8,5,3,0,2,"['a shelf with a camera behind a table on it, and a basket behind another table', 'a shelf with a camera on a basket behind it, and a table on another basket', 'a basket with a camera on a table behind it, and a shelf on another table', 'a table with a camera on a shelf behind it, and a basket on another shelf', 'a shelf with a table on a camera behind it, and a basket on another camera']",0.0,117.0,359.0,281.0
4999,a building on the ground with a car next to it and people under the sky,8,5,3,0,2,"['a sky on the ground with a car next to it and people under the building', 'a building on the ground with a sky next to it and people under the car', 'a building under the ground with a car next to it and people on the sky', 'a building on the car with a ground next to it and people under the sky', 'a building on the sky with a car next to it and people under the ground']",0.0,8.0,640.0,471.0
2364412,"a sign with a screw in it that is attached to a pole, and a sticker with a word on it",8,5,3,0,2,"['a word with a screw in it that is attached to a pole, and a sticker with a sign on it', 'a sign with a screw in it that is attached to a word, and a sticker with a pole on it', 'a sign with a word in it that is attached to a pole, and a sticker with a screw on it', 'a sticker with a screw in it that is attached to a pole, and a sign with a word on it', 'a sign with a screw in it that is attached to a sticker, and a pole with a word on it']",128.0,37.0,210.0,367.0
2364425,"a girl with an arm on her and a bracelet, and a bottle on a ledge",8,5,3,0,2,"['a girl with an bottle on her and a bracelet, and a arm on a ledge', 'a bracelet with an arm on her and a girl, and a bottle on a ledge', 'a girl with an arm on her and a ledge, and a bottle on a bracelet', 'a bottle with an arm on her and a bracelet, and a girl on a ledge', 'a girl with an arm on her and a bracelet, and a ledge on a bottle']",1.0,140.0,258.0,246.0
2364574,"a door knob on a door that is in a home, and a table with a glass cover",8,5,3,0,2,"['a door knob on a door that is in a table, and a home with a glass cover', 'a glass cover knob on a door that is in a home, and a table with a door', 'a table knob on a table that is in a home, and a door with a glass cover', 'a door on a door knob that is in a home, and a table with a glass cover', 'a glass cover on a door that is in a home, and a table with a door knob']",0.0,2.0,498.0,330.0
2364659,"a window on a tower, a structure by the building, and vents on the window",8,5,3,0,2,"['a building on a tower, a structure by the window, and vents on the building', 'a tower on a window, a structure by the building, and vents on the tower', 'a vents on a tower, a structure by the building, and window on the vents', 'a window on a vents, a structure by the building, and tower on the window', 'a structure on a tower, a window by the building, and vents on the structure']",7.0,32.0,273.0,466.0
2364814,a man wearing shoes and shorts and holding a racket on a court.,8,5,3,0,2,"['a racket wearing shoes and shorts and holding a man on a court.', 'a court wearing shoes and shorts and holding a racket on a man.', 'a man wearing racket and shorts and holding a shoes on a court.', 'a man wearing shoes and racket and holding a shorts on a court.', 'a man wearing shoes and shorts and holding a court on a racket.']",87.0,76.0,344.0,256.0
2364824,a person wearing shorts and a watch on their wrist sitting on a bench,8,5,3,0,2,"['a person wearing shorts and a bench on their wrist sitting on a watch', 'a person wearing woman and a watch on their wrist sitting on a bench', 'a person wearing shorts and a watch on their wrist sitting on a woman', 'a bench wearing shorts and a watch on their wrist sitting on a person', 'a person wearing bench and a watch on their wrist sitting on a shorts']",177.0,0.0,320.0,399.0
2365103,"a team in the dugout by a baseball field, and a man swinging a bat",8,5,3,0,2,"['a man in the dugout by a baseball field, and a team swinging a bat', 'a team in the man by a baseball field, and a dugout swinging a bat', 'a bat in the dugout by a baseball field, and a man swinging a team', 'a team in the bat by a baseball field, and a man swinging a dugout', 'a team in the dugout by a bat, and a man swinging a baseball field']",4.0,72.0,492.0,256.0
2365114,"a kite in the sky with wires attached to it, and waves in an ocean.",8,5,3,0,2,"['a ocean in the sky with wires attached to it, and waves in an kite.', 'a wires in the sky with kite attached to it, and waves in an ocean.', 'a kite in the sky with ocean attached to it, and waves in an wires.', 'a kite in the sky with waves attached to it, and wires in an ocean.', 'a waves in the sky with wires attached to it, and kite in an ocean.']",0.0,5.0,375.0,493.0
