image_id,caption,n,n_objects,n_relations,n_attributes,n_connected_components,hard_negs,x,y,width,height
2360729,"a bookshelf with a book and some books under a television, and an award on the bookshelf",8,5,3,0,2,"['a bookshelf with a book and some books under a book shelf, and an award on the bookshelf', 'a booktelevision with a book and some books under a shelf, and an award on the booktelevision', 'a awardshelf with a book and some books under a television, and an book on the awardshelf', 'a televisionshelf with a television and some televisions under a book, and an award on the televisionshelf', 'a bookshelfshelf with a bookshelf and some bookshelfs under a television, and an award on the bookshelfshelf']",6.0,5.0,367.0,491.0
2360747,"the engine of a bus and the lettering on the bus, with a light on a pole",8,5,3,0,2,"['the engine of a lettering and the bus on the lettering, with a light on a pole', 'the engine of a bus and the pole on the bus, with a light on a lettering', 'the light of a bus and the lettering on the bus, with a engine on a pole', 'the engine of a light and the lettering on the light, with a bus on a pole', 'the pole of a bus and the lettering on the bus, with a light on a engine']",34.0,1.0,418.0,235.0
2360753,"ady has a head with a mouth, and a shadow on the wall",8,5,3,0,2,"['ady has a head with a wall, and a shadow on the mouth', 'wall has a head with a mouth, and a shadow on the ady', 'ady has a wall with a mouth, and a shadow on the head', 'ady has a shadow with a mouth, and a head on the wall', 'ady has a head with a mouth, and a wall on the shadow']",1.0,1.0,373.0,498.0
2360756,a chair with a leg on it is on the floor. a lady is petting a cat.,8,5,3,0,2,"['a lady with a leg on it is on the floor. a chair is petting a cat.', 'a cat with a leg on it is on the floor. a lady is petting a chair.', 'a chair with a leg on it is on the floor. a cat is petting a lady.', 'a chair with a leg on it is on the lady. a floor is petting a cat.', 'a chair with a leg on it is on the cat. a lady is petting a floor.']",4.0,54.0,495.0,276.0
2360786,the part of a metal faucet that is on a sink with a mirror above the sink,8,4,3,1,1,"['the mirror of a metal faucet that is on a sink with a part above the sink', 'the part of a metal faucet that is on a mirror with a sink above the mirror', 'the sink of a metal faucet that is on a part with a mirror above the sink', 'the part of a sink that is on a metal faucet with a mirror above the sink', 'the part of a mirror that is on a sink with a metal faucet above the sink']",49.0,54.0,147.0,279.0
2360793,spoon in bowl containing cereal on table made wood,8,5,3,0,2,"['wood in bowl containing cereal on table made spoon', 'spoon in bowl containing table on cereal made wood', 'cereal in bowl containing spoon on table made wood', 'spoon in table containing cereal on bowl made wood', 'table in bowl containing cereal on spoon made wood']",1.0,9.0,493.0,380.0
2360797,tile around window in shower with dispensers on wall,8,5,3,0,2,"['tile in warounddow around shower with dispensers on wall', 'tile around wall in shower with dispensers on window', 'tile around dispensers in shower with window on wall', 'wall around window in shower with dispensers on tile', 'window around tile in shower with dispensers on wall']",60.0,0.0,271.0,428.0
2360800,"an outfielder waiting for play, a player playing the game, and a baseball pitcher playing the game",8,5,3,0,2,"['an baseball pitcher waiting for play, a player playing the game, and a outfielder playing the game', 'an outfielder waiting for play, a baseball pitcher playing the game, and a player playing the game', 'an outfielder playing play, a player waiting for the game, and a baseball pitcher waiting for the game', 'an game waiting for play, a player playing the outfielder, and a baseball pitcher playing the game', 'an play waiting for outfielder, a player playing the game, and a baseball pitcher playing the game']",4.0,64.0,492.0,268.0
2360801,a pizza with chicken and bacon on it and another pizza with cheese on it,8,5,3,0,2,"['a cheese with chicken and bacon on it and another pizza with pizza on it', 'a pizza with cheese and bacon on it and another pizza with chicken on it', 'a bacon with chicken and pizza on it and another bacon with cheese on it', 'a pizza with chicken and cheese on it and another pizza with bacon on it', 'a chicken with pizza and bacon on it and another chicken with cheese on it']",4.0,176.0,337.0,280.0
2360808,cauliflower through another cauliflower and cheese covers casserole with crumbs,8,5,3,0,2,"['casserole through another casserole and cheese covers cauliflower with crumbs', 'cauliflower through another cauliflower and casserole covers cheese with crumbs', 'cauliflower covers another cauliflower and cheese through casserole with crumbs', 'cheese through another cheese and cauliflower covers casserole with crumbs', 'crumbs through another crumbs and cheese covers casserole with cauliflower']",1.0,15.0,497.0,348.0
2360814,a fork on a plate with a dish of food that contains broccoli,8,5,3,0,2,"['a food on a plate with a dish of fork that contains broccoli', 'a broccoli on a plate with a dish of food that contains fork', 'a plate on a fork with a dish of food that contains broccoli', 'a fork on a plate with a food of dish that contains broccoli', 'a fork on a broccoli with a dish of food that contains plate']",5.0,27.0,494.0,346.0
2360855,"three people on a bed, with a girl wearing pants, and a board on the bed",8,5,3,0,2,"['three people on a girl, with a bed wearing pants, and a board on the girl', 'three people on a board, with a girl wearing pants, and a bed on the board', 'three people on a pants, with a girl wearing bed, and a board on the pants', 'three people on a bed, with a board wearing pants, and a girl on the bed', 'three people on a bed, with a girl wearing board, and a pants on the bed']",0.0,9.0,500.0,316.0
2360882,train on railway tracks with power lines above it and a car on the train,8,5,3,0,2,"['power lines on railway tracks with train above it and a car on the power lines', 'train on power lines tracks with railway above it and a car on the train', 'train above railway tracks with power lines on it and a car above the train', 'train on car tracks with power lines above it and a railway on the train', 'car on railway tracks with power lines above it and a train on the car']",46.0,1.0,452.0,325.0
2360920,"a person with a face and a leg, and a tree behind them",8,4,4,0,1,"['a person with a face and a tree, and a leg behind them', 'a tree with a face and a leg, and a person behind them', 'a leg with a face and a person, and a tree behind them', 'a person with a tree and a leg, and a face behind them', 'a person with a face and a leg, and a tree has them']",148.0,52.0,342.0,295.0
2360933,"a meter on a motorcycle, and a cap on a tank. the motorcycle is on the street.",8,5,3,0,2,"['a meter on a cap, and a motorcycle on a tank. the cap is on the street.', 'a meter on a motorcycle, and a street on a tank. the motorcycle is on the cap.', 'a meter on a tank, and a cap on a motorcycle. the tank is on the street.', 'a meter on a motorcycle, and a tank on a cap. the motorcycle is on the street.', 'a meter on a motorcycle, and a cap on a street. the motorcycle is on the tank.']",0.0,1.0,499.0,372.0
2360935,"a laptop on a computer desk, a water bottle on the computer desk, and a mouse on the computer desk",8,5,3,0,2,"['a laptop on a mouse, a water bottle on the mouse, and a computer desk on the mouse', 'a laptop on a water bottle desk, a computer on the water bottle desk, and a mouse on the computer desk', 'a computer desk on a laptop, a water bottle on the laptop, and a mouse on the laptop', 'a computer on a laptop desk, a water bottle on the computer desk, and a mouse on the computer desk', 'a laptop on a water bottle, a computer desk on the water bottle, and a mouse on the water bottle']",251.0,122.0,225.0,252.0
2360963,"a hand holding an apple, and a woman looking at the lady holding the apple",8,4,4,0,1,"['a apple holding an hand, and a woman looking at the lady holding the apple', 'a woman holding an apple, and a hand looking at the lady holding the apple', 'a hand holdlooking atg an apple, and a woman looklooking atg at the lady holdlooking atg the apple', 'a hand holding an lady, and a woman looking at the apple holding the lady', 'a hand holding an woman, and a apple looking at the lady holding the woman']",59.0,41.0,272.0,264.0
2360977,a bench in a park with an arm and a floor below it,8,4,4,0,1,"['a bench in a floor with an arm and a park below it', 'a bench with a a park inn arm and a floor below it', 'a floor in a park with an arm and a bench below it', 'a bench below a park with an arm and a floor in it', 'a bench in a park with an arm and a floor of a it']",9.0,14.0,488.0,357.0
2360988,"a cow with legs and a mouth, eating grass from the stomach",8,5,3,0,2,"['a cow with grass and a mouth, eating legs from the stomach', 'a mouth with legs and a cow, eating grass from the stomach', 'a legs with cow and a mouth, eating grass from the stomach', 'a stomach with legs and a mouth, eating grass from the cow', 'a cow with stomach and a mouth, eating grass from the legs']",1.0,88.0,495.0,286.0
2361001,"a giraffe with a shadow and the sky above it, and another giraffe in the first giraffe",8,4,3,1,1,"['a sky with a shadow and the giraffe above it, and another sky in the first sky', 'a shadow with a giraffe and the sky above it, and another shadow in the first shadow', 'a giraffe with a shadow and the sky above it, and another giraffe of the first giraffe', 'a giraffe with a sky and the shadow above it, and another giraffe in the first giraffe', 'a giraffe with a shadow and the sky of it, and another giraffe in the first giraffe']",1.0,3.0,497.0,451.0
2361009,a hole in a fence and a stop sign on another fence with a pole,8,5,3,0,2,"['a hole in a stop sign and a fence on another stop sign with a pole', 'a hole in a pole and a stop sign on another pole with a fence', 'a pole in a fence and a stop sign on another fence with a hole', 'a fence in a hole and a stop sign on another hole with a pole', 'a stop sign in a fence and a hole on another fence with a pole']",2.0,1.0,495.0,410.0
2361029,"a boy with a hand holding an object in front of him, and a tissue box behind him",8,4,4,0,1,"['a boy with a tissue box holding an object in front of him, and a hand behind him', 'a tissue box with a hand holding an object in front of him, and a boy behind him', 'a object with a hand holding an boy in front of him, and a tissue box behind him', 'a boy with a hand holdbehindg an object in front of him, and a tissue box in him', 'a boy with a hand behind an object in front of him, and a tissue box holding him']",0.0,41.0,403.0,458.0
2361034,"a man kneeling on a blanket with a bike in the shade, and a dent in the bike",8,5,3,0,2,"['a shade kneeling on a blanket with a bike in the man, and a dent in the bike', 'a man kneeling on a bike with a blanket in the shade, and a dent in the blanket', 'a man kneeling on a blanket with a shade in the bike, and a dent in the shade', 'a bike kneeling on a blanket with a man in the shade, and a dent in the man', 'a man kneeling on a dent with a bike in the shade, and a blanket in the bike']",15.0,34.0,484.0,459.0
2361037,a pond in a zoo with elephants on the ground and a fence nearby,8,5,3,0,2,"['a pond in a fence with elephants on the ground and a zoo nearby', 'a pond in a zoo with fence on the ground and a elephants nearby', 'a fence in a zoo with elephants on the ground and a pond nearby', 'a pond in a elephants with zoo on the ground and a fence nearby', 'a pond in a zoo with elephants on the fence and a ground nearby']",0.0,1.0,500.0,453.0
2361039,a knife handle sticking out from between a plate of food and mashed potatoes,8,5,3,0,2,"['a knife food sticking out from between a plate of handle and mashed potatoes', 'a potatoes handle sticking out from between a plate of food and mashed knife', 'a knife plate sticking out from between a handle of food and mashed potatoes', 'a plate handle sticking out from between a knife of food and mashed potatoes', 'a food handle sticking out from between a plate of knife and mashed potatoes']",113.0,68.0,331.0,306.0
2361055,"a cat on a sheet, with a baby near it and a pillow behind it",8,5,3,0,2,"['a cat on a pillow, with a baby near it and a sheet behind it', 'a cat behind a sheet, with a baby near it and a pillow on it', 'a baby on a sheet, with a cat near it and a pillow behind it', 'a pillow on a sheet, with a baby near it and a cat behind it', 'a cat on a baby, with a sheet near it and a pillow behind it']",0.0,174.0,332.0,325.0
2361070,"a man in a hotel room, jumping on the bed with his shoe and pants on",8,5,3,0,2,"['a man in a hotel room, jumping on the shoe with his bed and pants on', 'a bed in a hotel room, jumping on the man with his shoe and pants on', 'a shoe in a hotel room, jumping on the bed with his man and pants on', 'a man in a hotel room, jumping on the pants with his shoe and bed on', 'a pants in a hotel room, jumping on the bed with his shoe and man on']",16.0,18.0,483.0,356.0
2361077,a horse on water with its hair growing and a reflection appearing in the water,8,5,3,0,2,"['a horse on water with its reflection growing and a hair appearing in the water', 'a horse on reflection with its hair growing and a water appearing in the reflection', 'a hair on water with its horse growing and a reflection appearing in the water', 'a reflection on water with its hair growing and a horse appearing in the water', 'a water on horse with its hair growing and a reflection appearing in the horse']",26.0,35.0,431.0,362.0
2361090,"a woman holding a remote in her hand, with a wall behind her and glasses on",8,5,3,0,2,"['a woman holding a remote in her wall, with a hand behind her and glasses on', 'a woman holding a glasses in her hand, with a wall behind her and remote on', 'a glasses holding a remote in her hand, with a wall behind her and woman on', 'a woman holding a remote in her hand, with a wall on her and glasses behind', 'a woman holding a wall in her hand, with a remote behind her and glasses on']",1.0,1.0,400.0,498.0
2361127,a motorcycle inside of a lot with a vehicle in front of a store and a shadow on top of the lot,8,5,3,0,2,"['a motorcycle in front of a lot with a vehicle inside of a store and a shadow on top of the lot', 'a store inside of a lot with a vehicle in front of a motorcycle and a shadow on top of the lot', 'a motorcycle on top of a lot with a vehicle in front of a store and a shadow inside of the lot', 'a shadow inside of a lot with a vehicle in front of a store and a motorcycle on top of the lot', 'a motorcycle inside of a lot with a vehicle in front of a store and a ground on top of the lot']",1.0,25.0,498.0,348.0
2361139,"a seam sewn across a jacket, a woman wearing the jacket, and a kite flying in the sky",8,5,3,0,2,"['a seam sewn across a kite, a woman wearing the kite, and a jacket flying in the sky', 'a kite sewn across a jacket, a woman wearing the jacket, and a seam flying in the sky', 'a seam sewn across a woman, a jacket wearing the woman, and a kite flying in the sky', 'a seam sewn across a jacket, a kite wearing the jacket, and a woman flying in the sky', 'a seam flying in a jacket, a woman wearing the jacket, and a kite sewn across the sky']",2.0,14.0,307.0,484.0
2361143,"a person in a suit with an umbrella over the snow, which has a footprint in it.",8,5,3,0,2,"['a umbrella in a suit with an person over the snow, which has a footprint in it.', 'a snow in a suit with an umbrella over the person, which has a footprint in it.', 'a person in a footprint with an umbrella over the snow, which has a suit in it.', 'a person in a umbrella with an suit over the snow, which has a footprint in it.', 'a footprint in a suit with an umbrella over the snow, which has a person in it.']",4.0,14.0,494.0,318.0
2361145,a man in gray shorts is casting a shadow on a fence behind him,8,4,3,1,1,"['a man in gray shorts is casting a shadow on a fence covering him', 'a shadow in gray shorts is casting a man on a fence behind him', 'a man in gray fence is casting a shadow on a shorts behind him', 'a man in gray shorts is casting a fence on a shadow behind him', 'a fence in gray shorts is casting a shadow on a man behind him']",0.0,1.0,499.0,324.0
2361147,"an airplane on a pavement with windows, and a man holding an object",8,5,3,0,2,"['an airplane on a man with windows, and a pavement holding an object', 'an man on a pavement with windows, and a airplane holding an object', 'an airplane holding a pavement with windows, and a man on an object', 'an pavement on a airplane with windows, and a man holding an object', 'an airplane on a pavement with windows, and a object holding an man']",5.0,23.0,226.0,378.0
2361154,"a hand holding a pair of scissors, with a finger on the bolt",8,4,4,0,1,"['a hand holding a pair of bolt, with a finger on the scissors', 'a bolt holding a pair of scissors, with a finger on the hand', 'a scissors holding a pair of hand, with a finger on the bolt', 'a finger holding a pair of scissors, with a hand on the bolt', 'a hand holding a pair of scissors, with a bolt on the finger']",1.0,40.0,473.0,392.0
2361163,"buildings in the background, another building behind a fence, and a fence on a pole",8,5,3,0,2,"['pole in the background, another building behind a fence, and a fence on a buildings', 'fence in the background, another building behind a buildings, and a buildings on a pole', 'fencing in the background, another building behind a fence, and a fence on a pole', 'poles in the background, another pole behind a fence, and a fence on a building', 'fencings in the background, another fencing behind a fence, and a fence on a pole']",0.0,3.0,499.0,371.0
2361172,"a napkin holder by the toilet in the bathroom, and a rug on the floor",8,5,3,0,2,"['a napkin toilet by the holder in the bathroom, and a rug on the floor', 'a napkin rug by the toilet in the bathroom, and a holder on the floor', 'a toilet holder by the napkin in the bathroom, and a rug on the floor', 'a rug holder by the toilet in the bathroom, and a napkin on the floor', 'a napkin holder by the toilet in the rug, and a bathroom on the floor']",0.0,0.0,498.0,330.0
2361221,"arches framing windows on a building, and a tree in a town square",8,5,3,0,2,"['arches framing tree on a building, and a windows in a town square', 'town square framing windows on a building, and a tree in a arches', 'windows framing arches on a building, and a tree in a town square', 'building framing windows on a arches, and a tree in a town square', 'tree framing windows on a building, and a arches in a town square']",17.0,65.0,480.0,305.0
2361223,a flower in a vase with rings and another vase in front of a wall,8,5,3,0,2,"['a wall in a vase with rings and another vase in front of a flower', 'a flower in a vase with rings and another vase sitting in a wall', 'a rings in a vase with flower and another vase in front of a wall', 'a flower in a rings with vase and another rings in front of a wall', 'a flower in a wall with rings and another vase in front of a vase']",3.0,1.0,426.0,497.0
2361260,"a corner on a suitcase that is sitting on a bed, and a marking on the suitcase",8,5,3,0,2,"['a suitcase on a corner that is sitting on a bed, and a marking on the suitcase', 'a corner on a marking that is sitting on a bed, and a suitcase on the marking', 'a marking on a suitcase that is sitting on a bed, and a corner on the suitcase', 'a corner on a bed that is sitting on a suitcase, and a marking on the bed', 'a corner on a suitcase that is sitting on a marking, and a bed on the suitcase']",0.0,96.0,332.0,402.0
2361266,"a faucet on a sink and a razor in the sink, and a hole in another sink",8,5,3,0,2,"['a faucet on a hole and a razor in the sink, and a sink in another hole', 'a faucet on a sofk and a razor of the sofk, and a hole of another sofk', 'a sink on a faucet and a razor in the sink, and a hole in another sink', 'a faucet on a razor and a sink in the razor, and a hole in another sink', 'a hole on a sink and a razor in the sink, and a faucet in another sink']",2.0,102.0,496.0,271.0
2361366,"a person with a nose, rolling in money on a bed full of money",8,4,3,1,1,"['a bed with a nose, rolling in money on a person full of money', 'a person with a nose, rolling in bed on a money full of bed', 'a person with a bed, rolling in money on a nose full of money', 'a money with a nose, rolling in person on a bed full of money', 'a person with a money, rolling in nose on a bed full of nose']",0.0,1.0,498.0,372.0
2361401,a giraffe walking in an enclosure with a branch next to it. the branch is on a tree.,8,4,3,1,1,"['a giraffe walking in an tree with a branch next to it. the branch is on a enclosure.', 'a giraffe next to an enclosure with a branch walking in it. the branch is on a tree.', 'a branch walking in an enclosure with a giraffe next to it. the branch is on a tree.', 'a tree walking in an enclosure with a branch next to it. the branch is on a giraffe.', 'a giraffe walking in an enclosure with a tree next to it. the tree is on a branch.']",0.0,0.0,332.0,406.0
2361412,"a stop sign at the intersection of a road with a left turn lane, with the shadow of the stop sign on the road",8,5,2,1,3,"['a shadow sign at the intersection of a road with a left turn lane, with the stop of the shadow sign on the road', 'a left sign at the intersection of a road with a stop turn lane, with the shadow of the left sign on the road', 'a stop sign at the intersection of a left with a road turn lane, with the shadow of the stop sign on the left', 'a stop sign at the intersection of a shadow with a left turn lane, with the road of the stop sign on the shadow', 'a road sign at the intersection of a stop with a left turn lane, with the shadow of the road sign on the stop']",0.0,0.0,373.0,499.0
2361639,a bedspread of diamond and a space underneath the bed in a room,8,5,3,0,2,"['a blanketspread of diamond and a space underneath the blanket in a room', 'a patternspread of diamond and a space underneath the pattern in a room', 'a bedspread of blanket and a space underneath the bed in a room', 'a bedspread of sheets and a space underneath the bed in a room', 'a spacespread of diamond and a bed underneath the space in a room']",1.0,1.0,499.0,374.0
2361641,a train on tracks with gravel underneath and windows on the train,8,4,4,0,1,"['a train under tracks with gravel onneath and windows under the train', 'a gravel on tracks with train underneath and windows on the gravel', 'a train on windows with gravel underneath and tracks on the train', 'a train on tracks with windows underneath and gravel on the train', 'a windows on tracks with gravel underneath and train on the windows']",1.0,203.0,331.0,288.0
2361645,a man with his arm around a cake with letters on the side of it that is on a tray,8,5,3,0,2,"['a cake with his arm around a man with letters on the side of it that is on a tray', 'a tray with his arm around a cake with letters on the side of it that is on a man', 'a man with his letters around a cake with arm on the side of it that is on a tray', 'a man with his cake around a arm with letters on the side of it that is on a tray', 'a man with his tray around a cake with letters on the side of it that is on a arm']",1.0,1.0,450.0,328.0
2361669,"pipes connected to a toilet, gloves above the toilet, and seat covers on the wall",8,5,3,0,2,"['toilet connected to a pipes, gloves above the toilet, and seat covers on the wall', 'wall connected to a toilet, gloves above the toilet, and seat covers on the pipes', 'pipes connected to a wall, gloves above the wall, and seat covers on the toilet', 'gloves connected to a toilet, pipes above the toilet, and seat covers on the wall', 'pipes connected to a gloves, toilet above the gloves, and seat covers on the wall']",108.0,8.0,260.0,459.0
2361694,"a bat with a child, and an adult and child. there is a tree behind the child.",8,4,4,0,1,"['a adult with a child, and an bat and child. there is a tree behind the child.', 'a bat with a adult, and an child and adult. there is a tree behind the adult.', 'a tree with a child, and an adult and child. there is a bat behind the child.', 'a bat with a tree, and an adult and tree. there is a child behind the tree.', 'a bat behind a child, and an adult and child. there is a tree with the child.']",0.0,0.0,491.0,291.0
2361704,a cup on top of a dispenser and a lamp in a bathroom,8,5,3,0,2,"['a cup on top of a dispenser and a bathroom in a lamp', 'a bathroom on top of a dispenser and a lamp in a cup', 'a dispenser on top of a cup and a lamp in a bathroom', 'a cup on top of a bathroom and a lamp in a dispenser', 'a lamp on top of a dispenser and a cup in a bathroom']",5.0,7.0,328.0,472.0
2361706,a cat wearing a tie and a hand holding the cat with stripes on its face,8,5,3,0,2,"['a cat wearing a stripes and a hand holding the cat with tie on its face', 'a face wearing a tie and a hand holding the face with stripes on its cat', 'a cat wearing a tie and a face holding the cat with stripes on its hand', 'a tie wearing a cat and a hand holding the tie with stripes on its face', 'a stripes wearing a tie and a hand holding the stripes with cat on its face']",20.0,22.0,411.0,476.0
2361727,"a glass on a table, with ice in it and food in a bowl",8,5,3,0,2,"['a food on a table, with ice in it and glass in a bowl', 'a bowl on a table, with ice in it and food in a glass', 'a table on a glass, with ice in it and food in a bowl', 'a glass on a food, with ice in it and table in a bowl', 'a glass on a bowl, with ice in it and food in a table']",1.0,1.0,374.0,498.0
