image_id,caption,n,n_objects,n_relations,n_attributes,n_connected_components,hard_negs,x,y,width,height
2365811,"an elephant in a river with tusks, and the river goes around the elephant. there is a jungle nearby",8,5,3,0,3,"['an river in a elephant with tusks, and the elephant goes around the river. there is a jungle nearby', 'an elephant around a river with tusks, and the river goes in the elephant. there is a jungle nearby', 'an jungle in a river with tusks, and the river goes around the elephant. there is a elephant nearby', 'an elephant in a ear with tusks, and the ear goes around the elephant. there is a jungle nriverby', 'an ear in a river with tusks, and the river goes around the elephant. there is a jungle nelephantby']",21.0,15.0,477.0,343.0
2365822,"cereal in a bowl with a raisin, and a napkin on a mat",8,5,3,0,2,"['cereal in a plate with a raisin, and a napkin on a mat', 'mat in a bowl with a raisin, and a napkin on a cereal', 'cereal in a bowl with a raisin, and a mat on a napkin', 'napkin in a bowl with a raisin, and a cereal on a mat', 'plate in a bowl with a raisin, and a napkin on a mat']",121.0,102.0,334.0,173.0
2365902,"a man wearing eyewear on his head, on a board, with a building behind him.",8,5,3,0,2,"['a building wearing eyewear on his head, on a board, with a man behind him.', 'a board wearing eyewear on his head, on a man, with a building behind him.', 'a man wearing building on his head, on a board, with a eyewear behind him.', 'a man wearing eyewear behind his head, on a board, with a building on him.', 'a man wearing board on his head, on a eyewear, with a building behind him.']",199.0,53.0,258.0,277.0
2365918,"a man in shorts on a field, and a frisbee flying in the air",8,5,3,0,2,"['a man in frisbee on a field, and a shorts flying in the air', 'a man in shorts on a field, and a grass flying in the air', 'a man in shorts on a person, and a frisbee flying in the air', 'a man in shorts on a field, and a frisbee flying in the ground', 'a frisbee in shorts on a field, and a man flying in the air']",1.0,2.0,330.0,497.0
2365944,a cat playing in a sink on a chrome faucet with a toilet behind it,8,4,3,1,1,"['a toilet playing in a sink on a chrome faucet with a cat behind it', 'a faucet playing in a sink on a chrome cat with a toilet behind it', 'a sink playing in a cat on a chrome faucet with a toilet behind it', 'a cat playing in a toilet on a chrome faucet with a sink behind it', 'a cat playing in a sink on a chrome toilet with a faucet behind it']",7.0,37.0,492.0,336.0
2365950,"a button on a pocket of a shirt, and a man with an eye",8,5,3,0,2,"['a button on a pocket of a eye, and a man with an shirt', 'a button on a man of a shirt, and a pocket with an eye', 'a eye on a pocket of a shirt, and a man with an button', 'a shirt on a pocket of a button, and a man with an eye', 'a button on a eye of a shirt, and a man with an pocket']",100.0,49.0,313.0,283.0
2365951,a truck with yellow paint and head lights in front of a building,8,4,3,1,1,"['a truck with yellow paint and concrete truck in front of a building', 'a truck with headlights paint and head lights in front of a building', 'a truck with yellow paint and head lights in front of a concrete truck', 'a truck with concrete truck paint and head lights in front of a building', 'a truck with building paint and head lights in front of a yellow']",0.0,0.0,455.0,263.0
2365952,"a building with two clocks and a pine tree next to it, open to the sky",8,4,3,1,1,"['a building with two tree and a pine clocks next to it, open to the sky', 'a building with tower and a pine tree next to it, open to the sky', 'a trees with two clocks and a pine tree next to it, open to the sky', 'a building with two tower and a pine tree next to it, open to the sky', 'a sky with two clocks and a pine tree next to it, open to the building']",1.0,1.0,498.0,427.0
2365981,"a boy against a wall with a line on top of the court, and time on front of the wall",8,5,3,0,2,"['a wall against a boy with a line on top of the court, and time on front of the wall', 'a line against a wall with a boy on top of the court, and time on front of the wall', 'a boy on top of a wall with a line against the court, and time on front of the wall', 'a boy against a time with a line on top of the court, and wall on front of the time', 'a boy against a line with a wall on top of the court, and time on front of the line']",2.0,91.0,496.0,322.0
2365996,"there are pebbles on the ground, a pole on the bench, and a cat on the bench.",8,5,3,0,2,"['there are cat on the ground, a pole on the bench, and a pebbles on the bench.', 'there are pebbles on the pole, a ground on the bench, and a cat on the bench.', 'there are pebbles on the ground, a pole on the cat, and a bench on the cat.', 'there are pebbles on the ground, a bench on the pole, and a cat on the bench.', 'there are pebbles on the cat, a pole on the bench, and a ground on the bench.']",1.0,89.0,394.0,410.0
2366072,"tape below the microwave, a counter on top of the cabinet, and buttons on the microwave",8,5,3,0,2,"['tape below the counter, a microwave on top of the cabinet, and buttons on the counter', 'cabinet below the microwave, a counter on top of the tape, and buttons on the microwave', 'microwave below the tape, a counter on top of the cabinet, and buttons on the tape', 'tape on top of the microwave, a counter below the cabinet, and buttons on the microwave', 'tape on the microwave, a counter below top of the cabinet, and buttbelows below the microwave']",37.0,1.0,456.0,369.0
2366082,"a man wearing gloves and sunglasses, with a sign behind him, and a truck behind the sign",8,5,3,0,2,"['a man behind gloves and sunglasses, with a sign wearing him, and a truck wearing the sign', 'a man wearing gloves and sign, with a sunglasses behind him, and a truck behind the sunglasses', 'a truck wearing gloves and sunglasses, with a sign behind him, and a man behind the sign', 'a man wearing gloves and sunglasses, with a truck behind him, and a sign behind the truck', 'a man wearing sign and sunglasses, with a gloves behind him, and a truck behind the gloves']",63.0,25.0,277.0,307.0
2366132,"a smoke stack of a train, people on the platform, and numbers on the train",8,5,3,0,2,"['a smoke stack of a people, train on the platform, and numbers on the people', 'a people of a train, smoke stack on the platform, and numbers on the train', 'a numbers of a train, people on the platform, and smoke stack on the train', 'a smoke stack of a platform, people on the train, and numbers on the platform', 'a smoke stack of a numbers, people on the platform, and train on the numbers']",93.0,114.0,243.0,189.0
2366145,"there is a zebra on dirt with a brush, and the hair is between the ear.",8,5,3,0,2,"['there is a zebra between dirt with a brush, and the hair is on the ear.', 'there is a zebra on dirt with a hair, and the brush is between the ear.', 'there is a hair on dirt with a brush, and the zebra is between the ear.', 'there is a zebra on ear with a brush, and the hair is between the dirt.', 'there is a zebra on dirt with a brush, and the ear is between the hair.']",68.0,109.0,426.0,229.0
2366145,"a zebra with stripes and a tail, and a tree next to it with leaves",8,5,3,0,2,"['a tail with stripes and a zebra, and a tree next to it with leaves', 'a leaves with stripes and a tail, and a tree next to it with zebra', 'a zebra with tree and a tail, and a stripes next to it with leaves', 'a stripes with zebra and a tail, and a tree next to it with leaves', 'a zebra with stripes and a leaves, and a tree next to it with tail']",5.0,5.0,316.0,290.0
2366247,a man with a ring and a starfish on a cake with a topper,8,5,3,0,2,"['a man with a hand and a starfish on a cake with a topper', 'a man with a top and a starfish on a cake with a ringper', 'a man with a ring and a starfish on a cake with a figurineper', 'a man with a ring and a top on a cake with a starfishper', 'a starfish with a ring and a man on a cake with a topper']",111.0,56.0,341.0,223.0
2366296,"water with ice and a tail sticking out, and a duck with an eye",8,5,3,0,2,"['eye with ice and a tail sticking out, and a duck with an water', 'water with eye and a tail sticking out, and a duck with an ice', 'water with ice and a eye sticking out, and a duck with an tail', 'duck with ice and a tail sticking out, and a water with an eye', 'water with duck and a tail sticking out, and a ice with an eye']",1.0,1.0,498.0,299.0
2366317,"a headboard on a bed, with feet of a man and a bear between the feet",8,5,3,0,2,"['a headboard on a feet, with bed of a man and a bear between the feet', 'a feet on a bed, with headboard of a man and a bear between the headboard', 'a headboard on a bed, with bear of a man and a feet between the bear', 'a headboard on a bed, with dresser of a man and a bear between the dresser', 'a headboard on a two feet, with feet of a man and a bear between the feet']",4.0,6.0,495.0,367.0
2366342,a table with food on top of it and paper under the food. there are also fries on the food.,8,4,4,0,1,"['a table with food on top of it and sandwich under the food. there are also fries on the food.', 'a table with sandwich on top of it and paper under the food. there are also fries on the food.', 'a table with food under top of it and paper on the food. there are also fries under the food.', 'a sandwich with food on top of it and paper under the food. there are also fries on the food.', 'a table with paper on top of it and food under the paper. there are also fries on the food.']",1.0,37.0,499.0,295.0
2366346,"a giraffe with horns and a tail, standing in front of a fence with grass near it",8,5,3,0,2,"['a giraffe with fence and a tail, standing in front of a horns with grass near it', 'a fence with horns and a tail, standing in front of a giraffe with grass near it', 'a tail with horns and a giraffe, standing in front of a fence with grass near it', 'a giraffe with horns and a tail, standing in front of a fence with grass behind it', 'a grass with horns and a tail, standing in front of a fence with giraffe near it']",238.0,147.0,260.0,227.0
2366392,tents in a park with trees in the background and a patch of grass in the foreground,8,5,3,0,2,"['tents in a park with row in the background and a patch of grass in the foreground', 'tents are beyond a park with trees in the background and a patch of grass in the foreground', 'row in a park with trees in the background and a patch of grass in the foreground', 'tents in a park with trees in the background and a patch are beyond grass in the foreground', 'tents in a park with trees in the background and a patch of bunch in the foreground']",1.0,42.0,498.0,306.0
2366404,"the train is tilted on the tracks with headlights on, and bushes are beside the tracks.",8,5,3,0,2,"['the grasses is tilted on the tracks with headlights on, and bushes are beside the tracks.', 'the lights is tilted on the tracks with headtrain on, and bushes are beside the tracks.', 'the train is tilted on the gravel with headlights on, and bushes are beside the tracks.', 'the headlights is tilted on the tracks with train on, and bushes are beside the tracks.', 'the train is tilted on the lights with headtracks on, and bushes are beside the lights.']",90.0,71.0,409.0,261.0
2366443,"a tongue sticking out and next to a key, and another key on a keyboard with a prop under it",8,5,3,0,2,"['a keyboard sticking out and next to a key, and another key on a tongue with a prop under it', 'a key sticking out and next to a tongue, and another key on a keyboard with a prop under it', 'a tundergue sticking out and next to a key, and another key on a keyboard with a prop on it', 'a tongue sticking out and next to a prop, and another prop on a propboard with a key under it', 'a prop sticking out and next to a key, and another key on a keyboard with a tongue under it']",116.0,167.0,351.0,187.0
2366466,"a room with a window and a woman, and a float in the window",8,5,3,0,2,"['a room with a whasdow and a woman, and a float has the whasdow', 'a room with a float and a woman, and a window in the float', 'a window with a room and a woman, and a float in the room', 'a room with a window and a float, and a woman in the window', 'a float with a window and a woman, and a room in the window']",1.0,1.0,498.0,374.0
2366470,foot prints in the snow leading up to the trees and the mountain of snow,8,4,4,0,1,"['slope in the snow leading up to the trees and the mountain of snow', 'foot prints in the snow leading up to the hill and the mountain of snow', 'foot prints in the snow leading up to the slope and the mountain of snow', 'trees in the snow leading up to the foot prints and the mountain of snow', 'foot prints in the snow leading up to the trees and the slope of snow']",0.0,73.0,499.0,260.0
2366474,a rabbit eating a banana on the floor with an ear and an eye,8,5,3,0,2,"['a floor eating a banana on the rabbit with an ear and an eye', 'a rabbit eating a eye on the floor with an ear and an banana', 'a rabbit eating a ear on the floor with an banana and an eye', 'a eye eating a banana on the floor with an ear and an rabbit', 'a banana eating a rabbit on the floor with an ear and an eye']",2.0,0.0,497.0,332.0
2366486,"trees behind people, lake behind trees, and an object behind the ground",8,5,3,0,2,"['dumpster behind people, lake behind dumpster, and an object behind the ground', 'beach behind people, lake behind trees, and an object behind the ground', 'trees behind people, dumpster behind trees, and an object behind the ground', 'trees behind object, lake behind trees, and an people behind the ground', 'sand behind people, lake behind trees, and an object behind the ground']",1.0,1.0,498.0,330.0
2366510,"a wait sign with a button and an arrow on it, and a pole",8,5,3,0,2,"['a arrow sign with a button and an wait on it, and a pole', 'a button sign with a wait and an arrow on it, and a pole', 'a wait sign with a signal and an arrow on it, and a pole', 'a wait button with a sign and an arrow on it, and a pole', 'a wait pole with a button and an arrow on it, and a sign']",65.0,13.0,269.0,319.0
2366612,"beans with a taco, and a chip and bun in a bowel",8,5,3,0,2,"['taco with a beans, and a chip and bun in a bowel', 'bowel with a taco, and a chip and bun in a beans', 'chip with a taco, and a beans and bun in a bowel', 'bun with a taco, and a chip and beans in a bowel', 'beans with a taco, and a chip and bowel in a bun']",1.0,4.0,327.0,370.0
2366650,"a baby with a diaper and another toothbrush, and a knob behind the baby",8,5,3,0,2,"['a baby with a diaper and another knob, and a toothbrush behind the baby', 'a baby with a knob and another toothbrush, and a diaper behind the baby', 'a toothbrush with a diaper and another baby, and a knob behind the toothbrush', 'a baby with a diaper and another toothbrush, and a knob on the baby', 'a knob with a diaper and another toothbrush, and a baby behind the knob']",305.0,30.0,180.0,290.0
2366853,"a toothbrush being held in a hand, and a boy with a hand on his shirt",8,5,3,0,2,"['a shirt being held in a hand, and a boy with a hand on his toothbrush', 'a toothbrush being held in a shirt, and a boy with a shirt on his hand', 'a hand being held in a toothbrush, and a boy with a toothbrush on his shirt', 'a boy being held in a hand, and a toothbrush with a hand on his shirt', 'a toothbrush being held in a hand, and a shirt with a hand on his boy']",53.0,116.0,226.0,320.0
2368211,"a circle on top of a train, with smoke on top of another train in the background and a fence behind it",8,5,3,0,2,"['a circle on top of a fence, with smoke on top of another train in the background and a train behind it', 'a circle on top of a smoke, with train on top of another smoke in the background and a fence behind it', 'a circle behind top of a train, with smoke on top of another train in the background and a fence on it', 'a fence on top of a train, with smoke on top of another train in the background and a circle behind it', 'a smoke on top of a train, with circle on top of another train in the background and a fence behind it']",0.0,1.0,473.0,375.0
2368374,"dirt on a line in the street, and a hose on the road",8,5,3,0,2,"['dirt on a road in the street, and a hose on the line', 'hose on a line in the street, and a dirt on the road', 'dirt on a line in the street, and a road on the hose', 'dirt on a line in the hose, and a street on the road', 'road on a line in the street, and a hose on the dirt']",0.0,232.0,331.0,170.0
2368711,"a boy sitting on a stool with his pants and glasses, and cabinets above him",8,5,3,0,2,"['a stool sitting on a boy with his pants and glasses, and cabinets above him', 'a boy sitting on a stool with his pants and glasses, and cabinets behind him', 'a glasses sitting on a stool with his pants and boy, and cabinets above him', 'a pants sitting on a stool with his boy and glasses, and cabinets above him', 'a boy sitting on a cabinets with his pants and glasses, and stool above him']",67.0,2.0,211.0,361.0
2368746,a cat is on top of the remote with its whiskers and tail on the couch.,8,5,3,0,2,"['a remote is on top of the cat with its whiskers and tail on the couch.', 'a cat is on top of the remote with its couch and tail on the whiskers.', 'a cat is on top of the stripes with its whiskers and tail on the couch.', 'a cat is on top of the remote with its stripes and tail on the couch.', 'a couch is on top of the remote with its whiskers and tail on the cat.']",0.0,1.0,477.0,373.0
2368798,the girl has skiis on her feet and the snow is on the ground.,8,5,3,0,2,"['the ground has skiis on her feet and the snow is on the girl.', 'the feet has skiis on her girl and the snow is on the ground.', 'the girl has skiis on her ground and the snow is on the feet.', 'the girl has ground on her feet and the snow is on the skiis.', 'the skiis has girl on her feet and the snow is on the ground.']",3.0,2.0,494.0,280.0
2368844,there is a bar in the kitchen with shelves on it and a stool by the bar,8,5,3,0,2,"['there is a bar in the shelves with kitchen on it and a stool by the bar', 'there is a bar in the stool with shelves on it and a kitchen by the bar', 'there is a kitchen in the bar with shelves on it and a stool by the kitchen', 'there is a shelves in the kitchen with bar on it and a stool by the shelves', 'there is a stool in the kitchen with shelves on it and a bar by the stool']",3.0,0.0,496.0,321.0
2368892,"a bed next to a mirror, with a reflexion in the mirror and blinds on the wall",8,5,3,0,2,"['a bed next to a mirror, with a wall in the mirror and blinds on the reflexion', 'a wall next to a mirror, with a reflexion in the mirror and blinds on the bed', 'a bed next to a blinds, with a reflexion in the mirror and mirror on the wall', 'a bed next to a mirror, with a reflexion in the mirror and wall on the blinds', 'a bed next to a wall, with a reflexion in the wall and blinds on the mirror']",2.0,1.0,372.0,497.0
2368968,smoke coming from an object and another smoke rising in a city with people,8,5,3,0,2,"['city coming from an object and another city rising in a smoke with people', 'object coming from an smoke and another object rising in a city with people', 'people coming from an object and another people rising in a city with smoke', 'smoke coming from an people and another smoke rising in a city with object', 'smoke coming from an city and another smoke rising in a object with people']",7.0,0.0,491.0,315.0
2369086,"a shadow of a lifeguard, a lifeguard in a tower, and canopies over a chair",8,5,3,0,2,"['a chair of a lifeguard, a lifeguard in a tower, and canopies over a shadow', 'a shadow of a lifeguard, a lifeguard in a tower, and chair over a canopies', 'a shadow of a lifeguard, a lifeguard over a tower, and canopies in a chair', 'a canopies of a lifeguard, a lifeguard in a tower, and shadow over a chair', 'a shadow of a chair, a lifeguard in a tower, and canopies over a lifeguard']",77.0,33.0,406.0,447.0
2369447,"a bed with a frame against a wall, and a pillow and pillows on the bed",8,5,3,0,2,"['a pillows with a frame against a wall, and a pillow and bed on the pillows', 'a pillow with a frame against a wall, and a bed and pillows on the pillow', 'a bed with a pillow against a wall, and a frame and frames on the bed', 'a wall with a frame against a bed, and a pillow and pillows on the wall', 'a frame with a bed against a wall, and a pillow and pillows on the frame']",119.0,2.0,380.0,319.0
2369784,"a person making pizza on a table, with a spoon and a cardboard",8,5,3,0,2,"['a spoon making pizza on a table, with a person and a cardboard', 'a person making spoon on a table, with a pizza and a cardboard', 'a person making cardboard on a table, with a spoon and a pizza', 'a person making table on a pizza, with a spoon and a cardboard', 'a cardboard making pizza on a table, with a spoon and a person']",2.0,0.0,498.0,331.0
2369812,"the front of the bus, the bus in the street, and the pole on top of the station",8,5,3,0,2,"['the bus of the front, the front in the street, and the pole on top of the station', 'the front of the pole, the pole in the street, and the bus on top of the station', 'the front of the station, the station in the street, and the pole on top of the bus', 'the pole of the bus, the bus in the street, and the front on top of the station', 'the front of the street, the bus in the bus, and the pole on top of the station']",138.0,6.0,271.0,174.0
2369853,a boy sitting in a chair with a frog on it. a tray is in the child's hand.,8,5,3,0,2,"[""a boy sitting in a tray with a frog on it. a chair is in the child's hand."", ""a frog sitting in a chair with a boy on it. a tray is in the child's hand."", ""a boy sitting in a child's hand with a frog on it. a tray is in the chair."", ""a boy sitting in a frog with a chair on it. a tray is in the child's hand."", ""a boy sitting in a chair with a tray on it. a frog is in the child's hand.""]",0.0,34.0,373.0,456.0
2369904,"plaque in cabinet, plant on top of cabinet",8,4,4,0,1,"['plant in cabinet, plaque on top of cabinet', 'cabinet in plaque, plant on top of plaque', 'plaque on top of cabinet, plant in cabon top ofet', 'plaque in plant, cabinet on top of plant', 'plaque with a cabwith aet, plant on top of cabwith aet']",28.0,143.0,267.0,350.0
2369965,a rack with a microwave on it that has a display and knobs,8,4,4,0,1,"['a rack with a microwave on it that has a toaster oven and knobs', 'a rack with a microwave on it that has a display and toaster oven', 'a rack with a microwave on it that has a clock and knobs', 'a toaster oven with a microwave on it that has a display and knobs', 'a clock with a microwave on it that has a display and knobs']",29.0,104.0,275.0,160.0
2370010,towel on oven door; oven in kitchen; microwave in kitchen,8,5,3,0,2,"['kitchen on oven door; oven in towel; microwave in kitchen', 'towel on microwave door; microwave in kitchen; oven in kitchen', 'microwave on oven door; oven in kitchen; towel in kitchen', 'towel on hand towel door; hand towel in kitchen; microwave in kitchen', 'towel on oven hand towel; oven in kitchen; microwave in kitchen']",1.0,1.0,477.0,318.0
2370064,"a glove with snow on it, a man wearing a helmet, and a snowboard on the snow",8,5,3,0,2,"['a snow with glove on it, a man wearing a helmet, and a snowboard on the snow', 'a glove with helmet on it, a man wearing a snow, and a helmetboard on the snow', 'a man with snow on it, a glove wearing a helmet, and a snowboard on the snow', 'a glove with snowboard on it, a man wearing a helmet, and a snowboardboard on the snowboard', 'a glove with man on it, a snow wearing a helmet, and a manboard on the man']",47.0,19.0,386.0,341.0
2370306,a man in a uniform and grass under some players who are wearing shirts,8,5,3,0,2,"['a grass in a uniform and man under some players who are wearing shirts', 'a man in a uniform and shirt under some players who are wearing grasss', 'a players in a uniform and grass under some man who are wearing shirts', 'a shirt in a uniform and grass under some players who are wearing mans', 'a man in a players and grass under some uniform who are wearing shirts']",0.0,94.0,497.0,304.0
2370319,a patch of dirt in a field with an elephant walking on the ground,8,5,3,0,2,"['a patch of dirt in a elephant with an field walking on the ground', 'a patch of dirt under a field with an elephant walking on the ground', 'a elephant of dirt in a field with an patch walking on the ground', 'a patch of dirt in a field with an ground walking on the elephant', 'a patch of elephant in a field with an dirt walking on the ground']",0.0,1.0,331.0,498.0
2370392,"a tarp hanging on a fence, a kid behind the fence, and another kid wearing a mitt",8,5,3,0,2,"['a tarp hanging on a kid, a fence behind the kid, and another fence wearing a mitt', 'a tarp hanging on a mitt, a kid behind the fence, and another kid wearing a fence', 'a kid hanging on a fence, a tarp behind the fence, and another kid wearing a mitt', 'a tarp hanging on a fence, a kid wearing the fence, and another kid behind a mitt', 'a mitt hanging on a fence, a kid behind the fence, and another kid wearing a tarp']",0.0,10.0,499.0,300.0
2370680,a woman in water on a beach with a man in trunks.,8,5,3,0,2,"['a woman in girl on a beach with a man in trunks.', 'a trunks in water on a beach with a man in woman.', 'a woman in water on a beach with a man in girl.', 'a man in water on a beach with a woman in trunks.', 'a wogirl in water on a beach with a girl in trunks.']",77.0,147.0,184.0,351.0
2370717,a man with arms and shoes and a guy wearing sneakers,8,5,3,0,2,"['a man with sneakers and shoes and a guy wearing arms', 'a sneakers with arms and shoes and a guy wearing man', 'a man with guy and shoes and a arms wearing sneakers', 'a man with shoes and arms and a guy wearing sneakers', 'a shoes with arms and man and a guy wearing sneakers']",57.0,4.0,224.0,292.0
