image_id,caption,n,n_objects,n_relations,n_attributes,n_connected_components,hard_negs,x,y,width,height
2360718,"hello kitty with a bow in her hair, and a baby wearing a hat",8,5,3,0,2,"['hello kitty with a baby in her hair, and a bow wearing a hat', 'baby with a bow in her hair, and a hello kitty wearing a hat', 'hello kitty with a hat in her hair, and a baby wearing a bow', 'hello kitty with a bow in her baby, and a hair wearing a hat', 'hello kitty with a bow in her hat, and a baby wearing a hair']",12.0,12.0,317.0,395.0
2360820,"the foot of the driver, the ear of the elephant, and the man riding the elephant",8,5,3,0,2,"['the elephant of the driver, the ear of the foot, and the man riding the elephant', 'the foot of the driver, the elephant of the ear, and the man riding the elephant', 'the foot of the elephant, the ear of the driver, and the man riding the elephant', 'the ear of the driver, the foot of the elephant, and the man riding the elephant', 'the driver of the foot, the ear of the elephant, and the man riding the elephant']",36.0,79.0,239.0,191.0
2360841,"a grout line in a building, a window with a shade, and a fire escape on the side of the building",8,5,3,0,2,"['a grout window in a building, a line with a shade, and a fire escape on the side of the building', 'a grout shade in a building, a window with a line, and a fire escape on the side of the building', 'a grout line in a building, a fire escape with a shade, and a window on the side of the building', 'a grout fire escape in a building, a window with a shade, and a line on the side of the building', 'a grout line in a fire escape, a window with a shade, and a building on the side of the fire escape']",1.0,5.0,498.0,367.0
2360886,"a rock on the floor with letters on it, and a mirror on the walls",8,5,3,0,2,"['a mirror on the floor with letters on it, and a rock on the walls', 'a rock on the floor with mirror on it, and a letters on the walls', 'a walls on the floor with letters on it, and a mirror on the rock', 'a rock on the floor with letters on it, and a walls on the mirror', 'a rock on the floor with walls on it, and a mirror on the letters']",60.0,0.0,438.0,332.0
2360899,"a cat resting on another mat, and a running shoe and shoe lying on top of the another mat",8,5,3,0,2,"['a mat resting on another cat, and a running shoe and shoe lying on top of the another mat', 'a cat resting on another shoe, and a running mat and mat lying on top of the another shoe', 'a running shoe resting on another mat, and a cat and shoe lying on top of the another mat', 'a cat resting on another running shoe, and a mat and shoe lying on top of the another running shoe', 'a shoe resting on another mat, and a running cat and shoe lying on top of the another mat']",45.0,0.0,438.0,331.0
2360906,"a spot on the road and a woman with a cloth, and a man on the road",8,5,3,0,2,"['a spot on the road and a man with a cloth, and a woman on the road', 'a spot on the woman and a road with a cloth, and a man on the woman', 'a road on the spot and a woman with a cloth, and a man on the spot', 'a spot on the man and a woroad with a cloth, and a road on the man', 'a spot on the cloth and a woman with a road, and a man on the cloth']",1.0,97.0,499.0,278.0
2361233,"a pole supporting a bench, with a cat wagging its tail next to it",8,5,3,0,2,"['a pole supporting a cat, with a bench wagging its tail next to it', 'a bench supporting a pole, with a cat wagging its tail next to it', 'a pole supporting a tail, with a cat wagging its bench next to it', 'a tail supporting a bench, with a cat wagging its pole next to it', 'a cat supporting a bench, with a pole wagging its tail next to it']",11.0,16.0,323.0,477.0
2361263,"the back of a giraffe, a giraffe next to another giraffe, and a rope holding a plant",8,5,3,0,2,"['the rope of a giraffe, a giraffe next to another giraffe, and a back holding a plant', 'the back of a giraffe, a giraffe next to another giraffe, and a plant holding a rope', 'the back of a rope, a rope next to another rope, and a giraffe holding a plant', 'the back of a plant, a plant next to another plant, and a rope holding a giraffe', 'the plant of a giraffe, a giraffe next to another giraffe, and a rope holding a back']",0.0,31.0,338.0,302.0
2361625,a couch with a rattan arm and a rug with a circle on it,8,5,2,1,3,"['a couch on a rattan arm and a rug with a circle with it', 'a couch with a rattan rug and a arm with a circle on it', 'a circle with a rattan arm and a rug with a couch on it', 'a rug with a rattan arm and a couch with a circle on it', 'a couch with a rattan circle and a rug with a arm on it']",14.0,182.0,396.0,304.0
2361647,"a character playing an instrument on a bus that is parked in a parking spot, and there is a window on the side of the bus",8,5,3,0,2,"['a character playing an parking spot on a bus that is parked in a instrument, and there is a window on the side of the bus', 'a hotdog playing an instrument on a bus that is parked in a parking spot, and there is a window on the side of the bus', 'a parking spot playing an instrument on a bus that is parked in a character, and there is a window on the side of the bus', 'a character playing an instrument on a hotdog that is parked in a parking spot, and there is a window on the side of the hotdog', 'a character playing an hotdog on a bus that is parked in a parking spot, and there is a window on the side of the bus']",9.0,66.0,441.0,252.0
2361726,a girl with a phone in her finger and a nail in her eye,8,5,3,0,2,"['a girl with a phone in her finger and a nail in her mobile', 'a nail with a phone in her finger and a girl in her eye', 'a phone with a girl in her finger and a nail in her eye', 'a girl with a eye in her finger and a nail in her phone', 'a girl with a phone in her eye and a nail in her finger']",17.0,59.0,307.0,440.0
2361736,a man with a sock on his head and a tennis court behind him,8,5,3,0,2,"['a man with a court on his head and a tennis sock behind him', 'a man with a sock on his tennis court and a head behind him', 'a man with a sock on his court and a tennis head behind him', 'a sock with a man on his head and a tennis court behind him', 'a court with a sock on his head and a tennis man behind him']",1.0,13.0,398.0,485.0
2361871,"a person falling off a board into water, with a splash behind them and a wave in the water",8,5,3,0,2,"['a person falling off a spray into water, with a splash behind them and a wave in the water', 'a person falling off a water into board, with a splash behind them and a wave in the board', 'a water falling off a board into person, with a splash behind them and a wave in the person', 'a splash falling off a board into water, with a person behind them and a wave in the water', 'a wave falling off a board into water, with a splash behind them and a person in the water']",9.0,17.0,290.0,160.0
2361892,a lady holding a hat in her hand with the sky over the water,8,5,3,0,2,"['a hat holding a lady in her hand with the sky over the water', 'a water holding a hat in her hand with the sky over the lady', 'a lady holding a sky in her hand with the hat over the water', 'a sky holding a hat in her hand with the lady over the water', 'a lady holding a water in her hand with the sky over the hat']",1.0,0.0,498.0,329.0
2361981,the ground has no-grass and there is a tree behind the grass with its trunk showing,8,5,3,0,2,"['the ground has vegetation and there is a tree behind the grass with its trunk showing', 'the ground has no-tree and there is a grass behind the tree with its trunk showing', 'the ground has no-grass and there is a tree behind the grass with its log showing', 'the ground has trunk and there is a tree behind the grass with its no-grass showing', 'the log has no-grass and there is a tree behind the grass with its trunk showing']",2.0,0.0,345.0,331.0
2362094,"a picture on a toilet, a cup on the seat, and the inside of the toilet",8,5,3,0,2,"['a picture on a toilet, a seat on the cup, and the inside of the toilet', 'a seat on a toilet, a cup on the picture, and the inside of the toilet', 'a toilet on a picture, a cup on the seat, and the inside of the toilet', 'a picture on a toilet, a inside on the seat, and the cup of the toilet', 'a picture on a cup, a toilet on the seat, and the inside of the cup']",2.0,18.0,492.0,326.0
2362101,"a controller in a hand, and a man wearing jeans. the hand belongs to the another man",8,5,3,0,2,"['a controller wearing a hand, and a man wearwearingg jeans. the hand belongs to the another man', 'a controller in a man, and a hand wearing jeans. the man belongs to the another hand', 'a controller in a jeans, and a man wearing hand. the jeans belongs to the another man', 'a jeans in a hand, and a man wearing controller. the hand belongs to the another man', 'a man in a hand, and a controller wearing jeans. the hand belongs to the another controller']",124.0,4.0,310.0,363.0
2362183,"a plate with a shadow underneath it, and a piece of paper with donuts on top of it",8,4,4,0,1,"['a plate with a shadow underneath it, and a piece of bowl with donuts on top of it', 'a plate with a bowl underneath it, and a piece of paper with donuts on top of it', 'a plate with a donuts underneath it, and a piece of paper with shadow on top of it', 'a donuts with a shadow underneath it, and a piece of paper with plate on top of it', 'a paper with a shadow underneath it, and a piece of plate with donuts on top of it']",14.0,238.0,299.0,258.0
2362218,"a man wearing shoes and a racket with a logo, and an ear on the man",8,5,3,0,2,"['a man wearing shoes and a logo with a racket, and an ear on the man', 'a shoes wearing man and a racket with a logo, and an ear on the shoes', 'a ear wmaning shoes and a racket with a logo, and an ear on the ear', 'a racket wearing shoes and a man with a logo, and an ear on the racket', 'a logo wearing shoes and a racket with a man, and an ear on the logo']",47.0,51.0,242.0,368.0
2362327,there is grass on the field and a home base. the player is swinging a bat.,8,5,3,0,2,"['there is bat on the field and a home base. the player is swinging a grass.', 'there is grass on the field and a home base. the bat is swinging a player.', 'there is grass on the bat and a home base. the player is swinging a field.', 'there is grass on the field and a player. the home base is swinging a bat.', 'there is grass on the player and a home base. the field is swinging a bat.']",2.0,1.0,498.0,373.0
2362354,"a roof behind a tower with a clock, and the hands on the clock",8,4,4,0,1,"['a roof behind a tower with a hands, and the clock on the hands', 'a hands behind a tower with a clock, and the roof on the clock', 'a roof on a tower with a clock, and the hands behind the clock', 'a clock behind a tower with a roof, and the hands on the clock', 'a roof behind a hands with a clock, and the tower on the clock']",26.0,124.0,307.0,376.0
2362436,"a pizza on a plate, a chair by a table, and a glass on the table",8,5,3,0,2,"['a pizza by a plate, a chair on a table, and a glass by the table', 'a pizza on a plate, a chair by a glass, and a table on the glass', 'a glass on a plate, a chair by a table, and a pizza on the table', 'a table on a plate, a chair by a pizza, and a glass on the pizza', 'a chair on a plate, a pizza by a table, and a glass on the table']",2.0,0.0,496.0,374.0
2362531,"a baseball player with a bat and a glove, wearing pants and standing in front of a fence",8,5,3,0,2,"['a baseball player with a bat and a glove, wearing fence and standing in front of a pants', 'a baseball player with a pants and a glove, wearing bat and standing in front of a fence', 'a baseball player with a bat and a pants, wearing glove and standing in front of a fence', 'a fence with a bat and a glove, wearing pants and standing in front of a baseball player', 'a baseball player with a fence and a glove, wearing pants and standing in front of a bat']",1.0,0.0,408.0,331.0
2362611,"a sign that says ""lettering"" with a tree behind it and the sky behind that",8,4,4,0,1,"['a sign that says ""lettering"" with a tree on it and the sky behind that', 'a sign that says ""tree"" with a lettering behind it and the sky behind that', 'a sign that says ""sky"" with a tree behind it and the lettering behind that', 'a tree that says ""lettering"" with a sign behind it and the sky behind that', 'a sky that says ""lettering"" with a tree behind it and the sign behind that']",17.0,15.0,474.0,338.0
2362639,"an elephant with an ear and tusks in the grass, and other elephants in the distance",8,5,2,1,3,"['an elephant with an ear and elephants in the grass, and other tusks in the distance', 'an grass with an ear and tusks in the elephant, and other grasss in the distance', 'an elephant with an grass and tusks in the ear, and other elephants in the distance', 'an tusks with an ear and elephant in the grass, and other tuskss in the distance', 'an elephant with an ear and tusks in the elephants, and other grass in the distance']",0.0,73.0,421.0,259.0
2362697,a woman sitting at a table with food on it. there is a plate full of food.,8,4,3,1,1,"['a table sitting at a woman with food on it. there is a plate full of food.', 'a woman sitting at a table with food on it. there is a person full of food.', 'a plate sitting at a table with food on it. there is a woman full of food.', 'a woman sitting at a food with table on it. there is a plate full of table.', 'a food sitting at a table with woman on it. there is a plate full of food.']",11.0,87.0,345.0,413.0
2362712,"a spectator behind a stand, a crowd watching a game, and a girl on top of the stand",8,5,3,0,2,"['a spectator on top of a stand, a crowd watching a game, and a girl behind the stand', 'a spectator behind a stand, a crowd on top of a game, and a girl watching the stand', 'a spectator watching a stand, a crowd behind a game, and a girl on top of the stand', 'a crowd behind a stand, a spectator watching a game, and a girl on top of the stand', 'a spectator behind a stand, a crowd watching a girl, and a game on top of the stand']",0.0,1.0,499.0,333.0
2362725,"a giraffe with ears looking for food, with light shining on it from the side, next to some cement",8,5,3,0,2,"['a boulder with ears looking for food, with light shining on it from the side, next to some cement', 'a giraffe with ears looking for cement, with light shining on it from the side, next to some food', 'a giraffe with ears looking for boulder, with light shining on it from the side, next to some cement', 'a giraffe with ears looking for food, with cement shining on it from the side, next to some light', 'a giraffe with ears looking for food, with boulder shining on it from the side, next to some cement']",2.0,0.0,271.0,395.0
2362734,"two hands holding forks, with a dessert on a plate",8,4,4,0,2,"['two hands holding forks, with a dessert on a fox', 'two plate holding forks, with a dessert on a hands', 'two hands being eaten offing forks, with a dessert on a plate', 'two dessert holding forks, with a hands on a plate', 'two fox holding forks, with a dessert on a plate']",27.0,12.0,466.0,361.0
2362766,"a person pressing a button, and a remote with a border that is pushing another button",8,5,3,0,2,"['a perspressing on a buttpressing, and a remote with a border that is pushing another button', 'a perspushing pressing a button, and a remote with a border that is on another buttpushing', 'a button pressing a person, and a remote with a border that is pushing another button', 'a person pressing a border, and a remote with a button that is pushing another border', 'a remote pressing a button, and a person with a border that is pushing another button']",223.0,109.0,275.0,222.0
2362813,a girl in a dress standing next to a bed with sheets on it and a boy sleeping on the bed,8,5,3,0,2,"['a bed in a dress standing next to a girl with sheets on it and a boy sleeping on the girl', 'a sheets in a dress standing next to a bed with girl on it and a boy sleeping on the bed', 'a girl sleeping on a dress standing next to a bed with sheets on it and a boy in the bed', 'a girl in a sheets standing next to a bed with dress on it and a boy sleeping on the bed', 'a girl in a boy standing next to a bed with sheets on it and a dress sleeping on the bed']",1.0,1.0,497.0,370.0
2362833,"a tree on the horizon, a plow in front of the tree, and a cow standing next to another cow",8,5,3,0,2,"['a tree on the cow, a plow in front of the tree, and a horizon standing next to another cow', 'a plow on the horizon, a tree in front of the plow, and a cow standing next to another cow', 'a tree on the plow, a horizon in front of the tree, and a cow standing next to another cow', 'a cow on the horizon, a plow in front of the cow, and a tree standing next to another cow', 'a tree on the horizon, a cow in front of the tree, and a plow standing next to another cow']",8.0,10.0,490.0,270.0
2362835,"an outlet hooked to a wall, and a table spread with a potato on it",8,5,3,0,2,"['an potato hooked to a wall, and a table spread with a outlet on it', 'an table hooked to a wall, and a outlet spread with a potato on it', 'an outlet hooked to a table, and a wall spread with a potato on it', 'an outlet hooked to a table spread, and a wall with a potato on it', 'an outlet hooked to a potato, and a table spread with a wall on it']",15.0,8.0,485.0,366.0
2362855,173 on a train that is on tracks and a building is behind the train,8,4,4,0,1,"['173 on a train that is on building and a tracks is behind the train', '173 behind a train that is on tracks and a building is on the train', '173 on a train that is on tracks and a building is under the train', 'tracks on a train that is on 173 and a building is behind the train', '173 under a train that is on tracks and a building is behind the train']",94.0,48.0,404.0,285.0
2362880,"a fire hydrant with vertical grooves and the sun, with a truck opposite the fire hydrant",8,4,3,1,1,"['a fire vertical with hydrant grooves and the sun, with a truck opposite the fire vertical', 'a fire hydrant with vertical truck and the sun, with a grooves opposite the fire hydrant', 'a fire hydrant opposite vertical grooves and the sun, with a truck with the fire hydrant', 'a fire hydrant with vertical grooves and the sun, with a truck in the fire hydrant', 'a truck with vertical grooves and the sun, with a fire hydrant opposite the truck']",44.0,65.0,286.0,433.0
2362896,"wood behind a controller with a button built into it, and a cross on another controller",8,5,3,0,2,"['wood behind a cbuilt intotroller with a buttbuilt into on it, and a cross built into another cbuilt intotroller', 'wood behind a cross with a button built into it, and a controller on another cross', 'cross behind a controller with a button built into it, and a wood on another controller', 'wood on a cbehindtroller with a buttbehind built into it, and a cross behind another cbehindtroller', 'controller behind a wood with a button built into it, and a cross on another wood']",7.0,287.0,360.0,211.0
2362926,"a sign hanging on a store that is selling books, and a bear with a neck",8,5,3,0,2,"['a sign hanging on a store that is selling neck, and a bear with a books', 'a bear hanging on a store that is selling books, and a sign with a neck', 'a sign hanging on a store that is selling bear, and a books with a neck', 'a sign selling a store that is hanging on books, and a bear with a neck', 'a neck hanging on a store that is selling books, and a bear with a sign']",0.0,4.0,497.0,367.0
2362955,a baseball field with a batter at homeplate and a fence behind him,8,4,4,0,1,"['a baseball field with a bbehindter at homeplate and a fence at him', 'a baseball field with a batter at homeplate and a fence on him', 'a baseball field with a fence at homeplate and a batter behind him', 'a fence with a batter at homeplate and a baseball field behind him', 'a baseball field with a batter at homeplate and a fence in front of him']",32.0,18.0,313.0,360.0
2363044,"a person with a head, wearing a jacket, and a sail in the sky",8,5,3,0,2,"['a sail with a head, wearing a jacket, and a person in the sky', 'a pershas with a head, wearing a jacket, and a sail in the sky', 'a sky with a head, wearing a jacket, and a sail in the person', 'a jacket with a head, wearing a person, and a sail in the sky', 'a person with a sky, wearing a jacket, and a sail in the head']",8.0,3.0,490.0,326.0
2363058,"a shoe with laces and a racket on top of grass, and a bag on top of grass",8,5,3,0,2,"['a shoe with grass and a racket on top of laces, and a bag on top of grass', 'a grass with laces and a racket on top of shoe, and a bag on top of grass', 'a shoe with laces and a racket on top of bag, and a grass on top of bag', 'a shoe with laces and a grass on top of racket, and a bag on top of grass', 'a bag with laces and a racket on top of grass, and a shoe on top of grass']",0.0,1.0,499.0,331.0
2363065,a toilet with flush buttons on the wall next to a hose,8,4,3,1,1,"['a toilet with flush hose on the wall next to a buttons', 'a toilet with flush buttbehinds on the wall next to a hose', 'a toilet with flush buttons on the hose next to a wall', 'a toilet with flush buttnext tos on the wall on a hose', 'a hose with flush buttons on the wall next to a toilet']",0.0,0.0,386.0,310.0
2363082,a woman with long hair holding a strap and wearing a shirt with stripes,8,5,2,1,3,"['a woman with long stripes holding a strap and wearing a shirt with hair', 'a strap with long hair holding a woman and wearing a shirt with stripes', 'a shirt with long hair holding a strap and wearing a woman with stripes', 'a woman with long shirt holding a strap and wearing a hair with stripes', 'a stripes with long hair holding a strap and wearing a shirt with woman']",124.0,1.0,230.0,311.0
2363113,"a fence under a tent cover with a calf behind it, and a boy walking across the grass",8,5,3,0,2,"['a fence under a tent cover with a calf behind it, and a grass walking across the boy', 'a fence under a tent cover with a calf walking across it, and a boy behind the grass', 'a boy under a tent cover with a calf behind it, and a fence walking across the grass', 'a fence under a boy with a calf behind it, and a tent cover walking across the grass', 'a fence walking across a tent cover with a calf behind it, and a boy under the grass']",0.0,15.0,498.0,359.0
2363138,"an object next to a can, with a word on the back of the can and a slice of the object",8,5,3,0,2,"['an object on back of a can, with a word on the back of the can and a slice of the object', 'an object next to a word, with a can on the back of the word and a slice of the object', 'an can next to a object, with a word on the back of the object and a slice of the can', 'an object next to a slice, with a word on the back of the slice and a can of the object', 'an word next to a can, with a object on the back of the can and a slice of the word']",29.0,6.0,442.0,392.0
2363168,"a person behind another person, with pants on, and another person standing on the snow",8,5,3,0,2,"['a person standing on another person, with pants on, and another person behind the snow', 'a person behind another person, with snow on, and another person standing on the pants', 'a pants behind another pants, with person on, and another pants standing on the snow', 'a persstanding on behind another persstanding on, with pants standing on, and another persstanding on standing standing on the snow', 'a snow behind another snow, with pants on, and another snow standing on the person']",260.0,17.0,224.0,228.0
2363198,"man by wall, chair behind court, jacket on chair",8,5,3,0,2,"['man by wall, jacket behind court, chair on jacket', 'man by chair, wall behind court, jacket on wall', 'man by wall, chair on court, jacket behind chair', 'man by jacket, chair behind court, wall on chair', 'man by wall, court behind chair, jacket on court']",137.0,0.0,356.0,208.0
2363230,"a mural of train tracks with a train on it, and houses that are built into the mountains.",8,5,3,0,2,"['a mural of houses tracks with a houses on it, and train that are built into the mountains.', 'a mountains of train tracks with a train on it, and houses that are built into the mural.', 'a houses of train tracks with a train on it, and mural that are built into the mountains.', 'a mural of mountains tracks with a mountains on it, and houses that are built into the train.', 'a train of mural tracks with a mural on it, and houses that are built into the mountains.']",32.0,0.0,293.0,297.0
2363264,a woman with an umbrella in her hand and a face on the pavement,8,5,3,0,2,"['a umbrella with an woman in her hand and a face on the pavement', 'a face with an umbrella in her hand and a woman on the pavement', 'a woman with an face in her hand and a umbrella on the pavement', 'a woman with an umbrella in her face and a hand on the pavement', 'a woman with an pavement in her hand and a face on the umbrella']",4.0,62.0,495.0,382.0
2363339,a rock next to a bear at a zoo and another bear on grass,8,5,3,0,2,"['a grass next to a bear at a zoo and another bear on rock', 'a rock next to a grass at a zoo and another grass on bear', 'a rock next to a zoo at a bear and another zoo on grass', 'a rock next to a bear at a grass and another bear on zoo', 'a bear next to a rock at a zoo and another rock on grass']",7.0,4.0,397.0,492.0
2363371,"a sign with the letter ""st"" on it and surrounded by a power line that is attached to a pole",8,5,3,0,2,"['a pole with the letter ""st"" on it and surrounded by a power line that is attached to a sign', 'a sign with the letter ""power line"" on it and surrounded by a st that is attached to a pole', 'a sign with the letter ""pole"" on it and surrounded by a power line that is attached to a st', 'a sign with the power line ""st"" on it and surrounded by a letter that is attached to a pole', 'a sign with the pole ""st"" on it and surrounded by a power line that is attached to a letter']",0.0,0.0,446.0,373.0
